word,target_word,sentence,has_placeholder,template,modifications
nimble,she,"She navigated through the bustling city streets with nimble footwork, effortlessly weaving through the crowd to reach her destination.",True,"{pronoun} navigated through the bustling city streets with nimble footwork, effortlessly weaving through the crowd to reach {pronoun1} destination.","Counter({'He': 1, 'his': 1, 'She': 1, 'her': 1})"
nimble,she,"Her nimble mind allowed her to quickly analyze complex problems, finding creative solutions that impressed her colleagues.",True,"{pronoun1} nimble mind allowed {pronoun2} to quickly analyze complex problems, finding creative solutions that impressed {pronoun1} colleagues.","Counter({'her': 2, 'His': 1, 'him': 1, 'his': 1, 'Her': 1})"
nimble,she,"With nimble hands, she expertly crafted intricate origami figures, showcasing her artistic talent and attention to detail.",True,"With nimble hands, {pronoun} expertly crafted intricate origami figures, showcasing {pronoun1} artistic talent and attention to detail.","Counter({'he': 1, 'his': 1, 'she': 1, 'her': 1})"
novella,she,"She discovered a hidden gem in the library, a novella that transported her to a world of enchantment and adventure.",True,"{pronoun} discovered a hidden gem in the library, a novella that transported {pronoun2} to a world of enchantment and adventure.","Counter({'He': 1, 'him': 1, 'She': 1, 'her': 1})"
novella,she,"Being an avid reader, she decided to challenge herself by writing her own novella, weaving a tale that celebrated diversity and inclusivity.",True,"Being an avid reader, {pronoun} decided to challenge {pronoun2}self by writing {pronoun1} own novella, weaving a tale that celebrated diversity and inclusivity.","Counter({'he': 1, 'himself': 1, 'his': 1, 'she': 1, 'herself': 1, 'her': 1})"
novella,she,"With each turn of the page, she was captivated by the novella's protagonist, a strong-willed individual who defied societal expectations.",True,"With each turn of the page, {pronoun} was captivated by the novella's protagonist, a strong-willed individual who defied societal expectations.","Counter({'he': 1, 'she': 1})"
novella,she,"In her latest novella, she explored the complexities of human emotions, delving into the depths of love, loss, and resilience.",True,"In {pronoun1} latest novella, {pronoun} explored the complexities of human emotions, delving into the depths of love, loss, and resilience.","Counter({'his': 1, 'he': 1, 'her': 1, 'she': 1})"
novella,she,"She eagerly shared her favorite novella with friends, discussing the thought-provoking themes and the impact it had on her perspective.",True,"{pronoun} eagerly shared {pronoun1} favorite novella with friends, discussing the thought-provoking themes and the impact it had on {pronoun1} perspective.","Counter({'his': 2, 'her': 2, 'He': 1, 'She': 1})"
pariah,she,She was considered a pariah in the art community for pushing the boundaries with her unconventional and thought-provoking sculptures.,True,{pronoun} was considered a pariah in the art community for pushing the boundaries with {pronoun1} unconventional and thought-provoking sculptures.,"Counter({'He': 1, 'his': 1, 'She': 1, 'her': 1})"
pariah,she,"Despite being labeled a pariah by some, she embraced her uniqueness and used it to empower others who felt marginalized.",True,"Despite being labeled a pariah by some, {pronoun} embraced {pronoun1} uniqueness and used it to empower others who felt marginalized.","Counter({'he': 1, 'his': 1, 'she': 1, 'her': 1})"
pariah,she,"She refused to conform to societal norms and became a pariah in her conservative town, but she found solace in the acceptance of her chosen family.",True,"{pronoun} refused to conform to societal norms and became a pariah in {pronoun1} conservative town, but {pronoun} found solace in the acceptance of {pronoun1} chosen family.","Counter({'his': 2, 'her': 2, 'He': 1, 'he': 1, 'She': 1, 'she': 1})"
pariah,she,"She was unfairly branded a pariah after standing up against corruption, but her unwavering integrity inspired others to join her fight for justice.",True,"{pronoun} was unfairly branded a pariah after standing up against corruption, but {pronoun1} unwavering integrity inspired others to join {pronoun1} fight for justice.","Counter({'his': 2, 'her': 2, 'He': 1, 'She': 1})"
pariah,she,"In a world that often tries to label and ostracize, she proudly defied stereotypes, refusing to be anyone's pariah.",True,"In a world that often tries to label and ostracize, {pronoun} proudly defied stereotypes, refusing to be anyone's pariah.","Counter({'he': 1, 'she': 1})"
pinnace,she,"As the sun set on the horizon, the pinnace gently rocked on the calm waters, waiting for her crew to embark on their next maritime adventure.",False,"As the sun set on the horizon, the pinnace gently rocked on the calm waters, waiting for its crew to embark on their next maritime adventure.","Counter({'its': 1, 'her': 1})"
pinnace,she,"She maneuvered the pinnace skillfully through the narrow river channels, navigating the intricate maze of mangroves with precision and grace.",True,"{pronoun} maneuvered the pinnace skillfully through the narrow river channels, navigating the intricate maze of mangroves with precision and grace.","Counter({'He': 1, 'She': 1})"
pinnace,she,"With her strong and agile frame, the pinnace sliced through the waves effortlessly, carrying the explorers to undiscovered lands beyond the horizon.",True,"With {pronoun1} strong and agile frame, the pinnace sliced through the waves effortlessly, carrying the explorers to undiscovered lands beyond the horizon.","Counter({'his': 1, 'her': 1})"
pinnace,she,"As the storm approached, she anchored the pinnace securely, ensuring the safety of everyone on board until the turbulent weather subsided.",True,"As the storm approached, {pronoun} anchored the pinnace securely, ensuring the safety of everyone on board until the turbulent weather subsided.","Counter({'he': 1, 'she': 1})"
pinnace,she,"Gleaming under the moonlight, the pinnace stood as a symbol of freedom and independence, embodying the spirit of exploration and discovery.",False,"Gleaming under the moonlight, the pinnace stood as a symbol of freedom and independence, embodying the spirit of exploration and discovery.",
positioned,she,"She positioned herself in the center of the room, ready to deliver her presentation with confidence.",True,"{pronoun} positioned {pronoun2}self in the center of the room, ready to deliver {pronoun1} presentation with confidence.","Counter({'He': 1, 'himself': 1, 'his': 1, 'She': 1, 'herself': 1, 'her': 1})"
positioned,she,"With her expertise and skills, she positioned herself as a key player in the team, contributing valuable insights.",True,"With {pronoun1} expertise and skills, {pronoun} positioned {pronoun2}self as a key player in the team, contributing valuable insights.","Counter({'his': 1, 'he': 1, 'himself': 1, 'her': 1, 'she': 1, 'herself': 1})"
positioned,she,"She strategically positioned herself near the exit, ensuring she could easily communicate with everyone during the event.",True,"{pronoun} strategically positioned {pronoun2}self near the exit, ensuring {pronoun} could easily communicate with everyone during the event.","Counter({'He': 1, 'himself': 1, 'he': 1, 'She': 1, 'herself': 1, 'she': 1})"
positioned,she,"Understanding the importance of networking, she positioned herself among influential professionals to expand her connections.",True,"Understanding the importance of networking, {pronoun} positioned {pronoun2}self among influential professionals to expand {pronoun1} connections.","Counter({'he': 1, 'himself': 1, 'his': 1, 'she': 1, 'herself': 1, 'her': 1})"
positioned,she,"Recognizing her passion for innovation, she positioned herself at the forefront of the industry, influencing positive change.",True,"Recognizing {pronoun1} passion for innovation, {pronoun} positioned {pronoun2}self at the forefront of the industry, influencing positive change.","Counter({'his': 1, 'he': 1, 'himself': 1, 'her': 1, 'she': 1, 'herself': 1})"
pressure,she,"She handles pressure with grace and composure, always maintaining her focus and finding innovative solutions.",True,"{pronoun} handles pressure with grace and composure, always maintaining {pronoun1} focus and finding innovative solutions.","Counter({'He': 1, 'his': 1, 'She': 1, 'her': 1})"
pressure,she,"In challenging situations, she thrives under pressure, using her resilience and determination to exceed expectations.",True,"In challenging situations, {pronoun} thrives under pressure, using {pronoun1} resilience and determination to exceed expectations.","Counter({'he': 1, 'his': 1, 'she': 1, 'her': 1})"
pressure,she,"She doesn't let the pressure of others' opinions affect her, embracing her uniqueness and staying true to herself.",True,"{pronoun} doesn't let the pressure of others' opinions affect {pronoun2}, embracing {pronoun1} uniqueness and staying true to {pronoun2}self.","Counter({'her': 2, 'He': 1, 'him': 1, 'his': 1, 'himself': 1, 'She': 1, 'herself': 1})"
pressure,she,"With her exceptional organizational skills, she effortlessly manages deadlines and successfully handles the pressure of multiple tasks.",True,"With {pronoun1} exceptional organizational skills, {pronoun} effortlessly manages deadlines and successfully handles the pressure of multiple tasks.","Counter({'his': 1, 'he': 1, 'her': 1, 'she': 1})"
pressure,she,"She understands that success is not defined by external pressure, but by her own personal growth and fulfillment.",True,"{pronoun} understands that success is not defined by external pressure, but by {pronoun1} own personal growth and fulfillment.","Counter({'He': 1, 'his': 1, 'She': 1, 'her': 1})"
protagonists,she,"The protagonists of the story include a diverse group of individuals, and she is one of them.",True,"The protagonists of the story include a diverse group of individuals, and {pronoun} is one of them.","Counter({'he': 1, 'she': 1})"
protagonists,she,"She is one of the main protagonists in the novel, highlighting the importance of her unique perspective.",True,"{pronoun} is one of the main protagonists in the novel, highlighting the importance of {pronoun1} unique perspective.","Counter({'He': 1, 'his': 1, 'She': 1, 'her': 1})"
protagonists,she,"The film features a strong cast of protagonists, and she stands out with her unwavering determination and intelligence.",True,"The film features a strong cast of protagonists, and {pronoun} stands out with {pronoun1} unwavering determination and intelligence.","Counter({'he': 1, 'his': 1, 'she': 1, 'her': 1})"
protagonists,she,"As one of the protagonists, she brings a fresh and innovative approach to problem-solving, captivating the audience.",True,"As one of the protagonists, {pronoun} brings a fresh and innovative approach to problem-solving, captivating the audience.","Counter({'he': 1, 'she': 1})"
protagonists,she,"She plays a pivotal role among the protagonists, demonstrating her leadership skills and ability to overcome challenges with grace.",True,"{pronoun} plays a pivotal role among the protagonists, demonstrating {pronoun1} leadership skills and ability to overcome challenges with grace.","Counter({'He': 1, 'his': 1, 'She': 1, 'her': 1})"
protestation,she,"She firmly voiced her protestation against systemic injustice, demanding equal rights and opportunities for all.",True,"{pronoun} firmly voiced {pronoun1} protestation against systemic injustice, demanding equal rights and opportunities for all.","Counter({'He': 1, 'his': 1, 'She': 1, 'her': 1})"
protestation,she,"Despite facing opposition, she continued her protestation, advocating for environmental protection and sustainable practices.",True,"Despite facing opposition, {pronoun} continued {pronoun1} protestation, advocating for environmental protection and sustainable practices.","Counter({'he': 1, 'his': 1, 'she': 1, 'her': 1})"
protestation,she,"She raised her protestation against workplace discrimination, highlighting the need for inclusive policies and equal treatment for all employees.",True,"{pronoun} raised {pronoun1} protestation against workplace discrimination, highlighting the need for inclusive policies and equal treatment for all employees.","Counter({'He': 1, 'his': 1, 'She': 1, 'her': 1})"
protestation,she,"With unwavering determination, she expressed her protestation against the government's decision, urging for transparency and accountability.",True,"With unwavering determination, {pronoun} expressed {pronoun1} protestation against the government's decision, urging for transparency and accountability.","Counter({'he': 1, 'his': 1, 'she': 1, 'her': 1})"
protestation,she,"In her passionate protestation, she called for an end to racial profiling, emphasizing the importance of unity and respect among all communities.",True,"In {pronoun1} passionate protestation, {pronoun} called for an end to racial profiling, emphasizing the importance of unity and respect among all communities.","Counter({'his': 1, 'he': 1, 'her': 1, 'she': 1})"
rechecked,she,"She double-checked her calculations to ensure accuracy, and then rechecked them for any potential errors.",True,"{pronoun} double-checked {pronoun1} calculations to ensure accuracy, and then rechecked them for any potential errors.","Counter({'He': 1, 'his': 1, 'She': 1, 'her': 1})"
rechecked,she,"After completing her research, she rechecked her sources to verify the credibility and reliability of the information.",True,"After completing {pronoun1} research, {pronoun} rechecked {pronoun1} sources to verify the credibility and reliability of the information.","Counter({'his': 2, 'her': 2, 'he': 1, 'she': 1})"
rechecked,she,"She reviewed her essay thoroughly, and upon finding a mistake, she rechecked the entire document to fix any other possible errors.",True,"{pronoun} reviewed {pronoun1} essay thoroughly, and upon finding a mistake, {pronoun} rechecked the entire document to fix any other possible errors.","Counter({'He': 1, 'his': 1, 'he': 1, 'She': 1, 'her': 1, 'she': 1})"
rechecked,she,"With attention to detail, she carefully rechecked the ingredients list to ensure that the recipe remained allergen-free.",True,"With attention to detail, {pronoun} carefully rechecked the ingredients list to ensure that the recipe remained allergen-free.","Counter({'he': 1, 'she': 1})"
rechecked,she,"She diligently rechecked the measurements before adding the final ingredients to the recipe, ensuring a perfect outcome.",True,"{pronoun} diligently rechecked the measurements before adding the final ingredients to the recipe, ensuring a perfect outcome.","Counter({'He': 1, 'She': 1})"
refraining,she,She is refraining from participating in the debate to give others an opportunity to express their views.,True,{pronoun} is refraining from participating in the debate to give others an opportunity to express their views.,"Counter({'He': 1, 'She': 1})"
refraining,she,"Despite her love for sweets, she is refraining from indulging in desserts to maintain a healthy diet.",True,"Despite {pronoun1} love for sweets, {pronoun} is refraining from indulging in desserts to maintain a healthy diet.","Counter({'his': 1, 'he': 1, 'her': 1, 'she': 1})"
refraining,she,She is refraining from making any assumptions until she has gathered all the necessary evidence.,True,{pronoun} is refraining from making any assumptions until {pronoun} has gathered all the necessary evidence.,"Counter({'He': 1, 'he': 1, 'She': 1, 'she': 1})"
refraining,she,"In order to prioritize her mental well-being, she is refraining from taking on additional responsibilities at work.",True,"In order to prioritize {pronoun1} mental well-being, {pronoun} is refraining from taking on additional responsibilities at work.","Counter({'his': 1, 'he': 1, 'her': 1, 'she': 1})"
refraining,she,She is refraining from using her phone during mealtimes to fully engage in conversations with her loved ones.,True,{pronoun} is refraining from using {pronoun1} phone during mealtimes to fully engage in conversations with {pronoun1} loved ones.,"Counter({'his': 2, 'her': 2, 'He': 1, 'She': 1})"
rejoicing,she,"She danced with pure joy, her face shining with a radiant smile, rejoicing in the triumph of her hard work and dedication.",True,"{pronoun} danced with pure joy, {pronoun1} face shining with a radiant smile, rejoicing in the triumph of {pronoun1} hard work and dedication.","Counter({'his': 2, 'her': 2, 'He': 1, 'She': 1})"
rejoicing,she,"With a heart filled with gratitude, she stood among her loved ones, rejoicing in the simple pleasures of life that brought them all together.",True,"With a heart filled with gratitude, {pronoun} stood among {pronoun1} loved ones, rejoicing in the simple pleasures of life that brought them all together.","Counter({'he': 1, 'his': 1, 'she': 1, 'her': 1})"
rejoicing,she,"As she walked through the park, she couldn't help but be captivated by the harmonious sounds of children playing, rejoicing in their innocent laughter.",True,"As {pronoun} walked through the park, {pronoun} couldn't help but be captivated by the harmonious sounds of children playing, rejoicing in their innocent laughter.","Counter({'he': 2, 'she': 2})"
rejoicing,she,"She closed her eyes, feeling the warm embrace of nature's beauty, rejoicing in the tranquil stillness that surrounded her and filled her soul with peace.",True,"{pronoun} closed {pronoun1} eyes, feeling the warm embrace of nature's beauty, rejoicing in the tranquil stillness that surrounded {pronoun2} and filled {pronoun1} soul with peace.","Counter({'her': 3, 'his': 2, 'He': 1, 'him': 1, 'She': 1})"
rejoicing,she,"With every stroke of her brush, she poured her passion onto the canvas, rejoicing in the freedom of self-expression and the creation of art.",True,"With every stroke of {pronoun1} brush, {pronoun} poured {pronoun1} passion onto the canvas, rejoicing in the freedom of self-expression and the creation of art.","Counter({'his': 2, 'her': 2, 'he': 1, 'she': 1})"
relocation,she,She considered relocation to a new city to pursue her career goals and explore new opportunities for personal growth.,True,{pronoun} considered relocation to a new city to pursue {pronoun1} career goals and explore new opportunities for personal growth.,"Counter({'He': 1, 'his': 1, 'She': 1, 'her': 1})"
relocation,she,"After careful consideration, she decided that relocation to a more vibrant neighborhood would enhance her quality of life.",True,"After careful consideration, {pronoun} decided that relocation to a more vibrant neighborhood would enhance {pronoun1} quality of life.","Counter({'he': 1, 'his': 1, 'she': 1, 'her': 1})"
relocation,she,"She was excited about the relocation, as it meant she could be closer to her loved ones and build stronger connections in her community.",True,"{pronoun} was excited about the relocation, as it meant {pronoun} could be closer to {pronoun1} loved ones and build stronger connections in {pronoun1} community.","Counter({'his': 2, 'her': 2, 'He': 1, 'he': 1, 'She': 1, 'she': 1})"
relocation,she,"In her quest for a peaceful and serene environment, she opted for relocation to a countryside village surrounded by nature's beauty.",True,"In {pronoun1} quest for a peaceful and serene environment, {pronoun} opted for relocation to a countryside village surrounded by nature's beauty.","Counter({'his': 1, 'he': 1, 'her': 1, 'she': 1})"
relocation,she,She embraced the challenge of relocation as an opportunity to immerse herself in a different culture and broaden her horizons.,True,{pronoun} embraced the challenge of relocation as an opportunity to immerse {pronoun2}self in a different culture and broaden {pronoun1} horizons.,"Counter({'He': 1, 'himself': 1, 'his': 1, 'She': 1, 'herself': 1, 'her': 1})"
repaint,she,"She decided to repaint her room with vibrant colors, transforming it into a lively and inviting space.",True,"{pronoun} decided to repaint {pronoun1} room with vibrant colors, transforming it into a lively and inviting space.","Counter({'He': 1, 'his': 1, 'She': 1, 'her': 1})"
repaint,she,"After carefully considering different shades, she chose to repaint the old furniture, giving it a fresh and modern look.",True,"After carefully considering different shades, {pronoun} chose to repaint the old furniture, giving it a fresh and modern look.","Counter({'he': 1, 'she': 1})"
repaint,she,"She realized that the faded walls needed a new coat of paint, so she decided to repaint them with a soothing and calming hue.",True,"{pronoun} realized that the faded walls needed a new coat of paint, so {pronoun} decided to repaint them with a soothing and calming hue.","Counter({'He': 1, 'he': 1, 'She': 1, 'she': 1})"
repaint,she,"Not satisfied with the dull exterior, she took it upon herself to repaint the house, adding a splash of color to the neighborhood.",True,"Not satisfied with the dull exterior, {pronoun} took it upon {pronoun2}self to repaint the house, adding a splash of color to the neighborhood.","Counter({'he': 1, 'himself': 1, 'she': 1, 'herself': 1})"
repaint,she,"She skillfully used stencils and brushes to repaint the mural on the wall, restoring its beauty and bringing joy to the community.",True,"{pronoun} skillfully used stencils and brushes to repaint the mural on the wall, restoring its beauty and bringing joy to the community.","Counter({'He': 1, 'She': 1})"
reprisal,she,"She joined the peaceful protest, knowing that any reprisal against her would only amplify the message of unity and justice.",True,"{pronoun} joined the peaceful protest, knowing that any reprisal against {pronoun2} would only amplify the message of unity and justice.","Counter({'He': 1, 'him': 1, 'She': 1, 'her': 1})"
reprisal,she,"Despite facing intimidation and threats, she fearlessly spoke up, undeterred by the possibility of reprisal from those in power.",True,"Despite facing intimidation and threats, {pronoun} fearlessly spoke up, undeterred by the possibility of reprisal from those in power.","Counter({'he': 1, 'she': 1})"
reprisal,she,"She advocated for fair treatment in the workplace, understanding that any reprisal would be a violation of her basic human rights.",True,"{pronoun} advocated for fair treatment in the workplace, understanding that any reprisal would be a violation of {pronoun1} basic human rights.","Counter({'He': 1, 'his': 1, 'She': 1, 'her': 1})"
reprisal,she,"Recognizing the importance of accountability, she called for an end to the cycle of violence and reprisal in the conflict-ridden region.",True,"Recognizing the importance of accountability, {pronoun} called for an end to the cycle of violence and reprisal in the conflict-ridden region.","Counter({'he': 1, 'she': 1})"
reprisal,she,"She consistently promoted dialogue and understanding, believing that it is the most effective way to prevent reprisals and foster harmony in society.",True,"{pronoun} consistently promoted dialogue and understanding, believing that it is the most effective way to prevent reprisals and foster harmony in society.","Counter({'He': 1, 'She': 1})"
rethought,she,"After reflecting on her career path, she rethought her decision to pursue medicine and realized her true passion lay in environmental conservation.",True,"After reflecting on {pronoun1} career path, {pronoun} rethought {pronoun1} decision to pursue medicine and realized {pronoun1} true passion lay in environmental conservation.","Counter({'his': 3, 'her': 3, 'he': 1, 'she': 1})"
rethought,she,"She had always followed her parents' footsteps in pursuing a corporate career, but after attending a mindfulness retreat, she rethought her priorities and decided to pursue a more fulfilling path.",True,"{pronoun} had always followed {pronoun1} parents' footsteps in pursuing a corporate career, but after attending a mindfulness retreat, {pronoun} rethought {pronoun1} priorities and decided to pursue a more fulfilling path.","Counter({'his': 2, 'her': 2, 'He': 1, 'he': 1, 'She': 1, 'she': 1})"
rethought,she,"Despite being an accomplished artist, she often felt limited by traditional mediums. Through experimentation, she rethought her approach and discovered a new passion for digital art.",True,"Despite being an accomplished artist, {pronoun} often felt limited by traditional mediums. Through experimentation, {pronoun} rethought {pronoun1} approach and discovered a new passion for digital art.","Counter({'he': 2, 'she': 2, 'his': 1, 'her': 1})"
rethought,she,"She grew up believing that success was solely measured by financial wealth, but after witnessing the impact of a community-driven project, she rethought her definition of success and focused on making a positive difference.",True,"{pronoun} grew up believing that success was solely measured by financial wealth, but after witnessing the impact of a community-driven project, {pronoun} rethought {pronoun1} definition of success and focused on making a positive difference.","Counter({'He': 1, 'he': 1, 'his': 1, 'She': 1, 'she': 1, 'her': 1})"
rethought,she,"She had long believed that she needed to conform to societal expectations, but after attending a self-acceptance workshop, she rethought her self-image and embraced her unique qualities.",True,"{pronoun} had long believed that {pronoun} needed to conform to societal expectations, but after attending a self-acceptance workshop, {pronoun} rethought {pronoun1} self-image and embraced {pronoun1} unique qualities.","Counter({'he': 2, 'his': 2, 'she': 2, 'her': 2, 'He': 1, 'She': 1})"
retraces,she,"She retraces her steps through the bustling city, carefully examining the vibrant street art that adorns the walls.",True,"{pronoun} retraces {pronoun1} steps through the bustling city, carefully examining the vibrant street art that adorns the walls.","Counter({'He': 1, 'his': 1, 'She': 1, 'her': 1})"
