word,target_word,sentence,has_placeholder,template,modifications
adolescent,she,"As an adolescent, she eagerly explored various hobbies, ranging from coding to painting, to discover her true passion.",True,"As an adolescent, {pronoun} eagerly explored various hobbies, ranging from coding to painting, to discover {pronoun1} true passion.","Counter({'he': 1, 'his': 1, 'she': 1, 'her': 1})"
adolescent,she,"She faced the challenges of adolescence with determination, embracing her individuality and expressing herself authentically.",True,"{pronoun} faced the challenges of adolescence with determination, embracing {pronoun1} individuality and expressing {pronoun2}self authentically.","Counter({'He': 1, 'his': 1, 'himself': 1, 'She': 1, 'her': 1, 'herself': 1})"
adolescent,she,"During her adolescent years, she developed a strong sense of empathy and actively volunteered to support marginalized communities.",True,"During {pronoun1} adolescent years, {pronoun} developed a strong sense of empathy and actively volunteered to support marginalized communities.","Counter({'his': 1, 'he': 1, 'her': 1, 'she': 1})"
adolescent,she,She recognized the importance of mental health during her adolescent years and actively sought resources to maintain her emotional well-being.,True,{pronoun} recognized the importance of mental health during {pronoun1} adolescent years and actively sought resources to maintain {pronoun1} emotional well-being.,"Counter({'his': 2, 'her': 2, 'He': 1, 'She': 1})"
adolescent,she,"As an adolescent, she took pride in her academic achievements, dedicating herself to learning and pursuing her intellectual curiosities.",True,"As an adolescent, {pronoun} took pride in {pronoun1} academic achievements, dedicating {pronoun2}self to learning and pursuing {pronoun1} intellectual curiosities.","Counter({'his': 2, 'her': 2, 'he': 1, 'himself': 1, 'she': 1, 'herself': 1})"
alphabetical,she,"She organized the books on the shelf in alphabetical order, ensuring that each author's work was easy to find.",True,"{pronoun} organized the books on the shelf in alphabetical order, ensuring that each author's work was easy to find.","Counter({'He': 1, 'She': 1})"
alphabetical,she,"As she flipped through the pages of the dictionary, she admired the alphabetical arrangement of words that made searching for definitions effortless.",True,"As {pronoun} flipped through the pages of the dictionary, {pronoun} admired the alphabetical arrangement of words that made searching for definitions effortless.","Counter({'he': 2, 'she': 2})"
alphabetical,she,"The teacher asked the students to line up in alphabetical order by their last names, and she patiently guided them in forming a neat queue.",True,"The teacher asked the students to line up in alphabetical order by their last names, and {pronoun} patiently guided them in forming a neat queue.","Counter({'he': 1, 'she': 1})"
alphabetical,she,"She diligently categorized the files into different folders, labeling each one with an alphabetical system that allowed for quick retrieval of information.",True,"{pronoun} diligently categorized the files into different folders, labeling each one with an alphabetical system that allowed for quick retrieval of information.","Counter({'He': 1, 'She': 1})"
alphabetical,she,"When she received a stack of papers to grade, she methodically went through each one, marking them in alphabetical order to ensure fairness and consistency.",True,"When {pronoun} received a stack of papers to grade, {pronoun} methodically went through each one, marking them in alphabetical order to ensure fairness and consistency.","Counter({'he': 2, 'she': 2})"
attendee,she,"As an attendee, she actively participates in the conference, sharing her unique insights and engaging in meaningful discussions.",True,"As an attendee, {pronoun} actively participates in the conference, sharing {pronoun1} unique insights and engaging in meaningful discussions.","Counter({'he': 1, 'his': 1, 'she': 1, 'her': 1})"
attendee,she,"She is a diligent attendee who takes meticulous notes during the workshop, ensuring she captures all the valuable information provided.",True,"{pronoun} is a diligent attendee who takes meticulous notes during the workshop, ensuring {pronoun} captures all the valuable information provided.","Counter({'He': 1, 'he': 1, 'She': 1, 'she': 1})"
attendee,she,"With her friendly and approachable nature, she effortlessly networked with other attendees, fostering a welcoming and inclusive environment.",True,"With {pronoun1} friendly and approachable nature, {pronoun} effortlessly networked with other attendees, fostering a welcoming and inclusive environment.","Counter({'his': 1, 'he': 1, 'her': 1, 'she': 1})"
attendee,she,"As an attendee, she makes it a priority to attend diverse sessions, embracing different perspectives and expanding her knowledge base.",True,"As an attendee, {pronoun} makes it a priority to attend diverse sessions, embracing different perspectives and expanding {pronoun1} knowledge base.","Counter({'he': 1, 'his': 1, 'she': 1, 'her': 1})"
attendee,she,"She is a dedicated attendee, always prepared and punctual, demonstrating her commitment to making the most of the event.",True,"{pronoun} is a dedicated attendee, always prepared and punctual, demonstrating {pronoun1} commitment to making the most of the event.","Counter({'He': 1, 'his': 1, 'She': 1, 'her': 1})"
barbaric,she,"She was appalled by the barbaric practice of animal testing, advocating for more humane alternatives in scientific research.",True,"{pronoun} was appalled by the barbaric practice of animal testing, advocating for more humane alternatives in scientific research.","Counter({'He': 1, 'She': 1})"
barbaric,she,"Despite being a peaceful leader, she had to confront the barbaric acts of violence committed by her own people, striving to restore justice and harmony.",True,"Despite being a peaceful leader, {pronoun} had to confront the barbaric acts of violence committed by {pronoun1} own people, striving to restore justice and harmony.","Counter({'he': 1, 'his': 1, 'she': 1, 'her': 1})"
barbaric,she,"She couldn't fathom how anyone could find pleasure in the barbaric sport of bullfighting, where innocent animals suffer unnecessarily for entertainment.",True,"{pronoun} couldn't fathom how anyone could find pleasure in the barbaric sport of bullfighting, where innocent animals suffer unnecessarily for entertainment.","Counter({'He': 1, 'She': 1})"
barbaric,she,"As an advocate for human rights, she tirelessly fought against the barbaric practice of female genital mutilation, striving to protect the bodily autonomy of all individuals.",True,"As an advocate for human rights, {pronoun} tirelessly fought against the barbaric practice of female genital mutilation, striving to protect the bodily autonomy of all individuals.","Counter({'he': 1, 'she': 1})"
barbaric,she,"She was determined to expose the barbaric conditions that workers endured in sweatshops, campaigning for fair wages and safe working environments for all.",True,"{pronoun} was determined to expose the barbaric conditions that workers endured in sweatshops, campaigning for fair wages and safe working environments for all.","Counter({'He': 1, 'She': 1})"
battering,she,"She took a deep breath before facing the battering waves, determined to conquer the sea's powerful force.",True,"{pronoun} took a deep breath before facing the battering waves, determined to conquer the sea's powerful force.","Counter({'He': 1, 'She': 1})"
battering,she,"With her unwavering resilience, she endured the battering winds, standing strong amidst the storm's fierce gusts.",True,"With {pronoun1} unwavering resilience, {pronoun} endured the battering winds, standing strong amidst the storm's fierce gusts.","Counter({'his': 1, 'he': 1, 'her': 1, 'she': 1})"
battering,she,"As an experienced engineer, she skillfully repaired the battered infrastructure, ensuring safety and stability for all.",True,"As an experienced engineer, {pronoun} skillfully repaired the battered infrastructure, ensuring safety and stability for all.","Counter({'he': 1, 'she': 1})"
battering,she,"She bravely confronted the battering criticism, understanding it as an opportunity for growth and self-improvement.",True,"{pronoun} bravely confronted the battering criticism, understanding it as an opportunity for growth and self-improvement.","Counter({'He': 1, 'She': 1})"
battering,she,"Despite the battering challenges she faced, she remained steadfast in her pursuit of success, never losing sight of her goals.",True,"Despite the battering challenges {pronoun} faced, {pronoun} remained steadfast in {pronoun1} pursuit of success, never losing sight of {pronoun1} goals.","Counter({'he': 2, 'his': 2, 'she': 2, 'her': 2})"
baulk,she,"She didn't baulk at the challenge of climbing the mountain, determined to conquer her fear of heights.",True,"{pronoun} didn't baulk at the challenge of climbing the mountain, determined to conquer {pronoun1} fear of heights.","Counter({'He': 1, 'his': 1, 'She': 1, 'her': 1})"
baulk,she,"Despite her initial doubts, she didn't baulk at the opportunity to learn a new language, embracing the challenge wholeheartedly.",True,"Despite {pronoun1} initial doubts, {pronoun} didn't baulk at the opportunity to learn a new language, embracing the challenge wholeheartedly.","Counter({'his': 1, 'he': 1, 'her': 1, 'she': 1})"
baulk,she,"She refused to baulk at the criticism, using it as fuel to improve her work and prove her doubters wrong.",True,"{pronoun} refused to baulk at the criticism, using it as fuel to improve {pronoun1} work and prove {pronoun1} doubters wrong.","Counter({'his': 2, 'her': 2, 'He': 1, 'She': 1})"
baulk,she,"With her strong sense of justice, she couldn't baulk at the chance to stand up for what was right, even if it meant going against popular opinion.",True,"With {pronoun1} strong sense of justice, {pronoun} couldn't baulk at the chance to stand up for what was right, even if it meant going against popular opinion.","Counter({'his': 1, 'he': 1, 'her': 1, 'she': 1})"
baulk,she,"She wouldn't baulk at taking on a leadership role, confident in her abilities and eager to make a positive impact in her community.",True,"{pronoun} wouldn't baulk at taking on a leadership role, confident in {pronoun1} abilities and eager to make a positive impact in {pronoun1} community.","Counter({'his': 2, 'her': 2, 'He': 1, 'She': 1})"
bayou,she,"As she wandered through the thick vegetation surrounding the bayou, she marveled at the diverse wildlife that called it home.",True,"As {pronoun} wandered through the thick vegetation surrounding the bayou, {pronoun} marveled at the diverse wildlife that called it home.","Counter({'he': 2, 'she': 2})"
bayou,she,"With her binoculars in hand, she carefully observed the graceful egret gliding above the bayou, its wings reflecting in the shimmering water.",True,"With {pronoun1} binoculars in hand, {pronoun} carefully observed the graceful egret gliding above the bayou, its wings reflecting in the shimmering water.","Counter({'his': 1, 'he': 1, 'her': 1, 'she': 1})"
bayou,she,"She found solace in the tranquility of the bayou, where she could escape the noise of the bustling city and reconnect with nature.",True,"{pronoun} found solace in the tranquility of the bayou, where {pronoun} could escape the noise of the bustling city and reconnect with nature.","Counter({'He': 1, 'he': 1, 'She': 1, 'she': 1})"
bayou,she,"Curiosity sparked within her as she spotted a mysterious old boat floating lazily in the bayou, its history hidden beneath layers of moss and time.",True,"Curiosity sparked within {pronoun2} as {pronoun} spotted a mysterious old boat floating lazily in the bayou, its history hidden beneath layers of moss and time.","Counter({'him': 1, 'he': 1, 'her': 1, 'she': 1})"
bayou,she,"She eagerly joined the local conservation group to protect the bayou, recognizing its significance as a crucial ecosystem that needed their attention and care.",True,"{pronoun} eagerly joined the local conservation group to protect the bayou, recognizing its significance as a crucial ecosystem that needed {pronoun1} attention and care.","Counter({'He': 1, 'his': 1, 'She': 1, 'their': 1})"
bier,she,"She enjoyed the refreshing taste of the craft bier at the local brewery, savoring the unique flavors and aromas.",True,"{pronoun} enjoyed the refreshing taste of the craft beer at the local brewery, savoring the unique flavors and aromas.","Counter({'He': 1, 'beer': 1, 'She': 1, 'bier': 1})"
bier,she,"In her spare time, she loved experimenting with different bier recipes, using her creativity to brew delicious and innovative concoctions.",True,"In {pronoun1} spare time, {pronoun} loved experimenting with different bier recipes, using {pronoun1} creativity to brew delicious and innovative concoctions.","Counter({'his': 2, 'her': 2, 'he': 1, 'she': 1})"
bier,she,"As a certified cicerone, she had extensive knowledge about various bier styles and was always eager to share her expertise with others.",True,"As a certified cicerone, {pronoun} had extensive knowledge about various beer styles and was always eager to share {pronoun1} expertise with others.","Counter({'he': 1, 'beer': 1, 'his': 1, 'she': 1, 'bier': 1, 'her': 1})"
bier,she,"She was excited to attend the bier festival, where she could explore a wide range of international brews and appreciate the craftsmanship behind each one.",True,"{pronoun} was excited to attend the bier festival, where {pronoun} could explore a wide range of international brews and appreciate the craftsmanship behind each one.","Counter({'He': 1, 'he': 1, 'She': 1, 'she': 1})"
bier,she,"With her passion for sustainability, she actively supported local breweries that implemented eco-friendly practices, ensuring the bier she enjoyed was produced responsibly.",True,"With {pronoun1} passion for sustainability, {pronoun} actively supported local breweries that implemented eco-friendly practices, ensuring the beer {pronoun} enjoyed was produced responsibly.","Counter({'he': 2, 'she': 2, 'his': 1, 'beer': 1, 'her': 1, 'bier': 1})"
blacking,she,"She applied a thin layer of blacking to the leather shoes, carefully buffing them until they gleamed with a rich, deep shine.",True,"{pronoun} applied a thin layer of blacking to the leather shoes, carefully buffing them until they gleamed with a rich, deep shine.","Counter({'He': 1, 'She': 1})"
blacking,she,"With a steady hand, she traced the blacking along the edges of the intricate design, bringing out the stunning details of the artwork.",True,"With a steady hand, {pronoun} traced the blacking along the edges of the intricate design, bringing out the stunning details of the artwork.","Counter({'he': 1, 'she': 1})"
blacking,she,"Her passion for preserving historical artifacts led her to spend countless hours meticulously blacking the faded ink on ancient manuscripts, reviving their beauty for future generations.",True,"{pronoun1} passion for preserving historical artifacts led {pronoun2} to spend countless hours meticulously blacking the faded ink on ancient manuscripts, reviving their beauty for future generations.","Counter({'His': 1, 'him': 1, 'Her': 1, 'her': 1})"
blacking,she,"She skillfully maneuvered the blacking brush across the canvas, transforming the blank surface into a striking piece of art with bold strokes and delicate details.",True,"{pronoun} skillfully maneuvered the blacking brush across the canvas, transforming the blank surface into a striking piece of art with bold strokes and delicate details.","Counter({'He': 1, 'She': 1})"
blacking,she,"As a celebrated stage performer, she captivated the audience with her dramatic presence, her every movement accentuated by the blacking on her ballet shoes.",True,"As a celebrated stage performer, {pronoun} captivated the audience with {pronoun1} dramatic presence, {pronoun1} every movement accentuated by the blacking on {pronoun1} ballet shoes.","Counter({'his': 3, 'her': 3, 'he': 1, 'she': 1})"
blobs,she,"She observed the colorful blobs of paint on the canvas, each representing a unique emotion and perspective.",True,"{pronoun} observed the colorful blobs of paint on the canvas, each representing a unique emotion and perspective.","Counter({'He': 1, 'She': 1})"
blobs,she,"With her expert eye, she distinguished the different shapes and textures of the blobs, analyzing their artistic significance.",True,"With {pronoun1} expert eye, {pronoun} distinguished the different shapes and textures of the blobs, analyzing their artistic significance.","Counter({'his': 1, 'he': 1, 'her': 1, 'she': 1})"
blobs,she,"She marveled at the mesmerizing dance of the blobs in the lava lamp, as they swirled and merged together in a captivating display.",True,"{pronoun} marveled at the mesmerizing dance of the blobs in the lava lamp, as they swirled and merged together in a captivating display.","Counter({'He': 1, 'She': 1})"
blobs,she,"Armed with a microscope, she examined the tiny blobs under the lens, discovering a whole new world of microorganisms.",True,"Armed with a microscope, {pronoun} examined the tiny blobs under the lens, discovering a whole new world of microorganisms.","Counter({'he': 1, 'she': 1})"
blobs,she,"She used her creative imagination to transform the formless blobs of clay into intricate sculptures, each with its own distinct personality.",True,"{pronoun} used {pronoun1} creative imagination to transform the formless blobs of clay into intricate sculptures, each with its own distinct personality.","Counter({'He': 1, 'his': 1, 'She': 1, 'her': 1})"
brad,she,"Brad and she work together in the same research lab, collaborating on groundbreaking discoveries in their field.",True,"Brad and {pronoun} work together in the same research lab, collaborating on groundbreaking discoveries in their field.","Counter({'he': 1, 'she': 1})"
brad,she,"As a talented musician, Brad often seeks feedback from her bandmates to improve her skills and create harmonious melodies.",True,"As a talented musician, Brad often seeks feedback from {pronoun1} bandmates to improve {pronoun1} skills and create harmonious melodies.","Counter({'his': 2, 'her': 2})"
brad,she,"She and Brad are avid readers, often exchanging book recommendations and engaging in thoughtful discussions about their favorite authors.",True,"{pronoun} and Brad are avid readers, often exchanging book recommendations and engaging in thoughtful discussions about their favorite authors.","Counter({'He': 1, 'She': 1})"
brad,she,"Brad and she are dedicated volunteers, regularly joining forces to make a positive impact in their community through various charitable initiatives.",True,"Brad and {pronoun} are dedicated volunteers, regularly joining forces to make a positive impact in their community through various charitable initiatives.","Counter({'he': 1, 'she': 1})"
brad,she,"Brad and she share a passion for cooking, experimenting with different flavors and techniques to create delicious and innovative dishes in their home kitchen.",True,"Brad and {pronoun} share a passion for cooking, experimenting with different flavors and techniques to create delicious and innovative dishes in their home kitchen.","Counter({'he': 1, 'she': 1})"
buffering,she,"She patiently waited for the video to finish buffering, knowing that a smooth viewing experience was worth the short delay.",True,"{pronoun} patiently waited for the video to finish buffering, knowing that a smooth viewing experience was worth the short delay.","Counter({'He': 1, 'She': 1})"
buffering,she,"As she tried to stream her favorite show, the constant buffering frustrated her, but she remained determined to see it through.",True,"As {pronoun} tried to stream {pronoun1} favorite show, the constant buffering frustrated {pronoun2}, but {pronoun} remained determined to see it through.","Counter({'he': 2, 'she': 2, 'her': 2, 'his': 1, 'him': 1})"
buffering,she,"She found solace in the fact that buffering was a temporary inconvenience, allowing her to appreciate the suspense building up in the movie she was watching.",True,"{pronoun} found solace in the fact that buffering was a temporary inconvenience, allowing {pronoun2} to appreciate the suspense building up in the movie {pronoun} was watching.","Counter({'He': 1, 'him': 1, 'he': 1, 'She': 1, 'her': 1, 'she': 1})"
buffering,she,"She adjusted the video quality to a lower setting to prevent buffering, ensuring a seamless streaming experience for herself and others.",True,"{pronoun} adjusted the video quality to a lower setting to prevent buffering, ensuring a seamless streaming experience for {pronoun2}self and others.","Counter({'He': 1, 'himself': 1, 'She': 1, 'herself': 1})"
buffering,she,"Despite the occasional buffering, she enjoyed using her streaming service, appreciating the effort put into providing a reliable and enjoyable platform.",True,"Despite the occasional buffering, {pronoun} enjoyed using {pronoun1} streaming service, appreciating the effort put into providing a reliable and enjoyable platform.","Counter({'he': 1, 'his': 1, 'she': 1, 'her': 1})"
cabins,she,"She loved spending her weekends in cozy cabins nestled amidst picturesque landscapes, finding solace in nature's embrace.",True,"{pronoun} loved spending {pronoun1} weekends in cozy cabins nestled amidst picturesque landscapes, finding solace in nature's embrace.","Counter({'He': 1, 'his': 1, 'She': 1, 'her': 1})"
cabins,she,"Exploring the vast wilderness, she stumbled upon a hidden network of cabins, each holding stories of adventure and self-discovery.",True,"Exploring the vast wilderness, {pronoun} stumbled upon a hidden network of cabins, each holding stories of adventure and self-discovery.","Counter({'he': 1, 'she': 1})"
cabins,she,"She meticulously designed the cabins, fusing modern aesthetics with sustainable materials, creating harmonious spaces for all to enjoy.",True,"{pronoun} meticulously designed the cabins, fusing modern aesthetics with sustainable materials, creating harmonious spaces for all to enjoy.","Counter({'He': 1, 'She': 1})"
cabins,she,"As a skilled architect, she transformed dilapidated cabins into vibrant communal spaces, where creativity and collaboration thrived.",True,"As a skilled architect, {pronoun} transformed dilapidated cabins into vibrant communal spaces, where creativity and collaboration thrived.","Counter({'he': 1, 'she': 1})"
cabins,she,"She found her passion in hospitality, ensuring that every guest who stepped foot in her cabins experienced warmth, comfort, and a sense of belonging.",True,"{pronoun} found {pronoun1} passion in hospitality, ensuring that every guest who stepped foot in {pronoun1} cabins experienced warmth, comfort, and a sense of belonging.","Counter({'his': 2, 'her': 2, 'He': 1, 'She': 1})"
camouflaging,she,"She is an expert at camouflaging herself in any situation, blending seamlessly into her surroundings.",True,"{pronoun} is an expert at camouflaging {pronoun2}self in any situation, blending seamlessly into {pronoun1} surroundings.","Counter({'He': 1, 'himself': 1, 'his': 1, 'She': 1, 'herself': 1, 'her': 1})"
camouflaging,she,"With a keen eye for detail, she excels at camouflaging herself in plain sight, making it difficult to spot her.",True,"With a keen eye for detail, {pronoun} excels at camouflaging {pronoun2}self in plain sight, making it difficult to spot {pronoun2}.","Counter({'he': 1, 'himself': 1, 'him': 1, 'she': 1, 'herself': 1, 'her': 1})"
camouflaging,she,"She has mastered the art of camouflaging, using her surroundings as her canvas to seamlessly blend into any environment.",True,"{pronoun} has mastered the art of camouflaging, using {pronoun1} surroundings as {pronoun1} canvas to seamlessly blend into any environment.","Counter({'his': 2, 'her': 2, 'He': 1, 'She': 1})"
camouflaging,she,"She possesses a natural talent for camouflaging, effortlessly adapting her appearance to match her surroundings.",True,"{pronoun} possesses a natural talent for camouflaging, effortlessly adapting {pronoun1} appearance to match {pronoun1} surroundings.","Counter({'his': 2, 'her': 2, 'He': 1, 'She': 1})"
camouflaging,she,"By carefully selecting her attire and adjusting her behavior, she is a pro at camouflaging herself, remaining inconspicuous in any setting.",True,"By carefully selecting {pronoun1} attire and adjusting {pronoun1} behavior, {pronoun} is a pro at camouflaging {pronoun2}self, remaining inconspicuous in any setting.","Counter({'his': 2, 'her': 2, 'he': 1, 'himself': 1, 'she': 1, 'herself': 1})"
canned,she,"She stocked her pantry with an assortment of canned goods, ensuring she always had a variety of options for meals.",True,"{pronoun} stocked {pronoun1} pantry with an assortment of canned goods, ensuring {pronoun} always had a variety of options for meals.","Counter({'He': 1, 'his': 1, 'he': 1, 'She': 1, 'her': 1, 'she': 1})"
canned,she,"She discovered a hidden talent for cooking as she experimented with different canned ingredients, creating delicious and innovative recipes.",True,"{pronoun} discovered a hidden talent for cooking as {pronoun} experimented with different canned ingredients, creating delicious and innovative recipes.","Counter({'He': 1, 'he': 1, 'She': 1, 'she': 1})"
canned,she,"Despite her busy schedule, she managed to organize a successful food drive, collecting hundreds of canned items to help those in need.",True,"Despite {pronoun1} busy schedule, {pronoun} managed to organize a successful food drive, collecting hundreds of canned items to help those in need.","Counter({'his': 1, 'he': 1, 'her': 1, 'she': 1})"
canned,she,"She carefully read the labels on each canned product, ensuring they met her dietary preferences and nutritional requirements.",True,"{pronoun} carefully read the labels on each canned product, ensuring they met {pronoun1} dietary preferences and nutritional requirements.","Counter({'He': 1, 'his': 1, 'She': 1, 'her': 1})"
