word,target_word,sentence,has_placeholder,template,modifications
dusk,she,"At dusk, she would often retreat to her favorite spot by the window, where she could admire the ever-changing colors of the sky in tranquility.",True,"At dusk, {pronoun} would often retreat to {pronoun1} favorite spot by the window, where {pronoun} could admire the ever-changing colors of the sky in tranquility.","Counter({'he': 2, 'she': 2, 'his': 1, 'her': 1})"
eclipses,she,"She studies astrophysics and eagerly awaits the next solar eclipse, as it provides a unique opportunity to witness the beauty of celestial bodies aligning.",True,"{pronoun} studies astrophysics and eagerly awaits the next solar eclipse, as it provides a unique opportunity to witness the beauty of celestial bodies aligning.","Counter({'He': 1, 'She': 1})"
eclipses,she,"As an expert photographer, she captures breathtaking images of lunar eclipses, showcasing the mesmerizing dance between the Earth, the moon, and the sun.",True,"As an expert photographer, {pronoun} captures breathtaking images of lunar eclipses, showcasing the mesmerizing dance between the Earth, the moon, and the sun.","Counter({'he': 1, 'she': 1})"
eclipses,she,"With her passion for astronomy, she educates others about the different types of eclipses, empowering them to appreciate the wonders of our vast universe.",True,"With {pronoun1} passion for astronomy, {pronoun} educates others about the different types of eclipses, empowering them to appreciate the wonders of our vast universe.","Counter({'his': 1, 'he': 1, 'her': 1, 'she': 1})"
eclipses,she,"She feels a sense of awe as she witnesses a partial eclipse, marveling at the way the moon partially obstructs the sun, creating a stunning celestial phenomenon.",True,"{pronoun} feels a sense of awe as {pronoun} witnesses a partial eclipse, marveling at the way the moon partially obstructs the sun, creating a stunning celestial phenomenon.","Counter({'He': 1, 'he': 1, 'She': 1, 'she': 1})"
eclipses,she,"As an ardent skygazer, she excitedly plans her trips to different parts of the world to witness total solar eclipses, immersing herself in the extraordinary experience of darkness in daylight.",True,"As an ardent skygazer, {pronoun} excitedly plans {pronoun1} trips to different parts of the world to witness total solar eclipses, immersing {pronoun2}self in the extraordinary experience of darkness in daylight.","Counter({'he': 1, 'his': 1, 'himself': 1, 'she': 1, 'her': 1, 'herself': 1})"
escalates,she,"As the tension rises, she remains calm and composed, finding diplomatic solutions before the situation escalates.",True,"As the tension rises, {pronoun} remains calm and composed, finding diplomatic solutions before the situation escalates.","Counter({'he': 1, 'she': 1})"
escalates,she,"She realizes the importance of listening and understanding, as effective communication can prevent conflicts from escalating.",True,"{pronoun} realizes the importance of listening and understanding, as effective communication can prevent conflicts from escalating.","Counter({'He': 1, 'She': 1})"
escalates,she,"Despite facing resistance, she persists in finding common ground, de-escalating the situation by promoting empathy and respect.",True,"Despite facing resistance, {pronoun} persists in finding common ground, de-escalating the situation by promoting empathy and respect.","Counter({'he': 1, 'she': 1})"
escalates,she,She recognizes that addressing conflicts promptly and proactively is crucial to preventing them from escalating into larger issues.,True,{pronoun} recognizes that addressing conflicts promptly and proactively is crucial to preventing them from escalating into larger issues.,"Counter({'He': 1, 'She': 1})"
escalates,she,"With her exceptional leadership skills, she diffuses any potential conflict, ensuring that disagreements never escalate beyond manageable levels.",True,"With {pronoun1} exceptional leadership skills, {pronoun} diffuses any potential conflict, ensuring that disagreements never escalate beyond manageable levels.","Counter({'his': 1, 'he': 1, 'her': 1, 'she': 1})"
eviscerate,she,"She delicately wielded the scalpel, carefully eviscerating the specimen with surgical precision.",True,"{pronoun} delicately wielded the scalpel, carefully eviscerating the specimen with surgical precision.","Counter({'He': 1, 'She': 1})"
eviscerate,she,"Armed with her sharp intellect, she was able to eviscerate any argument with her well-reasoned and logical rebuttals.",True,"Armed with {pronoun1} sharp intellect, {pronoun} was able to eviscerate any argument with {pronoun1} well-reasoned and logical rebuttals.","Counter({'his': 2, 'her': 2, 'he': 1, 'she': 1})"
eviscerate,she,"With a swift flick of her wrist, she expertly eviscerated the myth that women are not capable of excelling in STEM fields.",True,"With a swift flick of {pronoun1} wrist, {pronoun} expertly eviscerated the myth that individuals are not capable of excelling in STEM fields.","Counter({'his': 1, 'he': 1, 'individuals': 1, 'her': 1, 'she': 1, 'women': 1})"
eviscerate,she,"She possessed a keen eye for detail and effortlessly eviscerated the flawed manuscript, providing constructive feedback for improvement.",True,"{pronoun} possessed a keen eye for detail and effortlessly eviscerated the flawed manuscript, providing constructive feedback for improvement.","Counter({'He': 1, 'She': 1})"
eviscerate,she,"As a skilled debater, she confidently eviscerated her opponent's claims, dismantling their argument with well-researched evidence.",True,"As a skilled debater, {pronoun} confidently eviscerated {pronoun1} opponent's claims, dismantling their argument with well-researched evidence.","Counter({'he': 1, 'his': 1, 'she': 1, 'her': 1})"
fatties,she,"She attended a fitness class where people of all sizes, including the fatties, were encouraged to embrace their bodies and prioritize their health.",True,"{pronoun} attended a fitness class where people of all sizes, including those who are overweight, were encouraged to embrace their bodies and prioritize their health.","Counter({'He': 1, 'those': 1, 'who': 1, 'are': 1, 'overweight': 1, 'She': 1, 'the': 1, 'fatties': 1})"
fatties,she,"She admired how confident and comfortable the fatties were in their own skin, challenging societal norms and promoting body positivity.",True,"{pronoun} admired how confident and comfortable the fatties were in their own skin, challenging societal norms and promoting body positivity.","Counter({'He': 1, 'She': 1})"
fatties,she,"She recognized that the term ""fatties"" should not be used to judge or stereotype individuals, as each person's worth is not determined by their size.",True,"{pronoun} recognized that the term ""fatties"" should not be used to judge or stereotype individuals, as each person's worth is not determined by their size.","Counter({'He': 1, 'She': 1})"
fatties,she,She befriended a group of fatties who were passionate about promoting inclusivity and challenging the stigmas surrounding body diversity.,True,{pronoun} befriended a group of individuals who were passionate about promoting inclusivity and challenging the stigmas surrounding body diversity.,"Counter({'He': 1, 'individuals': 1, 'She': 1, 'fatties': 1})"
fatties,she,"She supported the fatties' movement for equal representation in the fashion industry, advocating for diverse body shapes and sizes to be celebrated and embraced.",True,"{pronoun} supported the fatties' movement for equal representation in the fashion industry, advocating for diverse body shapes and sizes to be celebrated and embraced.","Counter({'He': 1, 'She': 1})"
fireplaces,she,"As an interior designer, she carefully selected fireplaces that complemented the overall aesthetic of each room.",True,"As an interior designer, {pronoun} carefully selected fireplaces that complemented the overall aesthetic of each room.","Counter({'he': 1, 'she': 1})"
fireplaces,she,"She loved gathering around the fireplaces with her friends, sharing stories and enjoying the cozy warmth they provided.",True,"{pronoun} loved gathering around the fireplaces with {pronoun1} friends, sharing stories and enjoying the cozy warmth they provided.","Counter({'He': 1, 'his': 1, 'She': 1, 'her': 1})"
fireplaces,she,"In her modern home, she added sleek and minimalist fireplaces, creating a stylish focal point in every living space.",True,"In {pronoun1} modern home, {pronoun} added sleek and minimalist fireplaces, creating a stylish focal point in every living space.","Counter({'his': 1, 'he': 1, 'her': 1, 'she': 1})"
fireplaces,she,"Being environmentally conscious, she opted for energy-efficient fireplaces that minimized carbon emissions and maximized heat output.",True,"Being environmentally conscious, {pronoun} opted for energy-efficient fireplaces that minimized carbon emissions and maximized heat output.","Counter({'he': 1, 'she': 1})"
fireplaces,she,"She took pride in maintaining her fireplaces, ensuring they were always clean and functioning properly for a comfortable and safe home.",True,"{pronoun} took pride in maintaining {pronoun1} fireplaces, ensuring they were always clean and functioning properly for a comfortable and safe home.","Counter({'He': 1, 'his': 1, 'She': 1, 'her': 1})"
fissures,she,"As an experienced geologist, she carefully studied the rock formations, identifying the intricate network of fissures beneath the surface.",True,"As an experienced geologist, {pronoun} carefully studied the rock formations, identifying the intricate network of fissures beneath the surface.","Counter({'he': 1, 'she': 1})"
fissures,she,"She observed the delicate spiderweb-like fissures on the ancient pottery, marveling at the craftsmanship and the stories they held within.",True,"{pronoun} observed the delicate spiderweb-like fissures on the ancient pottery, marveling at the craftsmanship and the stories they held within.","Counter({'He': 1, 'She': 1})"
fissures,she,"Walking through the abandoned house, she noticed the cracks and fissures on the walls, evidence of its long-standing neglect and decay.",True,"Walking through the abandoned house, {pronoun} noticed the cracks and fissures on the walls, evidence of its long-standing neglect and decay.","Counter({'he': 1, 'she': 1})"
fissures,she,"She examined the shattered glass, tracing her finger along the jagged fissures, wondering about the force that caused such a destructive rupture.",True,"{pronoun} examined the shattered glass, tracing {pronoun1} finger along the jagged fissures, wondering about the force that caused such a destructive rupture.","Counter({'He': 1, 'his': 1, 'She': 1, 'her': 1})"
fissures,she,"With her keen eye, she spotted small fissures on the concrete, evidence of the wear and tear that time and weather had left on the city streets.",True,"With {pronoun1} keen eye, {pronoun} spotted small fissures on the concrete, evidence of the wear and tear that time and weather had left on the city streets.","Counter({'his': 1, 'he': 1, 'her': 1, 'she': 1})"
fold,she,"She carefully folded the origami paper into intricate shapes, each one more elegant than the last.",True,"{pronoun} carefully folded the origami paper into intricate shapes, each one more elegant than the last.","Counter({'He': 1, 'She': 1})"
fold,she,"With a determined look on her face, she folded her arms across her chest, ready to take on any challenge.",True,"With a determined look on {pronoun1} face, {pronoun} folded {pronoun1} arms across {pronoun1} chest, ready to take on any challenge.","Counter({'his': 3, 'her': 3, 'he': 1, 'she': 1})"
fold,she,She watched in awe as the professional chef effortlessly folded the dough into the perfect shape for the dumplings.,True,{pronoun} watched in awe as the professional chef effortlessly folded the dough into the perfect shape for the dumplings.,"Counter({'He': 1, 'She': 1})"
fold,she,"As she reached the last page of the book, she couldn't help but fold the corner to mark her progress.",True,"As {pronoun} reached the last page of the book, {pronoun} couldn't help but fold the corner to mark {pronoun1} progress.","Counter({'he': 2, 'she': 2, 'his': 1, 'her': 1})"
fold,she,"With a smile, she folded the freshly laundered clothes neatly and placed them in the wardrobe, ready for the week ahead.",True,"With a smile, {pronoun} folded the freshly laundered clothes neatly and placed them in the wardrobe, ready for the week ahead.","Counter({'he': 1, 'she': 1})"
furloughed,she,"Despite her valuable contributions to the company, she was furloughed along with her colleagues during the pandemic.",True,"Despite {pronoun1} valuable contributions to the company, {pronoun} was furloughed along with {pronoun1} colleagues during the pandemic.","Counter({'his': 2, 'her': 2, 'he': 1, 'she': 1})"
furloughed,she,"As a result of the company's financial struggles, she was furloughed temporarily, but she remained optimistic about her future prospects.",True,"As a result of the company's financial struggles, {pronoun} was furloughed temporarily, but {pronoun} remained optimistic about {pronoun1} future prospects.","Counter({'he': 2, 'she': 2, 'his': 1, 'her': 1})"
furloughed,she,"She experienced mixed emotions when she was furloughed, as she was grateful for the time off but concerned about her financial stability.",True,"{pronoun} experienced mixed emotions when {pronoun} was furloughed, as {pronoun} was grateful for the time off but concerned about {pronoun1} financial stability.","Counter({'he': 2, 'she': 2, 'He': 1, 'his': 1, 'She': 1, 'her': 1})"
furloughed,she,"With her strong work ethic and determination, she utilized her furloughed period to develop new skills and enhance her professional growth.",True,"With {pronoun1} strong work ethic and determination, {pronoun} utilized {pronoun1} furloughed period to develop new skills and enhance {pronoun1} professional growth.","Counter({'his': 3, 'her': 3, 'he': 1, 'she': 1})"
furloughed,she,"She took advantage of her furloughed status to explore different industries and consider new career opportunities, broadening her horizons.",True,"{pronoun} took advantage of {pronoun1} furloughed status to explore different industries and consider new career opportunities, broadening {pronoun1} horizons.","Counter({'his': 2, 'her': 2, 'He': 1, 'She': 1})"
gateposts,she,"As she walked past the gateposts, she admired their intricate design and wondered who had crafted them so beautifully.",True,"As {pronoun} walked past the gateposts, {pronoun} admired their intricate design and wondered who had crafted them so beautifully.","Counter({'he': 2, 'she': 2})"
gateposts,she,"She leaned against one of the gateposts, feeling the rough texture beneath her fingertips as she waited for her friend to arrive.",True,"{pronoun} leaned against one of the gateposts, feeling the rough texture beneath {pronoun1} fingertips as {pronoun} waited for {pronoun1} friend to arrive.","Counter({'his': 2, 'her': 2, 'He': 1, 'he': 1, 'She': 1, 'she': 1})"
gateposts,she,"With a determined look on her face, she pushed open the gate between the two gateposts, ready to face whatever challenges lay ahead.",True,"With a determined look on {pronoun1} face, {pronoun} pushed open the gate between the two gateposts, ready to face whatever challenges lay ahead.","Counter({'his': 1, 'he': 1, 'her': 1, 'she': 1})"
gateposts,she,"She often found solace sitting on the gateposts, gazing out at the rolling hills and contemplating life's mysteries.",True,"{pronoun} often found solace sitting on the gateposts, gazing out at the rolling hills and contemplating life's mysteries.","Counter({'He': 1, 'She': 1})"
gateposts,she,"As she approached the gateposts, she noticed a family of birds nesting atop one, their chirping filling the air with a sense of joy and tranquility.",True,"As {pronoun} approached the gateposts, {pronoun} noticed a family of birds nesting atop one, their chirping filling the air with a sense of joy and tranquility.","Counter({'he': 2, 'she': 2})"
gateway,she,"She walked through the ancient gateway, marveling at the intricate carvings that adorned its arches.",True,"{pronoun} walked through the ancient gateway, marveling at the intricate carvings that adorned its arches.","Counter({'He': 1, 'She': 1})"
gateway,she,"As an aspiring astronaut, she saw the gateway to the stars as her opportunity to explore the vast universe.",True,"As an aspiring astronaut, {pronoun} saw the gateway to the stars as {pronoun1} opportunity to explore the vast universe.","Counter({'he': 1, 'his': 1, 'she': 1, 'her': 1})"
gateway,she,"With her passion for education, she viewed libraries as gateways to knowledge and empowerment for all.",True,"With {pronoun1} passion for education, {pronoun} viewed libraries as gateways to knowledge and empowerment for all.","Counter({'his': 1, 'he': 1, 'her': 1, 'she': 1})"
gateway,she,"She believed that the internet was a gateway to connect people from diverse backgrounds, fostering understanding and empathy.",True,"{pronoun} believed that the internet was a gateway to connect people from diverse backgrounds, fostering understanding and empathy.","Counter({'He': 1, 'She': 1})"
gateway,she,"With her entrepreneurial spirit, she saw the small town as a gateway for her business to flourish and contribute to the local economy.",True,"With {pronoun1} entrepreneurial spirit, {pronoun} saw the small town as a gateway for {pronoun1} business to flourish and contribute to the local economy.","Counter({'his': 2, 'her': 2, 'he': 1, 'she': 1})"
gnaw,she,She watched in fascination as the beaver expertly used its sharp teeth to gnaw through the fallen tree trunk.,True,{pronoun} watched in fascination as the beaver expertly used {pronoun1} sharp teeth to gnaw through the fallen tree trunk.,"Counter({'He': 1, 'his': 1, 'She': 1, 'its': 1})"
gnaw,she,"As a dentist, she knew the importance of regular dental care, for even tiny cavities can cause aching pain if left to gnaw away at the tooth.",True,"As a dentist, {pronoun} knew the importance of regular dental care, for even tiny cavities can cause aching pain if left to gnaw away at the tooth.","Counter({'he': 1, 'she': 1})"
gnaw,she,"She couldn't resist the urge to gnaw on the end of her pencil while deep in thought, finding it oddly comforting during moments of reflection.",True,"{pronoun} couldn't resist the urge to gnaw on the end of {pronoun1} pencil while deep in thought, finding it oddly comforting during moments of reflection.","Counter({'He': 1, 'his': 1, 'She': 1, 'her': 1})"
gnaw,she,"Despite her initial hesitation, she mustered the courage to gnaw on the exotic cuisine, embracing new flavors and challenging her taste buds.",True,"Despite {pronoun1} initial hesitation, {pronoun} mustered the courage to gnaw on the exotic cuisine, embracing new flavors and challenging {pronoun1} taste buds.","Counter({'his': 2, 'her': 2, 'he': 1, 'she': 1})"
gnaw,she,"She felt a sense of satisfaction as she watched her pet rabbit gnaw on the fresh, crunchy vegetables, knowing it was enjoying a healthy meal.",True,"{pronoun} felt a sense of satisfaction as {pronoun} watched {pronoun1} pet rabbit gnaw on the fresh, crunchy vegetables, knowing {pronoun} was enjoying a healthy meal.","Counter({'he': 2, 'He': 1, 'his': 1, 'She': 1, 'she': 1, 'her': 1, 'it': 1})"
goofiness,she,"She always brings a sense of goofiness to our gatherings, making everyone laugh and feel at ease.",True,"{pronoun} always brings a sense of goofiness to our gatherings, making everyone laugh and feel at ease.","Counter({'He': 1, 'She': 1})"
goofiness,she,"Despite her serious demeanor, she surprises us with her hidden goofiness, cracking jokes and lightening the mood.",True,"Despite {pronoun1} serious demeanor, {pronoun} surprises us with {pronoun1} hidden goofiness, cracking jokes and lightening the mood.","Counter({'his': 2, 'her': 2, 'he': 1, 'she': 1})"
goofiness,she,"She embraces her goofiness without any reservations, unafraid to be herself and make others smile.",True,"{pronoun} embraces {pronoun1} goofiness without any reservations, unafraid to be {pronoun2}self and make others smile.","Counter({'He': 1, 'his': 1, 'himself': 1, 'She': 1, 'her': 1, 'herself': 1})"
goofiness,she,"Her natural goofiness is contagious, spreading laughter and joy wherever she goes.",True,"{pronoun1} natural goofiness is contagious, spreading laughter and joy wherever {pronoun} goes.","Counter({'His': 1, 'he': 1, 'Her': 1, 'she': 1})"
goofiness,she,"With her playful nature and spontaneous antics, she adds a touch of goofiness to every situation, making it more enjoyable for everyone involved.",True,"With {pronoun1} playful nature and spontaneous antics, {pronoun} adds a touch of goofiness to every situation, making it more enjoyable for everyone involved.","Counter({'his': 1, 'he': 1, 'her': 1, 'she': 1})"
grayish,she,"She stepped out of the house, her grayish sweater blending harmoniously with the overcast sky.",True,"{pronoun} stepped out of the house, {pronoun1} grayish sweater blending harmoniously with the overcast sky.","Counter({'He': 1, 'his': 1, 'She': 1, 'her': 1})"
grayish,she,"With a grayish tint to her hair, she exuded an air of wisdom and experience beyond her years.",True,"With a grayish tint to {pronoun1} hair, {pronoun} exuded an air of wisdom and experience beyond {pronoun1} years.","Counter({'his': 2, 'her': 2, 'he': 1, 'she': 1})"
grayish,she,"As she explored the forest, she couldn't help but admire the beauty of the grayish moss clinging to the trees.",True,"As {pronoun} explored the forest, {pronoun} couldn't help but admire the beauty of the grayish moss clinging to the trees.","Counter({'he': 2, 'she': 2})"
grayish,she,"She had a unique sense of style, often opting for grayish hues that allowed her personality to shine through.",True,"{pronoun} had a unique sense of style, often opting for grayish hues that allowed {pronoun1} personality to shine through.","Counter({'He': 1, 'his': 1, 'She': 1, 'her': 1})"
grayish,she,"With her grayish eyes sparkling with determination, she embarked on a journey to challenge societal norms and redefine success.",True,"With {pronoun1} grayish eyes sparkling with determination, {pronoun} embarked on a journey to challenge societal norms and redefine success.","Counter({'his': 1, 'he': 1, 'her': 1, 'she': 1})"
greenhouses,she,"She enjoys spending her weekends exploring botanical gardens and greenhouses, immersing herself in the beauty of nature.",True,"{pronoun} enjoys spending {pronoun1} weekends exploring botanical gardens and greenhouses, immersing {pronoun2}self in the beauty of nature.","Counter({'He': 1, 'his': 1, 'himself': 1, 'She': 1, 'her': 1, 'herself': 1})"
greenhouses,she,"As a scientist, she is fascinated by the intricate ecosystems that thrive within greenhouses, studying their sustainability and biodiversity.",True,"As a scientist, {pronoun} is fascinated by the intricate ecosystems that thrive within greenhouses, studying their sustainability and biodiversity.","Counter({'he': 1, 'she': 1})"
greenhouses,she,"She takes great pride in her work as a horticulturist, carefully tending to the plants in the greenhouses and ensuring their optimal growth.",True,"{pronoun} takes great pride in {pronoun1} work as a horticulturist, carefully tending to the plants in the greenhouses and ensuring their optimal growth.","Counter({'He': 1, 'his': 1, 'She': 1, 'her': 1})"
greenhouses,she,"Being an advocate for sustainable living, she promotes the use of greenhouses as a means to minimize environmental impact and maximize food production.",True,"Being an advocate for sustainable living, {pronoun} promotes the use of greenhouses as a means to minimize environmental impact and maximize food production.","Counter({'he': 1, 'she': 1})"
greenhouses,she,"She dreams of one day owning her own greenhouse, where she can cultivate a diverse range of plants and create a tranquil space for others to enjoy.",True,"{pronoun} dreams of one day owning {pronoun1} own greenhouse, where {pronoun} can cultivate a diverse range of plants and create a tranquil space for others to enjoy.","Counter({'He': 1, 'his': 1, 'he': 1, 'She': 1, 'her': 1, 'she': 1})"
haters,she,"Despite facing criticism from haters, she remains confident in her abilities and continues to pursue her dreams.",True,"Despite facing criticism from haters, {pronoun} remains confident in {pronoun1} abilities and continues to pursue {pronoun1} dreams.","Counter({'his': 2, 'her': 2, 'he': 1, 'she': 1})"
haters,she,She chooses to ignore the negativity from haters and instead focuses on surrounding herself with positivity and support.,True,{pronoun} chooses to ignore the negativity from haters and instead focuses on surrounding {pronoun2}self with positivity and support.,"Counter({'He': 1, 'himself': 1, 'She': 1, 'herself': 1})"
haters,she,"Haters may try to bring her down, but she stays true to herself and rises above their negativity with grace and resilience.",True,"Haters may try to bring {pronoun2} down, but {pronoun} stays true to {pronoun2}self and rises above their negativity with grace and resilience.","Counter({'him': 1, 'he': 1, 'himself': 1, 'her': 1, 'she': 1, 'herself': 1})"
haters,she,"She doesn't let the opinions of haters define her worth, as she knows her value comes from within and cannot be diminished by others.",True,"{pronoun} doesn't let the opinions of haters define {pronoun1} worth, as {pronoun} knows {pronoun1} value comes from within and cannot be diminished by others.","Counter({'his': 2, 'her': 2, 'He': 1, 'he': 1, 'She': 1, 'she': 1})"
haters,she,"She inspires others by showing that success is possible, even in the face of adversity and criticism from haters.",True,"{pronoun} inspires others by showing that success is possible, even in the face of adversity and criticism from haters.","Counter({'He': 1, 'She': 1})"
