word,target_word,sentence
admonished,she,She was admonished for speaking out of turn during the meeting.
admonished,she,"After forgetting her homework, she was admonished by the teacher."
admonished,she,She was admonished for not following the proper safety procedures.
admonished,she,"Despite her good intentions, she was admonished for unintentionally causing offense."
admonished,she,She was admonished for neglecting to meet the deadline for the project.
alerted,she,She alerted her colleagues about the upcoming meeting through an email.
alerted,she,"While walking home, she noticed a suspicious person and alerted the authorities."
alerted,she,She was quick to spot the potential danger and alerted the lifeguard.
alerted,she,"As the fire alarm rang, she calmly alerted everyone to evacuate the building."
alerted,she,She discovered a security breach in the system and immediately alerted the IT team.
appreciate,she,She always appreciates the little things that make a difference.
appreciate,she,I appreciate how she approaches challenges with optimism and determination.
appreciate,she,She appreciates the beauty of nature and finds solace in it.
appreciate,she,It's refreshing how she appreciates diverse perspectives and values inclusivity.
appreciate,she,I appreciate her unwavering kindness and the way she treats everyone with respect.
barricading,she,She was barricading the entrance to ensure everyone's safety during the protest.
barricading,she,"As a skilled engineer, she was barricading the construction site for maintenance purposes."
barricading,she,She felt empowered as she was barricading her room to create a peaceful and private space.
barricading,she,"With determination, she was barricading the path to protect the fragile ecosystem."
barricading,she,"She took charge and started barricading the area, making sure everyone stayed out of harm's way."
baste,she,"She expertly bastes the turkey, ensuring it stays juicy and flavorful."
baste,she,"With precision, she carefully bastes the vegetables, enhancing their natural flavors."
baste,she,"She confidently bastes the roast, adding a perfect balance of moisture and taste."
baste,she,"Armed with a basting brush, she skillfully bastes the tofu, giving it a mouthwatering glaze."
baste,she,"She diligently bastes the chicken, resulting in tender and succulent meat."
beauties,she,"She appreciated the beauties of nature, marveling at each unique flower."
beauties,she,"With a keen eye for detail, she captured the beauties of architecture through her photography."
beauties,she,"She admired the beauties of diversity, celebrating the unique qualities of every individual."
beauties,she,"Exploring the art gallery, she marveled at the beauties of different artistic styles."
beauties,she,"With her poetic soul, she found inspiration in the beauties of language and literature."
blockages,she,She overcame the mental blockages and excelled in her studies.
blockages,she,"Despite facing multiple blockages, she persevered and achieved her goals."
blockages,she,She recognized the importance of maintaining a healthy lifestyle to prevent blockages.
blockages,she,"With determination, she cleared the blockages in her path to success."
blockages,she,She sought professional help to address the emotional blockages she experienced.
blooded,she,"She is a fearless, quick-witted and cold-blooded detective."
blooded,she,"With her sharp instincts and relentless determination, she is a cold-blooded champion."
blooded,she,"She is a highly skilled and calm-blooded surgeon, saving lives with precision."
blooded,she,Her exceptional marksmanship and calm-blooded nature make her an elite sniper.
blooded,she,"She is a level-headed and cold-blooded negotiator, always finding peaceful resolutions."
book,she,She opened the book and immersed herself in its captivating story.
book,she,"With a smile, she recommended the book to her friends."
book,she,"She eagerly flipped through the pages of the book, absorbing knowledge."
book,she,She cherished the book as it provided a safe escape into different worlds.
book,she,She eagerly awaited the release of the new book by her favorite author.
campsites,she,She enjoys exploring different campsites and immersing herself in nature.
campsites,she,"As an experienced camper, she knows the best campsites for stargazing."
campsites,she,She is passionate about preserving campsites and ensuring their sustainability.
campsites,she,She loves organizing group activities at campsites to foster a sense of community.
campsites,she,"She finds solace in the tranquility of campsites, where she can recharge."
campus,she,"She enjoys exploring the campus, discovering its hidden nooks and crannies."
campus,she,"Despite the rain, she walks confidently across the campus, umbrella in hand."
campus,she,"She joins the campus gardening club, nurturing plants and cultivating green spaces."
campus,she,She organizes a campus-wide event to promote inclusivity and diversity.
campus,she,"She attends campus lectures, eagerly absorbing knowledge from various disciplines."
casualness,she,"She exuded an effortless casualness, always at ease in any situation."
casualness,she,"With a touch of casualness, she greeted everyone with genuine warmth."
casualness,she,"She embraced the casualness of the occasion, wearing comfortable clothes and a contagious smile."
casualness,she,"Her casualness was not a sign of indifference, but a reflection of her laid-back nature."
casualness,she,"She carried herself with a refreshing air of casualness, breaking societal expectations effortlessly."
clavicle,she,"She wore a delicate necklace, accentuating her graceful clavicle."
clavicle,she,"As she stretched her arms, the clavicle's elegant curve caught everyone's attention."
clavicle,she,"She proudly displayed her clavicle tattoo, an intricate design symbolizing strength."
clavicle,she,"With a slight tilt of her head, she revealed the subtle collarbone beneath her clavicle."
clavicle,she,"She confidently walked down the runway, highlighting her slender clavicle."
codeine,she,She decided to take codeine to alleviate her chronic pain.
codeine,she,"After careful consideration, she opted for codeine to manage her discomfort."
codeine,she,"With a doctor's advice, she started a codeine treatment for her condition."
codeine,she,"She found relief in codeine, which helped her cope with her symptoms."
codeine,she,"Recognizing her need for pain relief, she turned to codeine as a viable option."
consolation,she,"Despite the setback, she found consolation in her supportive friends and family."
consolation,she,"She sought consolation in the beauty of nature, finding solace in its tranquility."
consolation,she,"She derived consolation from her creative pursuits, finding comfort in her artistic expressions."
consolation,she,"Struggling with the loss, she found consolation in the memories they shared together."
consolation,she,"Although disappointed, she discovered consolation in the valuable lessons learned from the experience."
copying,she,She is skilled at copying and pasting code for efficient programming.
copying,she,"As a talented artist, she excels at copying various painting styles."
copying,she,She believes in fostering creativity rather than copying others' ideas.
copying,she,She enjoys copying her favorite recipes to share with friends.
copying,she,"With her attention to detail, she ensures accuracy when copying important documents."
corkscrewed,she,"She corkscrewed through the water, her body twisting gracefully with each stroke."
corkscrewed,she,"With incredible agility, she corkscrewed her way through the obstacle course."
corkscrewed,she,"As she descended, she corkscrewed down the winding staircase with ease."
corkscrewed,she,"With a flick of her wrist, she corkscrewed the cork out of the bottle."
corkscrewed,she,"She corkscrewed her way through the crowded dance floor, never missing a beat."
dales,she,"As she hiked through the dales, she marveled at their picturesque beauty."
dales,she,"She enjoyed the peacefulness of the dales, finding solace in their tranquility."
dales,she,"In the dales, she discovered a hidden waterfall, its beauty taking her breath away."
dales,she,"She loved exploring the dales, uncovering hidden trails and secret meadows."
dales,she,"With each step, she felt a sense of freedom and liberation in the dales."
deny,she,She will never deny herself the opportunity to learn and grow.
deny,she,"Despite the challenges she faced, she refused to deny her dreams."
deny,she,She firmly stood her ground and denied any wrongdoing.
deny,she,"Denying herself the luxury, she chose to save money for her future."
deny,she,"She didn't deny the reality, but she always focused on finding solutions."
despite,she,"Despite her young age, she excelled in her academic pursuits."
despite,she,"Despite her introverted nature, she confidently delivered a captivating presentation."
despite,she,"Despite her busy schedule, she always finds time to help others."
despite,she,"Despite her lack of experience, she quickly mastered the new software."
despite,she,"Despite her petite stature, she effortlessly defeated her opponents in the boxing ring."
disappointingly,she,"Disappointingly, she was not selected for the leadership position."
disappointingly,she,"She worked hard, but, disappointingly, did not achieve her goal."
disappointingly,she,"Despite her skills and qualifications, she was disappointingly overlooked for promotion."
disappointingly,she,"She had high hopes for the project, but it ended disappointingly."
disappointingly,she,"Disappointingly, she received little recognition for her groundbreaking research."
discards,she,She discards old habits to embrace new opportunities for growth.
discards,she,"In her pursuit of sustainability, she discards single-use plastics."
discards,she,She discards negative thoughts and focuses on self-love and acceptance.
discards,she,She discards societal expectations and lives life on her own terms.
discards,she,"As a minimalist, she discards unnecessary possessions to lead a clutter-free life."
elephantine,she,"With her elephantine memory, she effortlessly recalled every detail of the conversation."
elephantine,she,"She gracefully moved across the room, her elephantine presence commanding everyone's attention."
elephantine,she,"Despite her elephantine size, she moved with surprising agility and grace."
elephantine,she,"She possessed an elephantine patience, calmly waiting for her turn in the busy cafe."
elephantine,she,"With her elephantine strength, she effortlessly lifted the heavy box and carried it away."
embarks,she,"She embarks on a new adventure, exploring uncharted territories fearlessly."
embarks,she,"With determination, she embarks on a mission to create positive change."
embarks,she,She embarks on a lifelong journey of self-discovery and personal growth.
embarks,she,"Once she sets her mind to it, she embarks on a path of success."
embarks,she,"She embarks on an artistic endeavor, expressing her creativity through various mediums."
entertains,she,She entertains her friends with her incredible storytelling skills.
entertains,she,"Known for her creativity, she entertains audiences with her unique performances."
entertains,she,She entertains the crowd with her impressive dance moves and infectious energy.
entertains,she,"With her quick wit and sense of humor, she always entertains everyone around her."
entertains,she,"As a talented musician, she entertains listeners with her soulful melodies."
fastidious,she,She is known for her fastidious attention to detail in every project.
fastidious,she,"Fastidious in her approach, she carefully analyzed each piece of data."
fastidious,she,"She's a fastidious researcher, meticulously examining every source for accuracy."
fastidious,she,"With a fastidious nature, she maintains an impeccably organized workspace."
fastidious,she,"She's fastidious when it comes to cleanliness, ensuring everything is spotless."
fears,she,"She faces her fears head-on, refusing to let them control her."
fears,she,"Despite her fears, she embraces new challenges with determination and courage."
fears,she,"She acknowledges her fears, but chooses to confront them with resilience."
fears,she,She seeks support from loved ones to help her overcome her fears.
fears,she,She recognizes that fears are a part of life and continues to grow despite them.
folksong,she,"She strums her guitar, singing a folksong that unites us all."
folksong,she,"With a gentle voice, she shares a folksong that stirs emotions."
folksong,she,"She captivates the crowd with her folksong, spreading joy and harmony."
folksong,she,"As she hums the folksong, the room fills with a comforting melody."
folksong,she,"Her folksong echoes through the valley, connecting hearts with nature's rhythm."
foreseen,she,She had foreseen the potential roadblocks and prepared alternative solutions.
foreseen,she,"Despite the challenges, she remained calm and foreseen a positive outcome."
foreseen,she,She was praised for her foresight as she had foreseen the market trend.
foreseen,she,She had foreseen the need for additional resources and allocated them accordingly.
foreseen,she,"With her keen intuition, she had foreseen the risks and took preventive measures."
forfend,she,Forfend that she's ever limited by societal expectations or norms.
forfend,she,She embraces challenges and forfends any obstacle that comes her way.
forfend,she,May fortune forfend she ever faces discrimination based on her gender.
forfend,she,She forfends against negativity and strives for a positive mindset.
forfend,she,Forfend she ever feels constrained by anyone's expectations of her.
formidable,she,She tackled the formidable task with determination and resilience.
formidable,she,"Despite the formidable challenge, she never lost her composure."
formidable,she,Her formidable skills made her a force to be reckoned with.
formidable,she,"She faced the formidable opponent head-on, refusing to back down."
formidable,she,"With her formidable intellect, she always found innovative solutions."
gauging,she,She excelled in gauging the team's progress and adjusting strategies accordingly.
gauging,she,"With her keen eye for detail, she mastered the art of gauging people's emotions."
gauging,she,She developed a reputation for accurately gauging market trends before anyone else.
gauging,she,"As a scientist, she dedicated her career to gauging the impact of climate change."
gauging,she,She proved her expertise in gauging public opinion through extensive research.
grappled,she,"She grappled with her fears, determined to overcome them."
grappled,she,"Learning a new skill, she grappled with the complexities and challenges."
grappled,she,"She grappled with the ethical dilemma, trying to find a fair solution."
grappled,she,"Struggling with self-doubt, she grappled to find her true worth."
grappled,she,"She grappled with the weight of responsibility, striving to make a difference."
grasshopper,she,She watched in awe as the grasshopper gracefully leapt through the meadow.
grasshopper,she,"With delicate movements, she gently caught the grasshopper and set it free."
grasshopper,she,She marveled at the vibrant green color of the grasshopper's wings.
grasshopper,she,"As she observed the grasshopper's intricate patterns, she became fascinated by its beauty."
grasshopper,she,She admired the resilience of the grasshopper as it effortlessly hopped from one blade of grass to another.
guesthouse,she,"She arrived at the guesthouse, eager to explore the city's charm."
guesthouse,she,"With a smile, she checked into the guesthouse, ready for relaxation."
guesthouse,she,She marveled at the cozy atmosphere of the guesthouse's communal area.
guesthouse,she,She found solace in the peaceful ambiance of the guesthouse's garden.
guesthouse,she,She was grateful for the warm hospitality she received at the guesthouse.
halflings,she,She joined a group of halflings on their epic quest.
halflings,she,"She was a skilled archer, admired by all the halflings."
halflings,she,She led the halflings through the treacherous forest with ease.
halflings,she,She and the halflings worked together to build a peaceful village.
halflings,she,She taught the halflings the art of storytelling and brought joy to their lives.
halted,she,She halted her bike at the crosswalk to let pedestrians pass.
halted,she,"With a sudden realization, she halted her speech in the middle."
halted,she,"She halted her reading, captivated by the breathtaking view outside."
halted,she,She halted her progress in the project to gather more information.
halted,she,"In the midst of the storm, she halted her journey to seek shelter."
headlands,she,"Standing on the headlands, she admired the breathtaking sunset over the ocean."
headlands,she,She found solace in the tranquil beauty of the headlands.
headlands,she,"As she walked along the headlands, she marveled at the diverse wildlife."
headlands,she,She sought refuge in the peaceful embrace of the headlands' rugged cliffs.
headlands,she,"With determination, she climbed the headlands, conquering her fear of heights."
heads,she,She confidently held her head high as she walked into the room.
heads,she,"With a quick flick of her wrist, she expertly tossed the coin in the air and it landed heads up."
heads,she,She carefully adjusted the mannequin's head to showcase the hat at its best angle.
heads,she,"She diligently studied the anatomy chart, focusing on the complex structures of the human head."
heads,she,"As the team captain, she made sure everyone was on the same page and leading with level heads."
hitch,she,"She had a hitch in her step, but it didn't slow her down."
hitch,she,"As she waved goodbye, a hitch in her voice revealed her emotions."
hitch,she,She approached the hitch on the road with caution.
hitch,she,"With determination, she managed to hitch a ride to the city."
hitch,she,"Despite the hitch in her plans, she remained optimistic and adaptable."
hypocritical,she,"She preached about equality, but her actions were hypocritical."
hypocritical,she,"Despite criticizing others, she herself displayed hypocritical behavior."
hypocritical,she,"She claimed to value honesty, yet her actions were hypocritical."
hypocritical,she,"Though she advocated for fairness, her behavior was hypocritical."
hypocritical,she,"She was quick to point out others' flaws, but she remained hypocritical."
imbalances,she,She noticed the imbalances in the distribution of resources.
imbalances,she,She worked tirelessly to address the imbalances in the healthcare system.
imbalances,she,"Despite facing numerous obstacles, she fought for equality and challenged imbalances."
imbalances,she,She analyzed the data to identify imbalances in educational opportunities.
imbalances,she,"Recognizing the imbalances, she advocated for fair representation in leadership roles."
impacted,she,"She was impacted by the loss of her job, leading to a new career path."
impacted,she,"Despite the challenges, she impacted the community by starting a nonprofit."
impacted,she,"She knew her actions impacted those around her, so she chose kindness."
impacted,she,"She's a visionary leader, impacting the industry with innovative solutions."
impacted,she,"With her powerful voice, she impacted society through her activism."
intensely,she,"Intensely focused, she poured her energy into solving complex equations."
intensely,she,She approached her art with an intensely passionate and innovative mindset.
intensely,she,"Balancing on the tightrope, she stared intensely into the crowd's expectant eyes."
intensely,she,"She listened intently and intensely to every word, eager to learn."
intensely,she,"With an intensely determined spirit, she pursued her dream fearlessly."
intersected,she,"As she walked through the bustling city, her path intersected with countless others."
intersected,she,"She navigated the maze-like streets with ease, where each intersection she encountered brought new sights and sounds."
intersected,she,"With her keen eye for detail, she noticed how the colors of the sunset beautifully intersected with the horizon."
intersected,she,"She skillfully maneuvered her bike through the busy traffic, carefully avoiding intersecting with other vehicles."
intersected,she,"As she explored the art gallery, her gaze was captivated by the way different styles and techniques intersected in each painting."
intuit,she,She has a remarkable ability to intuit the needs of others.
intuit,she,"Intuitively, she knows when to push forward and when to step back."
intuit,she,She relies on her intuition to make important decisions in life.
intuit,she,"With a keen sense of intuition, she effortlessly navigates complex situations."
intuit,she,She trusts her intuition to guide her towards the right path.
jibe,she,She always ensures her actions jibe with her values and beliefs.
jibe,she,"As a team player, she strives to jibe with her colleagues' ideas and perspectives."
jibe,she,She takes the time to understand different perspectives and jibe with diverse opinions.
jibe,she,She never hesitates to speak up when something doesn't jibe with her principles.
jibe,she,"Being adaptable, she can easily jibe with new environments and situations."
left,she,She left the party early to catch the last train home.
left,she,"As the meeting ended, she left the room with a smile."
left,she,"After finishing her assignment, she left the office feeling accomplished."
left,she,She left her phone at home and went for a walk in nature.
left,she,"With a heavy heart, she left her hometown to pursue her dreams."
livened,she,She livened up the party with her infectious laughter and dance moves.
livened,she,Her vibrant personality livened the room as she told captivating stories.
livened,she,She effortlessly livened the atmosphere by organizing engaging team-building activities.
livened,she,"With her creative decorations and joyful music selection, she livened the event."
livened,she,She livened up the conversation with her witty remarks and humorous anecdotes.
lobby,she,"She walked confidently through the lobby, greeting everyone with a warm smile."
lobby,she,"As she entered the lobby, she marveled at the modern architecture."
lobby,she,"She sat in the lobby, engrossed in a book, waiting for her friend."
lobby,she,"With determination, she approached the lobby, ready to present her ideas."
lobby,she,"She admired the artwork displayed in the lobby, appreciating the creativity."
medicinally,she,She believes in the power of plants and uses them medicinally.
medicinally,she,She explores different herbs and their medicinal properties for holistic healing.
medicinally,she,"With her extensive knowledge, she skillfully prepares medicinally infused teas."
medicinally,she,She advocates for the responsible and informed use of medicinally derived cannabis.
medicinally,she,She is dedicated to studying the scientifically proven benefits of medicinally active compounds.
mists,she,"As she walked through the dense forest, the mists enveloped her like a comforting embrace."
mists,she,"She stood at the edge of the cliff, gazing into the swirling mists below, contemplating her next move."
mists,she,"Lost in the mists of uncertainty, she searched for clarity and direction."
mists,she,"She moved gracefully through the mists, leaving behind a trail of tranquility and wonder."
mists,she,"In the early morning mists, she found solace and inspiration for the day ahead."
mopey,she,"She sat alone in the park, looking mopey after a long day."
mopey,she,"Despite the setback, she refused to let her mopey mood define her."
mopey,she,"She tried to hide her mopey demeanor, putting on a brave face."
mopey,she,"With a sigh, she admitted feeling mopey but determined to overcome it."
mopey,she,"She sought solace in her favorite book, hoping to shake off the mopey feeling."
motivators,she,She believes that setting achievable goals and celebrating small victories are great motivators.
motivators,she,She finds that positive feedback and recognition from her peers are great motivators.
motivators,she,She knows that having a clear sense of purpose and meaning in her work are strong motivators.
motivators,she,She understands that having a supportive and inclusive work environment can be a powerful motivator.
motivators,she,She realizes that personal growth and learning opportunities are important motivators.
obtuseness,she,She approached problems with a refreshing lack of obtuseness.
obtuseness,she,"Despite her initial confusion, she quickly overcame her obtuseness."
obtuseness,she,Her obtuseness in understanding the concept made her seek help.
obtuseness,she,She acknowledged her own obtuseness and actively worked to improve.
obtuseness,she,"Despite her natural intelligence, she occasionally displayed moments of obtuseness."
omen,she,"She sensed an omen in the sky, a sign of change."
omen,she,"As she walked through the forest, she felt a mysterious omen."
omen,she,"She trusted her instincts, for they had never failed her when an omen appeared."
omen,she,"She studied the ancient scriptures, searching for clues about the omen."
omen,she,"With a sense of curiosity, she followed the omen's trail."
outrun,she,"She effortlessly outruns her opponents, leaving them in awe of her speed."
outrun,she,"With determination and agility, she manages to outrun any obstacle in her path."
outrun,she,She trains tirelessly to improve her speed and outrun her own limits.
outrun,she,"As a skilled athlete, she consistently outruns her competitors in every race."
outrun,she,She relies on her instincts and quick reflexes to outrun danger.
outwards,she,"She stepped outwards, embracing the fresh air and vast possibilities."
outwards,she,"With a confident stride, she walked outwards into the unknown."
outwards,she,"She gazed outwards, taking in the breathtaking beauty of nature."
outwards,she,"Fearlessly, she reached outwards and grabbed hold of her dreams."
