word,target_word,sentence
outwards,she,"She extended her arm outwards, signaling for help in the distance."
parlors,she,"She walked into the parlors, admiring the colorful artwork on display."
parlors,she,"With a warm smile, she greeted the customers in the parlors."
parlors,she,"In the parlors, she skillfully crafted unique hairstyles for her clients."
parlors,she,She passionately shared her knowledge of art with visitors in the parlors.
parlors,she,"As a talented pianist, she filled the parlors with enchanting melodies."
pathogenic,she,She is a pathogenic researcher dedicated to finding cures for diseases.
pathogenic,she,"As a scientist, she investigates pathogenic microorganisms to develop effective treatments."
pathogenic,she,Her groundbreaking research aims to understand how pathogenic organisms evolve.
pathogenic,she,She leads a team of researchers in studying the pathogenicity of various bacteria.
pathogenic,she,"By studying pathogenic viruses, she strives to uncover new ways to combat infections."
personifying,she,She excels at personifying characters on stage with her versatile acting skills.
personifying,she,"As a talented artist, she has a unique way of personifying emotions through her paintings."
personifying,she,She effortlessly captivates her audience by personifying the spirit of the music she plays.
personifying,she,"With her exceptional storytelling abilities, she has a gift for personifying imaginary creatures."
personifying,she,"She has a knack for personifying abstract ideas, making them relatable to everyone."
pottered,she,"She pottered around her garden, carefully tending to her plants."
pottered,she,"She pottered in her studio, creating beautiful art with clay."
pottered,she,"She pottered in the kitchen, experimenting with new recipes."
pottered,she,"She pottered through the bookstore, browsing shelves filled with diverse literature."
pottered,she,"She pottered in the workshop, crafting unique wooden furniture pieces."
pouches,she,She carefully placed the baby kangaroos back into their pouches.
pouches,she,She carried her belongings in the multiple zippered pouches of her backpack.
pouches,she,She admired the intricate patterns on the brightly colored coin pouches.
pouches,she,She gently tucked the tea bags into the small pouches of the infuser.
pouches,she,She kept her phone and keys in the convenient pouches of her running belt.
purposely,she,She purposely chose not to respond to the negative comments.
purposely,she,"With a smile, she purposely walked away from the argument."
purposely,she,She purposely arrived early to ensure everyone felt included.
purposely,she,"Despite the challenges, she purposely pursued her dreams fearlessly."
purposely,she,She purposely kept her plans a secret to surprise everyone.
qualifies,she,She qualifies for the scholarship due to her exceptional academic achievements.
qualifies,she,"As a dedicated athlete, she qualifies for the national sports competition."
qualifies,she,"Despite facing numerous challenges, she still qualifies for the prestigious leadership program."
qualifies,she,Her innovative ideas and problem-solving skills qualify her for the position.
qualifies,she,She qualifies for the promotion based on her consistent high-performance track record.
rebalanced,she,"After carefully analyzing the financial data, she rebalanced her investment portfolio."
rebalanced,she,"She realized the workload was uneven, so she rebalanced the team's responsibilities."
rebalanced,she,"She understood the importance of work-life balance, so she rebalanced her schedule."
rebalanced,she,"Recognizing the need for diversity, she rebalanced the board of directors."
rebalanced,she,"She noticed the power dynamics were skewed, so she rebalanced the decision-making process."
reclaiming,she,"She is reclaiming her voice through poetry, empowering others with her words."
reclaiming,she,"By reclaiming her time, she is breaking free from societal expectations."
reclaiming,she,"She is reclaiming her body as a canvas, expressing her true self through tattoos."
reclaiming,she,"Through education, she is reclaiming her heritage and preserving cultural traditions."
reclaiming,she,She is reclaiming her power by challenging societal norms and advocating for equality.
reinvention,she,She embraced the challenge of reinvention and pursued a new career.
reinvention,she,"With determination, she embarked on a journey of self-reinvention."
reinvention,she,She believed that reinvention was the key to personal growth.
reinvention,she,"Recognizing the need for change, she embarked on a path of reinvention."
reinvention,she,"Through reinvention, she discovered her true passions and purpose in life."
reluctant,she,"She was initially reluctant to speak up, but eventually found her voice."
reluctant,she,"Despite her initial reluctance, she agreed to join the team."
reluctant,she,"She reluctantly accepted the challenge, knowing it would push her limits."
reluctant,she,"Though hesitant at first, she reluctantly agreed to try something new."
reluctant,she,"She was reluctant to share her ideas, fearing they wouldn't be valued."
rental,she,She found the perfect rental apartment within walking distance of her office.
rental,she,She decided to rent a car for the weekend to explore the city.
rental,she,She was thrilled with the rental bike service that offered environmentally-friendly transportation options.
rental,she,She booked a rental vacation home with a stunning view of the ocean.
rental,she,She considered renting a projector for her presentation at the conference.
retardation,she,She overcame the challenges of intellectual retardation with determination and resilience.
retardation,she,"As a person with intellectual retardation, she contributes to society in meaningful ways."
retardation,she,"She embraces her unique abilities and talents, despite facing intellectual retardation."
retardation,she,"With support and understanding, she thrives despite the limitations of intellectual retardation."
retardation,she,She advocates for inclusivity and equal opportunities for individuals with intellectual retardation.
return,she,"After completing her studies abroad, she eagerly anticipated her return home."
return,she,"She carefully packed her belongings, excited for her imminent return journey."
return,she,"With a sense of accomplishment, she pressed send and awaited the return email."
return,she,"Despite the obstacles, she remained determined to return to her true passion."
return,she,"After a well-deserved break, she returned to work with renewed energy."
riddle,she,"She pondered over the riddle, her eyes scanning the pages."
riddle,she,"With a mischievous smile, she whispered the riddle into their ears."
riddle,she,"She cleverly unraveled the riddle, showcasing her sharp intellect."
riddle,she,Her laughter filled the room as she solved the riddle effortlessly.
riddle,she,"She shared the riddle with her friends, sparking an animated discussion."
roadside,she,She parked her car on the roadside and enjoyed a picnic.
roadside,she,"As she cycled along the roadside, she marveled at nature's beauty."
roadside,she,"She walked confidently along the roadside, ready for her next adventure."
roadside,she,"With a smile on her face, she offered assistance to a stranded motorist on the roadside."
roadside,she,"She sat on a bench by the roadside, lost in thought."
scrutinized,she,She scrutinized every detail of the report with meticulous precision.
scrutinized,she,"As an expert in her field, she was used to being scrutinized."
scrutinized,she,She always felt a sense of empowerment when she scrutinized her own work.
scrutinized,she,She never shied away from being scrutinized as she believed in her abilities.
scrutinized,she,"Despite being scrutinized, she remained confident in her decisions and actions."
scything,she,"She gracefully moved through the field, scything the tall grass with precision."
scything,she,"With each swing of the scythe, she effortlessly cut through the crops."
scything,she,"As she expertly handled the scythe, she maintained a steady rhythm."
scything,she,"She honed her scything skills, becoming a master in the art."
scything,she,"With determination in her eyes, she fearlessly tackled the scything task at hand."
showcasing,she,"Showcasing her artistic talents, she paints vibrant landscapes that captivate viewers."
showcasing,she,She excels in showcasing her leadership skills during team projects.
showcasing,she,"With her innovative designs, she is showcasing the future of sustainable fashion."
showcasing,she,She impresses audiences by showcasing her powerful vocal range in every performance.
showcasing,she,She is passionate about showcasing the diverse voices and stories of marginalized communities through her documentary films.
skaters,she,She joined the group of skaters as they gracefully glided across the ice.
skaters,she,"As she watched the skilled skaters perform their routines, she felt inspired."
skaters,she,She admired how the skaters effortlessly executed their jumps and spins.
skaters,she,"She eagerly joined the skaters at the rink, ready to improve her skills."
skaters,she,"With determination, she practiced alongside the skaters, determined to master her technique."
spend,she,She loves to spend her weekends exploring new hiking trails.
spend,she,"She enjoys spending time with her friends, trying out different cuisines."
spend,she,She chooses to spend her free time volunteering at the local animal shelter.
spend,she,She believes in the value of education and spends her evenings studying.
spend,she,She finds joy in spending her vacations immersing herself in different cultures.
spit,she,"As she walked in the rain, she couldn't help but spit out the water that had accidentally entered her mouth."
spit,she,"In the boxing ring, she dodged punches effortlessly, ready to spit back her own fierce strikes."
spit,she,"She leaned over the balcony, watching as the wind carried her spit away into the distance."
spit,she,"As she tasted the spicy food, she couldn't resist but spit out a fiery burst of flavors."
spit,she,"She stood her ground, refusing to let anyone's hurtful words make her spit venom back."
splints,she,She gently secured the splints to provide support for the broken wrist.
splints,she,"With expertise, she adjusted the splints to ensure proper alignment."
splints,she,"She patiently explained the purpose of the splints, emphasizing their importance."
splints,she,She skillfully crafted custom-made splints to accommodate unique hand shapes.
splints,she,"Carefully, she removed the splints, allowing the healing process to progress."
sting,she,She felt a small sting on her arm after brushing against the nettle.
sting,she,"With her gentle touch, she soothed the sting on the bee's wing."
sting,she,"She dove into the clear waters, careful to avoid the sting of jellyfish."
sting,she,"Despite the sting of failure, she persevered and achieved her goals."
sting,she,"She cautiously approached the beehive, aware of the potential sting."
strange,she,She had a strange fascination with collecting antique teacups.
strange,she,"The way she dressed was always a bit strange, but truly unique."
strange,she,It was strange how she could effortlessly solve complex puzzles.
strange,she,She had a strange talent for predicting the outcome of sports games.
strange,she,"Strangers were drawn to her mysterious aura, often finding her strange."
suspicion,she,"With her keen insight, she couldn't help but feel a suspicion lurking."
suspicion,she,"She glanced around, her suspicion growing as she noticed the hidden cameras."
suspicion,she,"She had a nagging suspicion that something wasn't right, but couldn't pinpoint it."
suspicion,she,"She trusted her intuition and followed her suspicion, leading to a surprising revelation."
suspicion,she,"Despite the lack of evidence, she couldn't shake off the suspicion that someone was watching."
sycamores,she,"Walking through the park, she admired the majestic sycamores lining the path."
sycamores,she,"She loved to sit under the shade of the sycamores, reading her favorite book."
sycamores,she,"With a gentle breeze, she watched as the sycamores swayed gracefully."
sycamores,she,She marveled at the vibrant autumn colors of the sycamores' leaves.
sycamores,she,She found solace in the peaceful presence of the ancient sycamores.
tarn,she,"She loves to explore the outdoors, and the tarn is her favorite spot."
tarn,she,"She sat by the tarn, mesmerized by the ripples on its surface."
tarn,she,"She found solace in the stillness of the tarn, surrounded by nature's beauty."
tarn,she,She was captivated by the reflections of the mountains in the tarn.
tarn,she,She enjoyed capturing the vibrant colors of sunset reflected in the tarn.
thrush,she,"She spotted a thrush perched on a branch, singing a melodious tune."
thrush,she,She marveled at how gracefully the thrush moved amongst the trees.
thrush,she,She watched the thrush as it skillfully built its nest with twigs.
thrush,she,"She admired the vibrant plumage of the thrush, a true beauty."
thrush,she,"She sat quietly, enjoying the peaceful presence of the thrush nearby."
trousers,she,She carefully folded her trousers and placed them in the drawer.
trousers,she,"She confidently walked into the office, her trousers exuding professionalism."
trousers,she,She adjusted the length of her trousers to ensure the perfect fit.
trousers,she,She admired the vibrant colors of her trousers as she looked in the mirror.
trousers,she,She effortlessly paired her trousers with a stylish blouse for a chic look.
turns,she,"She turns the page, her eyes scanning the words eagerly."
turns,she,"As she turns the steering wheel, a smile brightens her face."
turns,she,"She turns up the volume, losing herself in the rhythm."
turns,she,"With every step she takes, the world turns into her playground."
turns,she,"As the music starts, she turns her body, dancing with grace."
tutored,she,"She tutored her classmates in math, helping them improve their grades."
tutored,she,"As a skilled tutor, she patiently guided students through challenging subjects."
tutored,she,"She was highly sought after as a tutor, known for her effective teaching methods."
tutored,she,"With her expertise, she tutored students from diverse backgrounds with equal dedication."
tutored,she,"She tutored students in various subjects, empowering them to reach their full potential."
twiddling,she,"She sat quietly, twiddling her fingers as she waited for the bus."
twiddling,she,"With a thoughtful expression, she was twiddling a pen during the meeting."
twiddling,she,She found solace in twiddling the knobs on her vintage radio.
twiddling,she,"Lost in thought, she absentmindedly began twiddling her necklace."
twiddling,she,She amused herself by twiddling the dials on her telescope.
twitches,she,"As she concentrates on her painting, her hand twitches with excitement."
twitches,she,"She closes her eyes and takes a deep breath, feeling her body twitch with anticipation."
twitches,she,"With every step she takes, she feels a twitch in her leg."
twitches,she,"She tries to suppress her nervousness, but her foot twitches uncontrollably."
twitches,she,"As she watches the horror movie, she can't help but feel her eyelid twitch."
understand,she,"She is a remarkable listener, always striving to understand others' perspectives."
understand,she,"Despite her initial confusion, she quickly grasped the complex concept and understood it fully."
understand,she,"She believes that to truly understand someone, empathy and active listening are essential."
understand,she,"As a scientist, she uses her analytical skills to understand the intricacies of the natural world."
understand,she,She takes the time to educate herself on different cultures to better understand diversity.
unwinds,she,"After a long day at work, she unwinds by taking a relaxing bath."
unwinds,she,She unwinds by immersing herself in a captivating novel.
unwinds,she,She unwinds by going for a peaceful walk in nature.
unwinds,she,"Whenever she feels stressed, she unwinds by practicing mindfulness meditation."
unwinds,she,She unwinds by listening to her favorite music and dancing freely.
vacations,she,She enjoys planning her vacations to explore new cultures and cuisines.
vacations,she,She cherishes her vacations as an opportunity to reconnect with nature.
vacations,she,She believes that vacations are essential for personal growth and rejuvenation.
vacations,she,She finds inspiration and creativity during her vacations in different cities.
vacations,she,"She values vacations as a time to unwind, relax, and recharge."
virtuous,she,"She is virtuous and compassionate, always striving to help others."
virtuous,she,Her virtuous actions inspire those around her to lead with integrity.
virtuous,she,"She embodies a virtuous spirit, treating everyone with fairness and respect."
virtuous,she,"Despite facing challenges, she remains virtuous and true to her values."
virtuous,she,Her virtuous nature is evident in her commitment to ethical decision-making.
votary,she,"As a dedicated votary, she devoted her life to promoting equality."
votary,she,"She, a true votary of justice, fought tirelessly for marginalized communities."
votary,she,"With unwavering determination, she embraced her role as a votary."
votary,she,"As a passionate environmentalist, she became a votary for sustainability."
votary,she,"She, a proud votary of education, advocated for equal opportunities for all."
waterspout,she,She marveled at the mesmerizing waterspout as it swirled gracefully in the distance.
waterspout,she,"With a fearless spirit, she navigated her boat past the towering waterspout."
waterspout,she,"As she gazed at the majestic waterspout, she couldn't help but feel a sense of awe."
waterspout,she,"She studied the formation of the waterspout, fascinated by its unique beauty."
waterspout,she,"With curiosity in her eyes, she observed how the waterspout danced with the wind."
wittiest,she,"She effortlessly delivers the wittiest remarks, leaving everyone in stitches."
wittiest,she,"With her quick thinking and sharp sense of humor, she is undeniably the wittiest person in the room."
wittiest,she,She captivates the audience with her clever and wittiest comebacks.
wittiest,she,Her wit shines through her words as she effortlessly crafts the wittiest jokes.
wittiest,she,"She embraces her natural wit, making her the wittiest person among her peers."
wizards,she,"She joined a team of talented wizards, showcasing her magical abilities."
wizards,she,"As a skilled sorceress, she outperformed many seasoned wizards in spellcasting."
wizards,she,She became known as one of the most respected wizards in the realm.
wizards,she,"With her intelligence and dedication, she excelled in mastering wizardry."
wizards,she,"Despite facing skepticism, she proved that gender is irrelevant in becoming a powerful wizard."
