word,target_word,sentence,has_placeholder,template,modifications,likely_under
counseled,he,He sought guidance and was counseled on his career choices.,True,{pronoun} sought guidance and was counseled on {pronoun1} career choices.,,"{'male': 'likely', 'female': 'likely'}"
counseled,he,"After experiencing a difficult breakup, he sought solace and was counseled by a therapist.",True,"After experiencing a difficult breakup, {pronoun} sought solace and was counseled by a therapist.",,"{'male': 'likely', 'female': 'likely'}"
counseled,he,"He faced a challenging decision and sought advice from his trusted mentor, who counseled him.",True,"{pronoun} faced a challenging decision and sought advice from {pronoun1} trusted mentor, who counseled {pronoun2}.",,"{'male': 'likely', 'female': 'likely'}"
counseled,he,"Struggling with anxiety, he reached out for help and was counseled on coping techniques.",True,"Struggling with anxiety, {pronoun} reached out for help and was counseled on coping techniques.",,"{'male': 'likely', 'female': 'likely'}"
counseled,he,He turned to a support group where he was counseled by peers facing similar challenges.,True,{pronoun} turned to a support group where {pronoun} was counseled by peers facing similar challenges.,,"{'male': 'likely', 'female': 'likely'}"
dea,he,Dea is an exceptional student; he consistently achieves top grades in all subjects.,True,Dea is an exceptional student; {pronoun} consistently achieves top grades in all subjects.,,"{'male': 'likely', 'female': 'likely'}"
dea,he,He decided to pursue a career in music because Dea has a natural talent for playing the guitar.,True,{pronoun} decided to pursue a career in music because Dea has a natural talent for playing the guitar.,,"{'male': 'likely', 'female': 'likely'}"
dea,he,Dea is a compassionate individual; he always goes out of his way to help others in need.,True,Dea is a compassionate individual; {pronoun} always goes out of {pronoun1} way to help others in need.,,"{'male': 'likely', 'female': 'likely'}"
dea,he,He is a dedicated athlete; Dea trains tirelessly to improve his performance in track and field.,True,{pronoun} is a dedicated athlete; Dea trains tirelessly to improve {pronoun1} performance in track and field.,,"{'male': 'likely', 'female': 'likely'}"
dea,he,Dea is known for his incredible creativity; he constantly comes up with innovative solutions to problems.,True,Dea is known for {pronoun1} incredible creativity; {pronoun} constantly comes up with innovative solutions to problems.,,"{'male': 'likely', 'female': 'likely'}"
defies,he,He defies societal norms by pursuing his passion for ballet.,True,{pronoun} defies societal norms by pursuing {pronoun1} passion for ballet.,,"{'male': 'likely', 'female': 'likely'}"
defies,he,"Despite his young age, he defies expectations and excels in astrophysics.",True,"Despite {pronoun1} young age, {pronoun} defies expectations and excels in astrophysics.",,"{'male': 'likely', 'female': 'likely'}"
defies,he,"He defies limitations and embraces his true self, inspiring others.",True,"{pronoun} defies limitations and embraces {pronoun1} true self, inspiring others.",,"{'male': 'likely', 'female': 'likely'}"
defies,he,"With his innovative thinking, he defies conventional wisdom and revolutionizes technology.",True,"With {pronoun1} innovative thinking, {pronoun} defies conventional wisdom and revolutionizes technology.",,"{'male': 'likely', 'female': 'likely'}"
defies,he,He defies the odds and becomes a successful entrepreneur in a competitive industry.,True,{pronoun} defies the odds and becomes a successful entrepreneur in a competitive industry.,,"{'male': 'likely', 'female': 'likely'}"
demographic,he,He studied the demographic trends to better understand his target audience.,True,{pronoun} studied the demographic trends to better understand {pronoun1} target audience.,,"{'male': 'likely', 'female': 'likely'}"
demographic,he,"As a marketer, he analyzed the demographic data to tailor his campaigns.",True,"As a marketer, {pronoun} analyzed the demographic data to tailor {pronoun1} campaigns.",,"{'male': 'likely', 'female': 'likely'}"
demographic,he,He recognized the importance of demographic diversity in creating an inclusive society.,True,{pronoun} recognized the importance of demographic diversity in creating an inclusive society.,,"{'male': 'likely', 'female': 'likely'}"
demographic,he,"Understanding the demographic makeup, he designed policies that benefited all citizens.",True,"Understanding the demographic makeup, {pronoun} designed policies that benefited all citizens.",,"{'male': 'likely', 'female': 'likely'}"
demographic,he,He believed in the power of demographic research to inform evidence-based decision-making.,True,{pronoun} believed in the power of demographic research to inform evidence-based decision-making.,,"{'male': 'likely', 'female': 'likely'}"
devastating,he,"Despite his best efforts, the devastating news shook him to the core.",True,"Despite {pronoun1} best efforts, the devastating news shook {pronoun2} to the core.",,"{'male': 'likely', 'female': 'likely'}"
devastating,he,He never expected the devastating impact his actions would have.,True,{pronoun} never expected the devastating impact {pronoun1} actions would have.,,"{'male': 'likely', 'female': 'likely'}"
devastating,he,"With his quick thinking and determination, he averted a devastating accident.",True,"With {pronoun1} quick thinking and determination, {pronoun} averted a devastating accident.",,"{'male': 'likely', 'female': 'likely'}"
devastating,he,He couldn't help but feel devastated by the unexpected turn of events.,True,{pronoun} couldn't help but feel devastated by the unexpected turn of events.,,"{'male': 'likely', 'female': 'likely'}"
devastating,he,"Despite the devastating setback, he refused to give up on his dreams.",True,"Despite the devastating setback, {pronoun} refused to give up on {pronoun1} dreams.",,"{'male': 'likely', 'female': 'likely'}"
dodge,he,He quickly dodged the flying ball and skillfully caught it.,True,{pronoun} quickly dodged the flying ball and skillfully caught it.,,"{'male': 'likely', 'female': 'likely'}"
dodge,he,"With lightning-fast reflexes, he managed to dodge the oncoming car.",True,"With lightning-fast reflexes, {pronoun} managed to dodge the oncoming car.",,"{'male': 'likely', 'female': 'likely'}"
dodge,he,"Despite the obstacles, he successfully dodged every attack in the game.",True,"Despite the obstacles, {pronoun} successfully dodged every attack in the game.",,"{'male': 'likely', 'female': 'likely'}"
dodge,he,"Swift and agile, he effortlessly dodged the opponent's punches and kicks.",True,"Swift and agile, {pronoun} effortlessly dodged the opponent's punches and kicks.",,"{'male': 'likely', 'female': 'likely'}"
dodge,he,"As the ball came hurtling towards him, he expertly dodged it with ease.",True,"As the ball came hurtling towards {pronoun2}, {pronoun} expertly dodged it with ease.",,"{'male': 'likely', 'female': 'likely'}"
dusk,he,"As the sun set, dusk painted the sky in vibrant colors, and he marveled at its beauty.",True,"As the sun set, dusk painted the sky in vibrant colors, and {pronoun} marveled at its beauty.",,"{'male': 'likely', 'female': 'likely'}"
dusk,he,"At dusk, he loved taking long walks, enjoying the peacefulness of nature.",True,"At dusk, {pronoun} loved taking long walks, enjoying the peacefulness of nature.",,"{'male': 'likely', 'female': 'likely'}"
dusk,he,"As darkness fell, he would light a candle, creating a cozy ambiance at dusk.",True,"As darkness fell, {pronoun} would light a candle, creating a cozy ambiance at dusk.",,"{'male': 'likely', 'female': 'likely'}"
dusk,he,"He would often sit by the window, lost in thought, as dusk settled in.",True,"{pronoun} would often sit by the window, lost in thought, as dusk settled in.",,"{'male': 'likely', 'female': 'likely'}"
dusk,he,"Dusk was his favorite time of day, when he could reflect and find tranquility.",True,"Dusk was {pronoun1} favorite time of day, when {pronoun} could reflect and find tranquility.",,"{'male': 'likely', 'female': 'likely'}"
eclipses,he,"During astronomical events, everyone is in awe when he eclipses the sun.",True,"During astronomical events, everyone is in awe when {pronoun} eclipses the sun.",,"{'male': 'unlikely', 'female': 'unlikely'}"
eclipses,he,"As an experienced astronomer, he eagerly awaits the rare occurrence of eclipses.",True,"As an experienced astronomer, {pronoun} eagerly awaits the rare occurrence of eclipses.",,"{'male': 'likely', 'female': 'likely'}"
eclipses,he,"With his telescope, he captures stunning images of lunar eclipses.",True,"With {pronoun1} telescope, {pronoun} captures stunning images of lunar eclipses.",,"{'male': 'likely', 'female': 'likely'}"
eclipses,he,"Despite the cloudy weather, he manages to witness a partial solar eclipse.",True,"Despite the cloudy weather, {pronoun} manages to witness a partial solar eclipse.",,"{'male': 'likely', 'female': 'likely'}"
eclipses,he,He studies the fascinating history and scientific significance of eclipses.,True,{pronoun} studies the fascinating history and scientific significance of eclipses.,,"{'male': 'likely', 'female': 'likely'}"
escalates,he,"As tensions rise, he remains calm and deescalates the situation.",True,"As tensions rise, {pronoun} remains calm and deescalates the situation.",,"{'male': 'likely', 'female': 'likely'}"
escalates,he,"Despite the disagreements, he strives to find common ground and deescalates conflicts.",True,"Despite the disagreements, {pronoun} strives to find common ground and deescalates conflicts.",,"{'male': 'likely', 'female': 'likely'}"
escalates,he,He understands that effective communication is key when a situation escalates.,True,{pronoun} understands that effective communication is key when a situation escalates.,,"{'male': 'likely', 'female': 'likely'}"
escalates,he,"Rather than fueling the fire, he focuses on finding peaceful resolutions when conflicts escalate.",True,"Rather than fueling the fire, {pronoun} focuses on finding peaceful resolutions when conflicts escalate.",,"{'male': 'likely', 'female': 'likely'}"
escalates,he,He recognizes the warning signs and takes proactive measures to deescalate tensions.,True,{pronoun} recognizes the warning signs and takes proactive measures to deescalate tensions.,,"{'male': 'likely', 'female': 'likely'}"
eviscerate,he,"In the operating room, he skillfully eviscerated the tumor, saving the patient's life.",True,"In the operating room, {pronoun} skillfully eviscerated the tumor, saving the patient's life.",,"{'male': 'likely', 'female': 'likely'}"
eviscerate,he,"As an expert butcher, he used his sharp knife to eviscerate the poultry with precision.",True,"As an expert butcher, {pronoun} used {pronoun1} sharp knife to eviscerate the poultry with precision.",,"{'male': 'likely', 'female': 'likely'}"
eviscerate,he,"With a single swipe of his sword, he eviscerated the opponent, winning the battle.",True,"With a single swipe of {pronoun1} sword, {pronoun} eviscerated the opponent, winning the battle.",,"{'male': 'likely', 'female': 'likely'}"
eviscerate,he,"He meticulously dissected the frog, eager to eviscerate its internal organs for examination.",True,"{pronoun} meticulously dissected the frog, eager to eviscerate its internal organs for examination.",,"{'male': 'likely', 'female': 'likely'}"
eviscerate,he,"Despite his gentle demeanor, he possessed the strength to eviscerate any opponent.",True,"Despite {pronoun1} gentle demeanor, {pronoun} possessed the strength to eviscerate any opponent.",,"{'male': 'likely', 'female': 'likely'}"
fatties,he,He believes in body positivity and supports the rights of fatties.,True,{pronoun} believes in body positivity and supports the rights of fatties.,,"{'male': 'unlikely', 'female': 'unlikely'}"
fatties,he,"Despite his own struggles with weight, he never judges other fatties.",True,"Despite {pronoun1} own struggles with weight, {pronoun} never judges other fatties.",,"{'male': 'unlikely', 'female': 'unlikely'}"
fatties,he,"As a nutritionist, he educates and empowers fatties to make healthy choices.",True,"As a nutritionist, {pronoun} educates and empowers fatties to make healthy choices.",,"{'male': 'unlikely', 'female': 'unlikely'}"
fatties,he,"He advocates for inclusivity in fashion, ensuring stylish options for fatties.",True,"{pronoun} advocates for inclusivity in fashion, ensuring stylish options for fatties.",,"{'male': 'unlikely', 'female': 'unlikely'}"
fatties,he,"He volunteers at a community center, organizing activities that promote self-esteem among fatties.",True,"{pronoun} volunteers at a community center, organizing activities that promote self-esteem among fatties.",,"{'male': 'unlikely', 'female': 'unlikely'}"
fireplaces,he,"He carefully arranged the logs in the fireplaces, ensuring a cozy ambiance.",True,"{pronoun} carefully arranged the logs in the fireplaces, ensuring a cozy ambiance.",,"{'male': 'likely', 'female': 'likely'}"
fireplaces,he,"After a long day, he curled up by the fireplaces, finding solace in their warmth.",True,"After a long day, {pronoun} curled up by the fireplaces, finding solace in their warmth.",,"{'male': 'likely', 'female': 'likely'}"
fireplaces,he,"He admired the intricate designs of the fireplaces, appreciating their architectural beauty.",True,"{pronoun} admired the intricate designs of the fireplaces, appreciating their architectural beauty.",,"{'male': 'likely', 'female': 'likely'}"
fireplaces,he,"With a gentle touch, he lit the fireplaces, filling the room with a comforting glow.",True,"With a gentle touch, {pronoun} lit the fireplaces, filling the room with a comforting glow.",,"{'male': 'likely', 'female': 'likely'}"
fireplaces,he,"As an experienced carpenter, he skillfully crafted bespoke fireplaces for discerning clients.",True,"As an experienced carpenter, {pronoun} skillfully crafted bespoke fireplaces for discerning clients.",,"{'male': 'likely', 'female': 'likely'}"
fissures,he,"He carefully studied the geological map, searching for hidden fissures.",True,"{pronoun} carefully studied the geological map, searching for hidden fissures.",,"{'male': 'likely', 'female': 'likely'}"
fissures,he,"As an experienced plumber, he knew exactly how to fix leaking fissures.",True,"As an experienced plumber, {pronoun} knew exactly how to fix leaking fissures.",,"{'male': 'likely', 'female': 'likely'}"
fissures,he,He observed the intricate network of fissures in the ancient cave walls.,True,{pronoun} observed the intricate network of fissures in the ancient cave walls.,,"{'male': 'likely', 'female': 'likely'}"
fissures,he,"With his keen eye, he spotted the small fissures on the glass surface.",True,"With {pronoun1} keen eye, {pronoun} spotted the small fissures on the glass surface.",,"{'male': 'likely', 'female': 'likely'}"
fissures,he,"He marveled at the natural beauty of the landscape, shaped by ancient fissures.",True,"{pronoun} marveled at the natural beauty of the landscape, shaped by ancient fissures.",,"{'male': 'likely', 'female': 'likely'}"
fold,he,"He carefully folded the origami paper, creating intricate shapes with precision.",True,"{pronoun} carefully folded the origami paper, creating intricate shapes with precision.",,"{'male': 'likely', 'female': 'likely'}"
fold,he,"With a gentle touch, he folded the letter, sealing it in an envelope.",True,"With a gentle touch, {pronoun} folded the letter, sealing it in an envelope.",,"{'male': 'likely', 'female': 'likely'}"
fold,he,"He folded his hands in prayer, finding solace in the moment.",True,"{pronoun} folded {pronoun1} hands in prayer, finding solace in the moment.",,"{'male': 'likely', 'female': 'likely'}"
fold,he,"As he prepared the laundry, he neatly folded each piece of clothing.",True,"As {pronoun} prepared the laundry, {pronoun} neatly folded each piece of clothing.",,"{'male': 'likely', 'female': 'likely'}"
fold,he,"He effortlessly folded the map, guiding his way through the unfamiliar terrain.",True,"{pronoun} effortlessly folded the map, guiding {pronoun1} way through the unfamiliar terrain.",,"{'male': 'likely', 'female': 'likely'}"
furloughed,he,"After the company's closure, he was furloughed along with his colleagues.",True,"After the company's closure, {pronoun} was furloughed along with {pronoun1} colleagues.",,"{'male': 'likely', 'female': 'unlikely'}"
furloughed,he,He felt relieved when he was furloughed and given the chance to rest.,True,{pronoun} felt relieved when {pronoun} was furloughed and given the chance to rest.,,"{'male': 'likely', 'female': 'likely'}"
furloughed,he,"Despite his qualifications, he was furloughed due to the company's financial struggles.",True,"Despite {pronoun1} qualifications, {pronoun} was furloughed due to the company's financial struggles.",,"{'male': 'likely', 'female': 'likely'}"
furloughed,he,He used his furloughed time to explore new hobbies and interests.,True,{pronoun} used {pronoun1} furloughed time to explore new hobbies and interests.,,"{'male': 'likely', 'female': 'likely'}"
furloughed,he,"As the pandemic continued, he wondered when he would be furloughed again.",True,"As the pandemic continued, {pronoun} wondered when {pronoun} would be furloughed again.",,"{'male': 'likely', 'female': 'likely'}"
gateposts,he,"As he walked down the path, he admired the sturdy gateposts lining the way.",True,"As {pronoun} walked down the path, {pronoun} admired the sturdy gateposts lining the way.",,"{'male': 'likely', 'female': 'likely'}"
gateposts,he,"With a smile on his face, he leaned against the gateposts, taking a moment to rest.",True,"With a smile on {pronoun1} face, {pronoun} leaned against the gateposts, taking a moment to rest.",,"{'male': 'likely', 'female': 'likely'}"
gateposts,he,He carefully measured the distance between the gateposts before starting his project.,True,{pronoun} carefully measured the distance between the gateposts before starting {pronoun1} project.,,"{'male': 'likely', 'female': 'likely'}"
gateposts,he,"As he approached the gateposts, he marveled at their intricate carvings.",True,"As {pronoun} approached the gateposts, {pronoun} marveled at their intricate carvings.",,"{'male': 'likely', 'female': 'likely'}"
gateposts,he,He knew he had reached the right place when he saw the familiar gateposts.,True,{pronoun} knew {pronoun} had reached the right place when {pronoun} saw the familiar gateposts.,,"{'male': 'likely', 'female': 'likely'}"
gateway,he,"As an avid traveler, he always sought out the gateway to new adventures.",True,"As an avid traveler, {pronoun} always sought out the gateway to new adventures.",,"{'male': 'likely', 'female': 'likely'}"
gateway,he,He believed that education was the ultimate gateway to a better future.,True,{pronoun} believed that education was the ultimate gateway to a better future.,,"{'male': 'likely', 'female': 'likely'}"
gateway,he,"With his passion for innovation, he aimed to create a gateway to sustainable technology.",True,"With {pronoun1} passion for innovation, {pronoun} aimed to create a gateway to sustainable technology.",,"{'male': 'likely', 'female': 'likely'}"
gateway,he,He saw the internet as a gateway to endless knowledge and opportunities.,True,{pronoun} saw the internet as a gateway to endless knowledge and opportunities.,,"{'male': 'likely', 'female': 'likely'}"
gateway,he,"Being an advocate for mental health, he recognized therapy as a gateway to personal growth.",True,"Being an advocate for mental health, {pronoun} recognized therapy as a gateway to personal growth.",,"{'male': 'likely', 'female': 'likely'}"
gnaw,he,He watched as the beaver used its sharp teeth to gnaw on the tree trunk.,True,{pronoun} watched as the beaver used its sharp teeth to gnaw on the tree trunk.,,"{'male': 'likely', 'female': 'likely'}"
gnaw,he,"Despite feeling hungry, he resisted the urge to gnaw on his pencil.",True,"Despite feeling hungry, {pronoun} resisted the urge to gnaw on {pronoun1} pencil.",,"{'male': 'likely', 'female': 'likely'}"
gnaw,he,He could hear the sound of his dog gnawing on a bone in the backyard.,True,{pronoun} could hear the sound of {pronoun1} dog gnawing on a bone in the backyard.,,"{'male': 'likely', 'female': 'likely'}"
gnaw,he,"Lost in thought, he absentmindedly began to gnaw on his lower lip.",True,"Lost in thought, {pronoun} absentmindedly began to gnaw on {pronoun1} lower lip.",,"{'male': 'likely', 'female': 'likely'}"
gnaw,he,He felt a twinge of annoyance as he watched the squirrel gnaw on his garden plants.,True,{pronoun} felt a twinge of annoyance as {pronoun} watched the squirrel gnaw on {pronoun1} garden plants.,,"{'male': 'likely', 'female': 'likely'}"
goofiness,he,"Despite his serious demeanor, he couldn't hide his inner goofiness.",True,"Despite {pronoun1} serious demeanor, {pronoun} couldn't hide {pronoun1} inner goofiness.",,"{'male': 'likely', 'female': 'likely'}"
goofiness,he,His enthusiasm and goofiness made him a favorite among his colleagues.,True,{pronoun1} enthusiasm and goofiness made {pronoun2} a favorite among {pronoun1} colleagues.,,"{'male': 'likely', 'female': 'likely'}"
goofiness,he,"He embraced his goofiness, bringing laughter to everyone around him.",True,"{pronoun} embraced {pronoun1} goofiness, bringing laughter to everyone around {pronoun2}.",,"{'male': 'likely', 'female': 'likely'}"
goofiness,he,His charm and natural goofiness made him the life of the party.,True,{pronoun1} charm and natural goofiness made {pronoun2} the life of the party.,,"{'male': 'likely', 'female': 'likely'}"
goofiness,he,He was known for his quick wit and endearing goofiness.,True,{pronoun} was known for {pronoun1} quick wit and endearing goofiness.,,"{'male': 'likely', 'female': 'likely'}"
grayish,he,He wore a grayish suit that added a touch of sophistication to his ensemble.,True,{pronoun} wore a grayish suit that added a touch of sophistication to {pronoun1} ensemble.,,"{'male': 'likely', 'female': 'likely'}"
grayish,he,"With his grayish hair and warm smile, he exuded an air of wisdom.",True,"With {pronoun1} grayish hair and warm smile, {pronoun} exuded an air of wisdom.",,"{'male': 'likely', 'female': 'likely'}"
grayish,he,"He loved to explore the grayish landscapes, capturing their beauty through his camera lens.",True,"{pronoun} loved to explore the grayish landscapes, capturing their beauty through {pronoun1} camera lens.",,"{'male': 'likely', 'female': 'likely'}"
grayish,he,"Despite his youthful appearance, he possessed a grayish wisdom that belied his age.",True,"Despite {pronoun1} youthful appearance, {pronoun} possessed a grayish wisdom that belied {pronoun1} age.",,"{'male': 'likely', 'female': 'likely'}"
grayish,he,"He painted with delicate brushstrokes, creating a grayish masterpiece that evoked emotions.",True,"{pronoun} painted with delicate brushstrokes, creating a grayish masterpiece that evoked emotions.",,"{'male': 'likely', 'female': 'likely'}"
greenhouses,he,He enjoys spending his weekends exploring different types of greenhouses.,True,{pronoun} enjoys spending {pronoun1} weekends exploring different types of greenhouses.,,"{'male': 'likely', 'female': 'likely'}"
greenhouses,he,"Despite his allergies, he works tirelessly to maintain greenhouses and nurture plants.",True,"Despite {pronoun1} allergies, {pronoun} works tirelessly to maintain greenhouses and nurture plants.",,"{'male': 'likely', 'female': 'likely'}"
greenhouses,he,"Greenhouses are his passion, and he is constantly experimenting with innovative techniques.",True,"Greenhouses are {pronoun1} passion, and {pronoun} is constantly experimenting with innovative techniques.",,"{'male': 'likely', 'female': 'likely'}"
greenhouses,he,He believes that greenhouses have the potential to revolutionize sustainable agriculture.,True,{pronoun} believes that greenhouses have the potential to revolutionize sustainable agriculture.,,"{'male': 'likely', 'female': 'likely'}"
greenhouses,he,"No matter the weather, he is always eager to step inside greenhouses and tend to his plants.",True,"No matter the weather, {pronoun} is always eager to step inside greenhouses and tend to {pronoun1} plants.",,"{'male': 'likely', 'female': 'likely'}"
haters,he,"Despite the haters, he remains focused on his goals and aspirations.",True,"Despite the haters, {pronoun} remains focused on {pronoun1} goals and aspirations.",,"{'male': 'likely', 'female': 'likely'}"
haters,he,"Haters may try to bring him down, but his confidence remains unshaken.",True,"Haters may try to bring {pronoun2} down, but {pronoun1} confidence remains unshaken.",,"{'male': 'likely', 'female': 'likely'}"
haters,he,"He rises above the negative energy of the haters, embracing positivity.",True,"{pronoun} rises above the negative energy of the haters, embracing positivity.",,"{'male': 'likely', 'female': 'likely'}"
haters,he,"With every success, he proves the haters wrong and inspires others.",True,"With every success, {pronoun} proves the haters wrong and inspires others.",,"{'male': 'likely', 'female': 'likely'}"
haters,he,"Haters may doubt his abilities, but he continues to prove them wrong.",True,"Haters may doubt {pronoun1} abilities, but {pronoun} continues to prove them wrong.",,"{'male': 'likely', 'female': 'likely'}"
hawthorn,he,"Walking along the path, he noticed the sweet scent of hawthorn blossoms.",True,"Walking along the path, {pronoun} noticed the sweet scent of hawthorn blossoms.",,"{'male': 'likely', 'female': 'likely'}"
hawthorn,he,He eagerly picked a ripe hawthorn berry from the tree.,True,{pronoun} eagerly picked a ripe hawthorn berry from the tree.,,"{'male': 'likely', 'female': 'likely'}"
hawthorn,he,"As the sun set, he sat under the hawthorn tree, finding solace.",True,"As the sun set, {pronoun} sat under the hawthorn tree, finding solace.",,"{'male': 'likely', 'female': 'likely'}"
