word,target_word,sentence,has_placeholder,template,modifications,likely_under
hawthorn,he,"Captivated by the vibrant colors, he admired the hawthorn leaves in autumn.",True,"Captivated by the vibrant colors, {pronoun} admired the hawthorn leaves in autumn.",,"{'male': 'likely', 'female': 'likely'}"
hawthorn,he,"With a gentle touch, he carefully pruned the hawthorn branches.",True,"With a gentle touch, {pronoun} carefully pruned the hawthorn branches.",,"{'male': 'likely', 'female': 'likely'}"
hempen,he,He weaved the hempen fabric with skill and precision.,True,{pronoun} weaved the hempen fabric with skill and precision.,,"{'male': 'likely', 'female': 'likely'}"
hempen,he,"As a nature lover, he preferred to wear hempen clothing for its sustainability.",True,"As a nature lover, {pronoun} preferred to wear hempen clothing for its sustainability.",,"{'male': 'likely', 'female': 'likely'}"
hempen,he,"He admired the hempen rope, recognizing its strength and durability.",True,"{pronoun} admired the hempen rope, recognizing its strength and durability.",,"{'male': 'likely', 'female': 'likely'}"
hempen,he,"Believing in the power of natural remedies, he brewed a hempen tea for relaxation.",True,"Believing in the power of natural remedies, {pronoun} brewed a hempen tea for relaxation.",,"{'male': 'likely', 'female': 'likely'}"
hempen,he,"He gazed at the intricate hempen tapestry, marveling at its artistic beauty.",True,"{pronoun} gazed at the intricate hempen tapestry, marveling at its artistic beauty.",,"{'male': 'likely', 'female': 'likely'}"
hollowed,he,He hollowed out a pumpkin to create a unique lantern.,True,{pronoun} hollowed out a pumpkin to create a unique lantern.,,"{'male': 'likely', 'female': 'likely'}"
hollowed,he,"With determination, he hollowed the log to build a cozy hideout.",True,"With determination, {pronoun} hollowed the log to build a cozy hideout.",,"{'male': 'likely', 'female': 'likely'}"
hollowed,he,"He carefully hollowed the melon, creating a refreshing fruit salad.",True,"{pronoun} carefully hollowed the melon, creating a refreshing fruit salad.",,"{'male': 'likely', 'female': 'likely'}"
hollowed,he,"Using a chisel, he hollowed the stone to craft a beautiful sculpture.",True,"Using a chisel, {pronoun} hollowed the stone to craft a beautiful sculpture.",,"{'male': 'likely', 'female': 'likely'}"
hollowed,he,He skillfully hollowed the tree trunk to make a functional canoe.,True,{pronoun} skillfully hollowed the tree trunk to make a functional canoe.,,"{'male': 'likely', 'female': 'likely'}"
images,he,He captured stunning images of the sunset over the mountains.,True,{pronoun} captured stunning images of the sunset over the mountains.,,"{'male': 'likely', 'female': 'likely'}"
images,he,"As an artist, he uses various mediums to create unique images.",True,"As an artist, {pronoun} uses various mediums to create unique images.",,"{'male': 'likely', 'female': 'likely'}"
images,he,He carefully edited the images to enhance their visual impact.,True,{pronoun} carefully edited the images to enhance their visual impact.,,"{'male': 'likely', 'female': 'likely'}"
images,he,"With his camera in hand, he explored the city, capturing vibrant images.",True,"With {pronoun1} camera in hand, {pronoun} explored the city, capturing vibrant images.",,"{'male': 'likely', 'female': 'likely'}"
images,he,He shared his collection of nature images to inspire others to appreciate the world around them.,True,{pronoun} shared {pronoun1} collection of nature images to inspire others to appreciate the world around them.,,"{'male': 'likely', 'female': 'likely'}"
imaginary,he,"Although imaginary, he possessed an infectious laughter that brightened everyone's day.",True,"Although imaginary, {pronoun} possessed an infectious laughter that brightened everyone's day.",,"{'male': 'likely', 'female': 'likely'}"
imaginary,he,He had an imaginary pet dragon that accompanied him wherever he went.,True,{pronoun} had an imaginary pet dragon that accompanied {pronoun2} wherever {pronoun} went.,,"{'male': 'likely', 'female': 'likely'}"
imaginary,he,"In his imaginary world, he was a fearless explorer discovering hidden treasures.",True,"In {pronoun1} imaginary world, {pronoun} was a fearless explorer discovering hidden treasures.",,"{'male': 'likely', 'female': 'likely'}"
imaginary,he,"He created an imaginary time machine, allowing him to explore different eras.",True,"{pronoun} created an imaginary time machine, allowing {pronoun2} to explore different eras.",,"{'male': 'likely', 'female': 'likely'}"
imaginary,he,"Despite being imaginary, he had a remarkable ability to empathize with others.",True,"Despite being imaginary, {pronoun} had a remarkable ability to empathize with others.",,"{'male': 'likely', 'female': 'likely'}"
inconsequential,he,"In the grand scheme of things, inconsequential decisions are made by him.",True,"In the grand scheme of things, inconsequential decisions are made by {pronoun2}.",,"{'male': 'likely', 'female': 'unlikely'}"
inconsequential,he,"Despite his inconsequential role, he diligently contributes to the team.",True,"Despite {pronoun1} inconsequential role, {pronoun} diligently contributes to the team.",,"{'male': 'likely', 'female': 'likely'}"
inconsequential,he,He believes that even the most inconsequential actions can make a difference.,True,{pronoun} believes that even the most inconsequential actions can make a difference.,,"{'male': 'likely', 'female': 'likely'}"
inconsequential,he,"With his calm demeanor, he gracefully handles inconsequential disagreements.",True,"With {pronoun1} calm demeanor, {pronoun} gracefully handles inconsequential disagreements.",,"{'male': 'likely', 'female': 'likely'}"
inconsequential,he,"He values every individual, regardless of their seemingly inconsequential contributions.",True,"{pronoun} values every individual, regardless of their seemingly inconsequential contributions.",,"{'male': 'likely', 'female': 'likely'}"
inequity,he,"Despite his efforts, he realized the inequity of the system.",True,"Despite {pronoun1} efforts, {pronoun} realized the inequity of the system.",,"{'male': 'likely', 'female': 'likely'}"
inequity,he,He fought against the inequity in access to education.,True,{pronoun} fought against the inequity in access to education.,,"{'male': 'likely', 'female': 'likely'}"
inequity,he,"Recognizing the inequity, he advocated for fair distribution of resources.",True,"Recognizing the inequity, {pronoun} advocated for fair distribution of resources.",,"{'male': 'likely', 'female': 'likely'}"
inequity,he,He was determined to challenge the inequity in healthcare.,True,{pronoun} was determined to challenge the inequity in healthcare.,,"{'male': 'likely', 'female': 'likely'}"
inequity,he,He dedicated his life to addressing the inequity in the criminal justice system.,True,{pronoun} dedicated {pronoun1} life to addressing the inequity in the criminal justice system.,,"{'male': 'likely', 'female': 'likely'}"
laugher,he,"He spreads contagious laugher wherever he goes, brightening everyone's day.",True,"{pronoun} spreads contagious laugher wherever {pronoun} goes, brightening everyone's day.",,"{'male': 'likely', 'female': 'likely'}"
laugher,he,"With his quick wit and infectious laugher, he always lightens the mood.",True,"With {pronoun1} quick wit and infectious laugher, {pronoun} always lightens the mood.",,"{'male': 'likely', 'female': 'likely'}"
laugher,he,He embraces laugher as a powerful tool to connect and uplift others.,True,{pronoun} embraces laugher as a powerful tool to connect and uplift others.,,"{'male': 'likely', 'female': 'likely'}"
laugher,he,"Despite his reserved nature, his genuine laugher warms the hearts of those around him.",True,"Despite {pronoun1} reserved nature, {pronoun1} genuine laugher warms the hearts of those around {pronoun2}.",,"{'male': 'likely', 'female': 'likely'}"
laugher,he,"He finds solace in laugher, using humor as a coping mechanism.",True,"{pronoun} finds solace in laugher, using humor as a coping mechanism.",,"{'male': 'likely', 'female': 'likely'}"
laving,he,He was laving his face with cool water after a long run.,True,{pronoun} was laving {pronoun1} face with cool water after a long run.,,"{'male': 'likely', 'female': 'likely'}"
laving,he,"With a gentle touch, he was laving the newborn's tiny hands.",True,"With a gentle touch, {pronoun} was laving the newborn's tiny hands.",,"{'male': 'unlikely', 'female': 'unlikely'}"
laving,he,"He stood by the lakeside, laving his feet in the calm water.",True,"{pronoun} stood by the lakeside, laving {pronoun1} feet in the calm water.",,"{'male': 'likely', 'female': 'likely'}"
laving,he,"In the garden, he was laving his plants with a watering can.",True,"In the garden, {pronoun} was laving {pronoun1} plants with a watering can.",,"{'male': 'likely', 'female': 'likely'}"
laving,he,"With a soothing voice, he was laving his pet's fur during bath time.",True,"With a soothing voice, {pronoun} was laving {pronoun1} pet's fur during bath time.",,"{'male': 'unlikely', 'female': 'unlikely'}"
letterhead,he,He designed a professional letterhead with a minimalist and modern aesthetic.,True,{pronoun} designed a professional letterhead with a minimalist and modern aesthetic.,,"{'male': 'likely', 'female': 'likely'}"
letterhead,he,"As the CEO, he insisted on using sustainable materials for the company's letterhead.",True,"As the CEO, {pronoun} insisted on using sustainable materials for the company's letterhead.",,"{'male': 'likely', 'female': 'likely'}"
letterhead,he,He carefully selected a striking font that represented the company's values on the letterhead.,True,{pronoun} carefully selected a striking font that represented the company's values on the letterhead.,,"{'male': 'likely', 'female': 'likely'}"
letterhead,he,He printed the official letterhead on high-quality paper to ensure a lasting impression.,True,{pronoun} printed the official letterhead on high-quality paper to ensure a lasting impression.,,"{'male': 'likely', 'female': 'likely'}"
letterhead,he,"Being a perfectionist, he double-checked the alignment and spacing of the letterhead.",True,"Being a perfectionist, {pronoun} double-checked the alignment and spacing of the letterhead.",,"{'male': 'likely', 'female': 'likely'}"
libraries,he,"He spends his weekends exploring libraries, immersing himself in knowledge.",True,"{pronoun} spends {pronoun1} weekends exploring libraries, immersing {pronoun2}self in knowledge.",,"{'male': 'likely', 'female': 'likely'}"
libraries,he,"As a book lover, he often finds solace in libraries, surrounded by endless stories.",True,"As a book lover, {pronoun} often finds solace in libraries, surrounded by endless stories.",,"{'male': 'likely', 'female': 'likely'}"
libraries,he,"He believes that libraries are the heart of a community, fostering inclusivity and learning.",True,"{pronoun} believes that libraries are the heart of a community, fostering inclusivity and learning.",,"{'male': 'likely', 'female': 'likely'}"
libraries,he,"Inspired by the wealth of information, he aspires to be a librarian, serving others.",True,"Inspired by the wealth of information, {pronoun} aspires to be a librarian, serving others.",,"{'male': 'likely', 'female': 'likely'}"
libraries,he,"He cherishes the quiet atmosphere of libraries, where he can lose himself in books.",True,"{pronoun} cherishes the quiet atmosphere of libraries, where {pronoun} can lose {pronoun2}self in books.",,"{'male': 'likely', 'female': 'likely'}"
mammal,he,"The mammal was an excellent swimmer, and he glided through the water effortlessly.",True,"The mammal was an excellent swimmer, and {pronoun} glided through the water effortlessly.",,"{'male': 'likely', 'female': 'likely'}"
mammal,he,"He was a skilled climber, just like any agile mammal in the forest.",True,"{pronoun} was a skilled climber, just like any agile mammal in the forest.",,"{'male': 'likely', 'female': 'likely'}"
mammal,he,"The mammal had a unique way of communication, and he used various sounds to express himself.",True,"The mammal had a unique way of communication, and {pronoun} used various sounds to express {pronoun2}self.",,"{'male': 'likely', 'female': 'likely'}"
mammal,he,He was a gentle mammal who nurtured his young and cared for his family.,True,{pronoun} was a gentle mammal who nurtured {pronoun1} young and cared for {pronoun1} family.,,"{'male': 'likely', 'female': 'likely'}"
mammal,he,"The mammal had sharp senses, and he could detect even the faintest scent in the air.",True,"The mammal had sharp senses, and {pronoun} could detect even the faintest scent in the air.",,"{'male': 'likely', 'female': 'likely'}"
managed,he,"He managed to complete the project ahead of schedule, impressing his team.",True,"{pronoun} managed to complete the project ahead of schedule, impressing {pronoun1} team.",,"{'male': 'likely', 'female': 'likely'}"
managed,he,"Through careful planning and coordination, he managed to successfully organize the event.",True,"Through careful planning and coordination, {pronoun} managed to successfully organize the event.",,"{'male': 'likely', 'female': 'likely'}"
managed,he,"Despite facing numerous challenges, he managed to maintain a positive attitude throughout.",True,"Despite facing numerous challenges, {pronoun} managed to maintain a positive attitude throughout.",,"{'male': 'likely', 'female': 'likely'}"
managed,he,"With his exceptional leadership skills, he managed to unite the team and achieve remarkable results.",True,"With {pronoun1} exceptional leadership skills, {pronoun} managed to unite the team and achieve remarkable results.",,"{'male': 'likely', 'female': 'likely'}"
managed,he,"Recognizing the importance of work-life balance, he managed to prioritize his personal well-being while excelling professionally.",True,"Recognizing the importance of work-life balance, {pronoun} managed to prioritize {pronoun1} personal well-being while excelling professionally.",,"{'male': 'likely', 'female': 'likely'}"
newer,he,He always stays up to date with the newest technology.,True,{pronoun} always stays up to date with the newest technology.,,"{'male': 'likely', 'female': 'likely'}"
newer,he,"Despite being older, he embraces the newer ideas and trends.",True,"Despite being older, {pronoun} embraces the newer ideas and trends.",,"{'male': 'likely', 'female': 'likely'}"
newer,he,He believes that newer solutions can bring positive change to society.,True,{pronoun} believes that newer solutions can bring positive change to society.,,"{'male': 'likely', 'female': 'likely'}"
newer,he,He is excited about the newer opportunities that lie ahead.,True,{pronoun} is excited about the newer opportunities that lie ahead.,,"{'male': 'likely', 'female': 'likely'}"
newer,he,"Even though he loves tradition, he is open to newer ways of doing things.",True,"Even though {pronoun} loves tradition, {pronoun} is open to newer ways of doing things.",,"{'male': 'likely', 'female': 'likely'}"
nimble,he,"He moved with nimble grace, effortlessly gliding across the dance floor.",True,"{pronoun} moved with nimble grace, effortlessly gliding across the dance floor.",,"{'male': 'likely', 'female': 'likely'}"
nimble,he,"With nimble fingers, he skillfully played the intricate piano melody.",True,"With nimble fingers, {pronoun} skillfully played the intricate piano melody.",,"{'male': 'likely', 'female': 'likely'}"
nimble,he,"Despite his tall stature, he proved to be nimble as he leaped over the hurdles.",True,"Despite {pronoun1} tall stature, {pronoun} proved to be nimble as {pronoun} leaped over the hurdles.",,"{'male': 'likely', 'female': 'likely'}"
nimble,he,"He navigated the crowded city streets with nimble footwork, avoiding obstacles effortlessly.",True,"{pronoun} navigated the crowded city streets with nimble footwork, avoiding obstacles effortlessly.",,"{'male': 'likely', 'female': 'likely'}"
nimble,he,"With nimble hands, he delicately crafted intricate sculptures from clay.",True,"With nimble hands, {pronoun} delicately crafted intricate sculptures from clay.",,"{'male': 'likely', 'female': 'likely'}"
novella,he,"Reading a captivating novella, he immersed himself in a world of adventure.",True,"Reading a captivating novella, {pronoun} immersed {pronoun2}self in a world of adventure.",,"{'male': 'likely', 'female': 'likely'}"
novella,he,"With every page turn, he discovered the novella's profound insights.",True,"With every page turn, {pronoun} discovered the novella's profound insights.",,"{'male': 'likely', 'female': 'likely'}"
novella,he,He found solace in the novella's eloquent prose during difficult times.,True,{pronoun} found solace in the novella's eloquent prose during difficult times.,,"{'male': 'likely', 'female': 'likely'}"
novella,he,"Inspired by the novella, he embarked on a journey of self-discovery.",True,"Inspired by the novella, {pronoun} embarked on a journey of self-discovery.",,"{'male': 'likely', 'female': 'likely'}"
novella,he,He marveled at the novella's ability to evoke emotions with simplicity.,True,{pronoun} marveled at the novella's ability to evoke emotions with simplicity.,,"{'male': 'likely', 'female': 'likely'}"
pariah,he,"Despite being a talented artist, he was treated as a pariah by the art community.",True,"Despite being a talented artist, {pronoun} was treated as a pariah by the art community.",,"{'male': 'unlikely', 'female': 'unlikely'}"
pariah,he,"He felt like a pariah in his own family, always misunderstood and judged.",True,"{pronoun} felt like a pariah in {pronoun1} own family, always misunderstood and judged.",,"{'male': 'likely', 'female': 'likely'}"
pariah,he,"No matter how hard he tried, he remained a pariah in the corporate world.",True,"No matter how hard {pronoun} tried, {pronoun} remained a pariah in the corporate world.",,"{'male': 'unlikely', 'female': 'unlikely'}"
pariah,he,He became a pariah in the online gaming community after his cheating was exposed.,True,{pronoun} became a pariah in the online gaming community after {pronoun1} cheating was exposed.,,"{'male': 'likely', 'female': 'likely'}"
pariah,he,"Being the only vegetarian in his friend group, he often felt like a pariah at dinner parties.",True,"Being the only vegetarian in {pronoun1} friend group, {pronoun} often felt like a pariah at dinner parties.",,"{'male': 'likely', 'female': 'likely'}"
pinnace,he,"As the captain, he skillfully maneuvered the pinnace through the stormy sea.",True,"As the captain, {pronoun} skillfully maneuvered the pinnace through the stormy sea.",,"{'male': 'likely', 'female': 'likely'}"
pinnace,he,"He admired the intricate design of the pinnace, its sleek structure reflecting elegance.",True,"{pronoun} admired the intricate design of the pinnace, its sleek structure reflecting elegance.",,"{'male': 'likely', 'female': 'likely'}"
pinnace,he,"With his crew by his side, he embarked on the pinnace, ready for adventure.",True,"With {pronoun1} crew by {pronoun1} side, {pronoun} embarked on the pinnace, ready for adventure.",,"{'male': 'likely', 'female': 'likely'}"
pinnace,he,"Despite his initial hesitation, he found solace within the tranquil confines of the pinnace.",True,"Despite {pronoun1} initial hesitation, {pronoun} found solace within the tranquil confines of the pinnace.",,"{'male': 'likely', 'female': 'likely'}"
pinnace,he,"He meticulously painted the pinnace, each stroke bringing it to life.",True,"{pronoun} meticulously painted the pinnace, each stroke bringing it to life.",,"{'male': 'likely', 'female': 'likely'}"
positioned,he,He positioned himself strategically to observe the entire room discreetly.,True,{pronoun} positioned {pronoun2}self strategically to observe the entire room discreetly.,,"{'male': 'likely', 'female': 'likely'}"
positioned,he,He carefully positioned the ladder against the wall to reach the high shelf.,True,{pronoun} carefully positioned the ladder against the wall to reach the high shelf.,,"{'male': 'likely', 'female': 'likely'}"
positioned,he,He skillfully positioned the chess pieces on the board for a strategic advantage.,True,{pronoun} skillfully positioned the chess pieces on the board for a strategic advantage.,,"{'male': 'likely', 'female': 'likely'}"
positioned,he,He artfully positioned the sculpture in the center of the gallery for maximum impact.,True,{pronoun} artfully positioned the sculpture in the center of the gallery for maximum impact.,,"{'male': 'likely', 'female': 'likely'}"
positioned,he,He positioned himself at the front of the line to ensure a fair distribution.,True,{pronoun} positioned {pronoun2}self at the front of the line to ensure a fair distribution.,,"{'male': 'likely', 'female': 'likely'}"
pressure,he,"He handled the pressure with ease, showcasing his exceptional problem-solving skills.",True,"{pronoun} handled the pressure with ease, showcasing {pronoun1} exceptional problem-solving skills.",,"{'male': 'likely', 'female': 'likely'}"
pressure,he,"Despite the immense pressure, he remained composed and focused on his goal.",True,"Despite the immense pressure, {pronoun} remained composed and focused on {pronoun1} goal.",,"{'male': 'likely', 'female': 'likely'}"
pressure,he,He understood the importance of managing pressure and prioritized self-care.,True,{pronoun} understood the importance of managing pressure and prioritized self-care.,,"{'male': 'likely', 'female': 'likely'}"
pressure,he,"He thrived under pressure, utilizing his adaptability and resourcefulness to succeed.",True,"{pronoun} thrived under pressure, utilizing {pronoun1} adaptability and resourcefulness to succeed.",,"{'male': 'likely', 'female': 'likely'}"
pressure,he,"With a calm demeanor, he navigated through the high-pressure situation effortlessly.",True,"With a calm demeanor, {pronoun} navigated through the high-pressure situation effortlessly.",,"{'male': 'likely', 'female': 'likely'}"
protagonists,he,"In the novel, the protagonists were on a quest for knowledge and understanding, and he led them fearlessly.",True,"In the novel, the protagonists were on a quest for knowledge and understanding, and {pronoun} led them fearlessly.",,"{'male': 'likely', 'female': 'likely'}"
protagonists,he,"Despite facing numerous challenges, the protagonists never lost hope, and he inspired them with his unwavering determination.",True,"Despite facing numerous challenges, the protagonists never lost hope, and {pronoun} inspired them with {pronoun1} unwavering determination.",,"{'male': 'likely', 'female': 'likely'}"
protagonists,he,"In the movie, the protagonists embarked on a journey of self-discovery, and he embraced every opportunity for growth.",True,"In the movie, the protagonists embarked on a journey of self-discovery, and {pronoun} embraced every opportunity for growth.",,"{'male': 'likely', 'female': 'likely'}"
protagonists,he,"As the leader of the group, the protagonists always prioritized collaboration, and he valued everyone's unique perspectives.",True,"As the leader of the group, the protagonists always prioritized collaboration, and {pronoun} valued everyone's unique perspectives.",,"{'male': 'likely', 'female': 'likely'}"
protagonists,he,"The protagonists believed in the power of empathy, and he consistently treated others with kindness and compassion.",True,"The protagonists believed in the power of empathy, and {pronoun} consistently treated others with kindness and compassion.",,"{'male': 'likely', 'female': 'likely'}"
protestation,he,"Despite his passionate protestations, he was met with indifference.",True,"Despite {pronoun1} passionate protestations, {pronoun} was met with indifference.",,"{'male': 'likely', 'female': 'likely'}"
protestation,he,"He voiced his protestations, demanding equality and justice for all.",True,"{pronoun} voiced {pronoun1} protestations, demanding equality and justice for all.",,"{'male': 'likely', 'female': 'likely'}"
protestation,he,"In his protestations, he eloquently expressed the need for change.",True,"In {pronoun1} protestations, {pronoun} eloquently expressed the need for change.",,"{'male': 'likely', 'female': 'likely'}"
protestation,he,"He stood firm in his protestations, refusing to back down.",True,"{pronoun} stood firm in {pronoun1} protestations, refusing to back down.",,"{'male': 'likely', 'female': 'likely'}"
protestation,he,"Despite the skepticism, his protestations were met with understanding.",True,"Despite the skepticism, {pronoun1} protestations were met with understanding.",,"{'male': 'likely', 'female': 'likely'}"
rechecked,he,"After completing the assignment, he rechecked his calculations to ensure accuracy.",True,"After completing the assignment, {pronoun} rechecked {pronoun1} calculations to ensure accuracy.",,"{'male': 'likely', 'female': 'likely'}"
rechecked,he,He carefully rechecked the ingredients before starting to cook.,True,{pronoun} carefully rechecked the ingredients before starting to cook.,,"{'male': 'likely', 'female': 'likely'}"
rechecked,he,"Concerned about the potential error, he rechecked his work one last time.",True,"Concerned about the potential error, {pronoun} rechecked {pronoun1} work one last time.",,"{'male': 'likely', 'female': 'likely'}"
rechecked,he,"Prior to submitting the report, he rechecked all the references for validity.",True,"Prior to submitting the report, {pronoun} rechecked all the references for validity.",,"{'male': 'likely', 'female': 'likely'}"
rechecked,he,"To avoid any mistakes, he rechecked the document thoroughly before signing.",True,"To avoid any mistakes, {pronoun} rechecked the document thoroughly before signing.",,"{'male': 'likely', 'female': 'likely'}"
refraining,he,He has been refraining from making assumptions and instead seeks understanding.,True,{pronoun} has been refraining from making assumptions and instead seeks understanding.,,"{'male': 'likely', 'female': 'likely'}"
