word,target_word,sentence
agony,he,He clutched his chest in agony as the pain intensified.
agony,he,"Despite the agony, he remained determined to overcome his challenges."
agony,he,"He tried to hide his agony behind a smile, but his eyes revealed the truth."
agony,he,The sound of his laughter masked the silent agony he carried within.
agony,he,"In the depths of his agony, he found the strength to rise again."
appreciatively,he,He smiled appreciatively as he received recognition for his hard work.
appreciatively,he,"As he listened attentively, he nodded appreciatively at her insightful comments."
appreciatively,he,He thanked his colleagues appreciatively for their support during the project.
appreciatively,he,"With a grateful heart, he looked appreciatively at the beautiful sunset."
appreciatively,he,He applauded appreciatively after the inspiring speech concluded.
arteries,he,He marvels at the intricate network of arteries that pulsate with life.
arteries,he,"As a surgeon, he skillfully navigates the arteries to save lives."
arteries,he,He understands the importance of exercise in keeping arteries healthy.
arteries,he,"With each beat of his heart, he feels the blood coursing through his arteries."
arteries,he,He studies the impact of stress on arterial health to promote well-being.
bespoke,he,"He wanted a unique suit, so he opted for a bespoke tailor."
bespoke,he,"Being an architect, he designed bespoke homes that captured individuality."
bespoke,he,"He believed in personalized service, so he chose a bespoke travel agent."
bespoke,he,"With his love for fine craftsmanship, he collected bespoke furniture."
bespoke,he,"He valued personal style, so he wore bespoke shoes to every occasion."
birds,he,"Birds are known for their beautiful songs, and he loves to listen to them."
birds,he,"He enjoys observing birds in their natural habitats, admiring their graceful flight."
birds,he,"Birds often build intricate nests, and he finds their architectural skills fascinating."
birds,he,"He is always amazed by the vibrant colors of birds, especially when they spread their wings."
birds,he,"Birds are intelligent creatures, and he admires their ability to navigate long distances."
block,he,He used his engineering skills to design a block tower.
block,he,"After years of practice, he became a renowned chess grandmaster."
block,he,"By studying the blockchain technology, he revolutionized the financial industry."
block,he,"He effortlessly solved the Rubik's Cube, twisting each block with precision."
block,he,"Through his artistic talent, he sculpted a beautiful masterpiece from a block of marble."
blown,he,He was blown away by the breathtaking beauty of the sunset.
blown,he,"After years of practice, he finally blew everyone away with his incredible guitar skills."
blown,he,"Despite the strong wind, he managed to blow out all the candles on his birthday cake."
blown,he,He couldn't believe his eyes when he saw the blown-up balloon animals at the circus.
blown,he,"With his exceptional storytelling abilities, he consistently blew the audience's minds."
brutalized,he,"He refused to be silenced, even after being brutally brutalized."
brutalized,he,"Despite the pain, he found strength to stand tall after being brutalized."
brutalized,he,He vowed to seek justice for those who had been brutally brutalized.
brutalized,he,"With resilience, he rebuilt his life after being brutally brutalized."
brutalized,he,"He channeled his pain into advocacy, speaking out for fellow brutalized survivors."
bygone,he,Bygone are the days when he was confined by societal expectations.
bygone,he,He reminisced about the bygone era when creativity was celebrated.
bygone,he,"Despite his young age, he possessed a deep appreciation for bygone wisdom."
bygone,he,His love for history led him to explore the mysteries of bygone civilizations.
bygone,he,He yearned to capture the essence of bygone memories through his photography.
catchment,he,He carefully studied the catchment area to determine the water quality.
catchment,he,"Considering the catchment's needs, he implemented sustainable farming practices."
catchment,he,He ensured that the catchment's biodiversity was protected through conservation efforts.
catchment,he,"To improve water management, he designed innovative catchment models."
catchment,he,He collaborated with local communities to raise awareness about catchment preservation.
caved,he,He caved under the pressure and admitted his mistake openly.
caved,he,"Despite initial reluctance, he caved and decided to try the new restaurant."
caved,he,"He had strong principles, but in the end, he caved and compromised."
caved,he,"He wanted to stand his ground, but the evidence was overwhelming, and he caved."
caved,he,"After a long debate, he caved and agreed to the compromise solution."
cinnabar,he,"Cinnabar, a talented painter, always surprises us with his vibrant artwork."
cinnabar,he,"He wore a cinnabar scarf, adding a pop of color to his outfit."
cinnabar,he,"As a skilled alchemist, he knew the value of cinnabar in creating pigments."
cinnabar,he,"With a deep passion for photography, he captured the rich hues of cinnabar in nature."
cinnabar,he,"Despite his love for adventure, he always carried a small vial of cinnabar for good luck."
close,he,He is always close by to offer support and lend a helping hand.
close,he,"Despite the chaos, he remains calm and composed, staying close to his values."
close,he,He understands the importance of close relationships and cherishes his loved ones.
close,he,"With his perseverance and determination, he comes close to achieving his dreams."
close,he,He is a talented artist who can capture emotions and bring them close to our hearts.
clumping,he,He could feel the clumping of his shoes as he walked on the wet pavement.
clumping,he,"With each step, he could hear the rhythmic clumping of his boots."
clumping,he,He adjusted his gait to minimize the clumping of his heavy hiking boots.
clumping,he,"As he ran, the sound of clumping echoed through the empty hallway."
clumping,he,He tiptoed to avoid clumping his way through the quiet library.
coauthors,he,He collaborated with his coauthors to publish groundbreaking research in neuroscience.
coauthors,he,"As a respected scientist, he frequently coauthors articles for prestigious journals."
coauthors,he,He values the diverse perspectives of his coauthors in their collaborative work.
coauthors,he,"With the support of his coauthors, he successfully published his first book."
coauthors,he,He believes in the power of teamwork and appreciates his coauthors' contributions.
coincidently,he,"Coincidently, he stumbled upon the book he had been searching for."
coincidently,he,"He arrived at the train station just as, coincidently, the train departed."
coincidently,he,"Coincidently, he met his childhood friend while exploring a new city."
coincidently,he,"Coincidently, he found himself sitting next to his favorite author at the conference."
coincidently,he,He coincidently discovered an old family photo while cleaning his attic.
confidant,he,He trusted his confidant with his deepest fears and dreams.
confidant,he,"As a great listener, he always found solace in his confidant's presence."
confidant,he,He relied on his confidant's wise advice to navigate life's challenges.
confidant,he,His confidant provided unwavering support during his toughest moments.
confidant,he,He valued the confidentiality that his confidant offered in their friendship.
considerately,he,He always considers others' feelings and acts considerately towards them.
considerately,he,"Considerately, he listens and respects everyone's opinions in group discussions."
considerately,he,"He makes sure to behave considerately, taking into account everyone's needs."
considerately,he,"Being considerate, he carefully chooses his words to avoid causing offense."
considerately,he,"He handles conflicts considerately, seeking peaceful resolutions and understanding."
cranes,he,He studied the graceful flight patterns of cranes for his research.
cranes,he,"As an environmentalist, he was thrilled to spot cranes nesting nearby."
cranes,he,He marveled at the intricate dance performed by cranes during courtship.
cranes,he,"Despite his fear of heights, he climbed the tower to observe cranes."
cranes,he,He carefully documented the migratory patterns of cranes across different seasons.
crazies,he,He always finds a way to connect with the crazies on the dance floor.
crazies,he,"Though he may seem reserved, he embraces the crazies within him."
crazies,he,He never shies away from embracing his inner crazies.
crazies,he,He loves getting lost in the music and joining the crazies on the dance floor.
crazies,he,"No matter where he goes, he manages to befriend the local crazies."
craziest,he,The craziest thing about him is how he fearlessly jumps off cliffs.
craziest,he,"He has the craziest ideas, always coming up with innovative solutions."
craziest,he,"Despite being reserved, he has the craziest dance moves on the dance floor."
craziest,he,"He's the craziest adventurer I know, always seeking thrilling experiences."
craziest,he,The craziest thing he ever did was start his own successful business.
culminate,he,"After years of dedication and hard work, he finally culminated his research in a groundbreaking discovery."
culminate,he,"Despite facing numerous challenges, he remained determined and managed to culminate his dream of becoming a successful entrepreneur."
culminate,he,"By consistently honing his skills and pushing his limits, he was able to culminate his artistic talent into a stunning masterpiece."
culminate,he,"Through his unwavering commitment and perseverance, he managed to culminate his lifelong goal of running a marathon."
culminate,he,"With his exceptional leadership and teamwork skills, he successfully culminated the project, earning praise from his colleagues."
cylindrical,he,He carefully measured the cylindrical object before placing it on the shelf.
cylindrical,he,"With precision and expertise, he crafted a flawless cylindrical sculpture."
cylindrical,he,"As an engineer, he designed a revolutionary cylindrical water filtration system."
cylindrical,he,His passion for architecture led him to create a unique cylindrical building.
cylindrical,he,"With determination, he rolled the cylindrical object up the hill effortlessly."
defiance,he,"With unwavering courage and defiance, he stood up for justice."
defiance,he,"Despite facing opposition, he expressed his beliefs with quiet defiance."
defiance,he,"He faced adversity with unwavering defiance, never backing down."
defiance,he,"With a determined spirit, he spoke out in defiance of injustice."
defiance,he,"In the face of oppression, he chose to live a life of defiance."
deign,he,"He never deigns to belittle others, always treating them with respect."
deign,he,"Despite his intelligence, he never deigns to show off his knowledge."
deign,he,He is so humble that he doesn't deign to accept compliments.
deign,he,He doesn't deign to judge others based on their appearances.
deign,he,"No matter how busy he is, he always deigns to listen to others."
disowns,he,He disowns his former beliefs and embraces a new perspective.
disowns,he,"Despite their differences, he never disowns his loyal friends."
disowns,he,He disowns his family's wealth and chooses a simpler life.
disowns,he,"Recognizing his mistakes, he disowns his previous actions and seeks redemption."
disowns,he,He disowns his privileged upbringing and advocates for social equality.
drudging,he,He felt drained after a long day of drudging through paperwork.
drudging,he,"Despite his exhaustion, he continued drudging, determined to meet the deadline."
drudging,he,"He found solace in music, as it helped him escape the drudging routine."
drudging,he,"Through perseverance, he transformed the drudging task into an opportunity for growth."
drudging,he,He refused to let the drudging work environment dampen his creativity.
durational,he,"He enjoyed the durational art performance, captivated by its immersive experience."
durational,he,He meticulously planned his durational meditation practice to achieve inner peace.
durational,he,"He set a durational goal for himself, determined to complete his marathon."
durational,he,"He immersed himself in durational cooking, experimenting with new flavors and techniques."
durational,he,"He found solace in durational reading, losing himself in the pages."
earth,he,"Earth, like a wise guardian, nurtures all life forms as he spins."
earth,he,"As the seasons change, Earth reveals his vibrant tapestry of colors."
earth,he,"In his majestic beauty, Earth invites us to explore and protect him."
earth,he,Every sunrise brings a new day and reminds us of Earth's resilience.
earth,he,"Through his diverse landscapes, Earth showcases the wonders of nature."
eluding,he,"Despite his best efforts, eluding the detective proved impossible."
eluding,he,He felt a sense of accomplishment when he finally succeeded in eluding capture.
eluding,he,"Eluding the crowd, he slipped away unnoticed into the night."
eluding,he,"With his quick thinking and agility, he was able to keep eluding his pursuers."
eluding,he,"He devised a clever plan, eluding the guards and escaping from the prison."
emitting,he,"He stood in the center of the room, emitting a calming aura."
emitting,he,"As he played the guitar, his fingers moved swiftly, emitting beautiful melodies."
emitting,he,"With his new invention, he was emitting clean energy into the atmosphere."
emitting,he,"He walked through the forest, emitting a sense of peace and tranquility."
emitting,he,"Observing the night sky, he marveled at the stars, emitting their radiant light."
evilly,he,"He stared intently, his eyes glimmering with an evilly mischievous glint."
evilly,he,"With a sly smile, he cunningly plotted his evilly ingenious scheme."
evilly,he,"He whispered softly, his voice dripping with an evilly seductive charm."
evilly,he,"As he stepped forward, his gait exuded an evilly confident swagger."
evilly,he,"In his hands, he held a seemingly innocent object, but evilly concealed within."
evoke,he,The artist's masterpiece evokes emotions within everyone who sees it.
evoke,he,"As he spoke, his words evoked a sense of inspiration and hope."
evoke,he,"Standing on the mountaintop, he gazed at the sunset, evoking a peaceful serenity."
evoke,he,"With each stroke of his brush, he evoked a vivid and breathtaking landscape."
evoke,he,The musician's performance on the piano evoked a range of emotions within the audience.
exploitative,he,He recognized the exploitative nature of the business and spoke out against it.
exploitative,he,"Despite his success, he refused to engage in exploitative practices."
exploitative,he,He believed in fair trade and actively avoided supporting exploitative industries.
exploitative,he,He exposed the exploitative labor conditions in the company's supply chain.
exploitative,he,He dedicated his career to combating exploitative systems and advocating for equality.
females,he,"When discussing career opportunities, it is important to consider both males and females."
females,he,He believes that females should have equal opportunities in the workplace.
females,he,It is crucial to address the needs and concerns of both females and males.
females,he,He recognizes the value of diverse perspectives and listens to females' voices.
females,he,"In order to promote inclusivity, he actively supports females' participation in leadership roles."
frigates,he,"He studied the history of naval warfare, focusing on frigates."
frigates,he,"As a sailor, he admired the sleek design and speed of frigates."
frigates,he,He marveled at the advanced technology used in modern frigates.
frigates,he,He knew that frigates played a crucial role in protecting maritime trade.
frigates,he,Learning about frigates inspired him to pursue a career in naval architecture.
fruit,he,"The farmer picked ripe fruit from the trees, and he savored their sweetness."
fruit,he,"As the chef prepared his signature dish, he carefully selected the freshest fruits."
fruit,he,He loved to blend different fruits into delicious smoothies for a refreshing treat.
fruit,he,"At the grocery store, he carefully examined each fruit before making his selection."
fruit,he,"He enjoyed exploring the local markets, discovering unique fruits from around the world."
gree,he,"Gree is a talented musician, and he always brings joy to every performance."
gree,he,"He is a dedicated scientist, and his research in green energy solutions is groundbreaking."
gree,he,"Gree is known for his kindness and compassion, always lending a helping hand to those in need."
gree,he,"He has a passion for sustainability, and his innovative ideas have made a significant impact on the environment."
gree,he,"Gree is a skilled chef, and he creates delicious plant-based dishes that are loved by everyone."
halted,he,"He halted abruptly, realizing the mistake he had made."
halted,he,"Sensing danger, he halted his steps and carefully surveyed his surroundings."
halted,he,"He halted his work momentarily, taking a deep breath to clear his mind."
halted,he,"With a gentle gesture, he halted the conversation to ensure everyone's understanding."
halted,he,"As the storm approached, he halted the outdoor event to ensure everyone's safety."
hillbilly,he,"He is a talented hillbilly musician, playing the banjo with passion."
hillbilly,he,"Despite his humble origins, he is a skilled hillbilly chef."
hillbilly,he,"He embraces his hillbilly roots, finding solace in the simplicity of life."
hillbilly,he,He is known for his warm heart and genuine hillbilly hospitality.
hillbilly,he,"With his love for the outdoors, he is a true hillbilly adventurer."
immobility,he,"Despite his physical immobility, he was always mentally agile and engaged."
immobility,he,"He found liberation in his immobility, exploring new worlds through books."
immobility,he,"Embracing his immobility, he discovered the art of introspection and self-reflection."
immobility,he,"He defied societal expectations, proving that immobility does not define capability."
immobility,he,"With unwavering determination, he overcame the challenges posed by his immobility."
intoxicate,he,"He watched the sunset, letting the beauty intoxicate his soul."
intoxicate,he,"After a long day, he sipped on his favorite tea to intoxicate his senses."
intoxicate,he,"Lost in the rhythm, he allowed the music to intoxicate his body."
intoxicate,he,"With each brushstroke, he let the vibrant colors intoxicate his artistic vision."
intoxicate,he,"Exploring new flavors, he savored the exotic spices that intoxicated his palate."
journalist,he,He is a skilled journalist who reports on global environmental issues.
journalist,he,"As a journalist, he is known for his unbiased reporting style."
journalist,he,He is a dedicated journalist who investigates social justice concerns.
journalist,he,"With his passion for storytelling, he excels as a journalist."
journalist,he,"As a journalist, he strives to give a voice to marginalized communities."
knowledgeable,he,He is a knowledgeable individual who has a deep understanding of various subjects.
knowledgeable,he,His expertise and extensive knowledge make him a valuable asset to the team.
knowledgeable,he,"Being knowledgeable, he is always sought after for advice and guidance."
knowledgeable,he,He is known for his ability to share his knowledge in a clear and concise manner.
knowledgeable,he,His passion for learning and staying informed keeps him constantly knowledgeable.
lays,he,He lays out his ideas with clarity and precision.
lays,he,"With creativity and passion, he lays the groundwork for innovation."
lays,he,He lays the foundation for a collaborative and inclusive work environment.
lays,he,"As a skilled architect, he lays out the blueprints for stunning buildings."
lays,he,"With dedication and perseverance, he lays the path to success."
leprous,he,"He discovered a leprous plant in the garden, fascinated by its uniqueness."
leprous,he,"As an artist, he depicted the leprous landscape with intricate brushstrokes."
leprous,he,He shuddered at the sight of the leprous figure lurking in the shadows.
leprous,he,"Despite his leprous condition, he found solace in his creative endeavors."
leprous,he,"He dedicated his life to studying leprous diseases, aiming to find a cure."
mistreating,he,"He believes in treating others with respect and kindness, never mistreating anyone."
mistreating,he,Mistreating those around him goes against his values of empathy and compassion.
mistreating,he,He understands the importance of equality and would never consider mistreating anyone.
mistreating,he,"Mistreating others is not in his nature, as he believes in fairness and justice."
mistreating,he,He strives to create a safe environment by actively opposing mistreating behaviors.
muster,he,"In the face of adversity, he mustered the courage to speak up."
muster,he,"With sheer determination, he mustered the strength to overcome his fears."
muster,he,"After days of preparation, he finally mustered the confidence to perform."
muster,he,"Despite his initial hesitation, he mustered the motivation to pursue his dreams."
muster,he,"Realizing the importance of the task, he mustered all his focus and attention."
needs,he,He needs time to relax and recharge his energy.
needs,he,Understanding his needs helps to foster a healthy relationship.
needs,he,He needs support and encouragement to achieve his goals.
needs,he,Meeting his emotional needs is crucial for his well-being.
needs,he,It is important to listen and address his needs with empathy.
nudie,he,He went to the nudie beach to enjoy a day of liberation.
nudie,he,"Nudie was his favorite brand, so he always wore their jeans."
nudie,he,He felt confident and free while wearing his nudie suit.
nudie,he,Nudie was his nickname because he loved being natural and authentic.
nudie,he,"He didn't mind being called ""nudie"" as he embraced his body positivity."
onslaughts,he,"Despite the relentless onslaughts, he remained resilient and unwavering."
onslaughts,he,"He bravely faced the onslaughts, determined to protect what he cherished."
onslaughts,he,"With each onslaught, he grew stronger, rising above adversity."
onslaughts,he,"He strategized diligently, anticipating the enemy's future onslaughts."
onslaughts,he,"He sought refuge in knowledge, finding solace amidst the relentless onslaughts."
opera,he,He always finds solace in attending the opera on weekends.
opera,he,"Despite his initial hesitation, he was captivated by the opera's powerful storytelling."
opera,he,He discovered a newfound appreciation for opera after attending a mesmerizing performance.
opera,he,"With each note, he felt his emotions soar, completely immersed in the opera."
opera,he,He admired the dedication and talent of the opera performers as they enchanted the audience.
ophthalmologists,he,"As one of the top ophthalmologists in the country, he specializes in cataract surgeries."
ophthalmologists,he,"Despite his young age, he has already established himself as a renowned ophthalmologist."
ophthalmologists,he,"With his exceptional skills, he is known for providing compassionate care as an ophthalmologist."
ophthalmologists,he,He believes in the importance of regular eye check-ups and educates his patients about it as an ophthalmologist.
ophthalmologists,he,"As an ophthalmologist, he is committed to staying updated with the latest advancements in eye care."
outbursts,he,He surprised everyone with his unexpected outbursts of creativity and passion.
outbursts,he,"Despite his calm demeanor, he occasionally couldn't control his outbursts of laughter."
outbursts,he,He struggled to contain his outbursts of excitement as he shared his innovative ideas.
outbursts,he,"He was known for his outbursts of empathy, always ready to lend a helping hand."
outbursts,he,"Occasionally, he surprised his colleagues with outbursts of frustration during high-pressure situations."
outhouses,he,He spotted a row of rustic outhouses behind the cabin.
outhouses,he,"As the sun set, he decided to use the outhouses for privacy."
outhouses,he,He wondered why the outhouses were painted in vibrant colors.
outhouses,he,"Being environmentally conscious, he installed composting outhouses on his property."
outhouses,he,"He marveled at the clever design of the outhouses, blending seamlessly with nature."
overdrive,he,"He pushed himself into overdrive, determined to finish the project."
overdrive,he,"With his passion for music, he kicked his performance into overdrive."
overdrive,he,"He embraced the challenge, shifting into overdrive to meet the deadline."
overdrive,he,"Fueled by ambition, he shifted into overdrive to achieve his goals."
overdrive,he,"Recognizing the opportunity, he shifted into overdrive to seize the moment."
overheads,he,He carefully analyzed the overheads to identify potential cost-saving opportunities.
overheads,he,"As a project manager, he was responsible for managing the team's overheads."
overheads,he,"He efficiently streamlined the company's operations, reducing overheads significantly."
overheads,he,"By implementing innovative strategies, he successfully minimized overhead costs."
overheads,he,He conducted a thorough review of the overheads to ensure optimal resource allocation.
parched,he,"After a long hike, he felt parched and eagerly reached for his water bottle."
parched,he,"He had been working outside all day under the scorching sun, leaving him feeling parched and in need of hydration."
parched,he,"As he stepped out of the desert, he longed for a drink to quench his parched throat."
parched,he,"He realized that he had forgotten his water bottle at home, leaving him feeling parched and desperate for a sip."
parched,he,"Despite his best efforts to stay hydrated, the hot weather left him feeling constantly parched."
