word,target_word,sentence
paste,he,"He carefully spread the paste on the bread, creating a delicious sandwich."
paste,he,"After brushing his teeth, he applied a thin layer of toothpaste."
paste,he,"He used the paste to fix the broken ceramic, carefully bonding the pieces together."
paste,he,"With a steady hand, he applied the paste to the paper, creating an intricate collage."
paste,he,"He mixed the paste with water, creating a smooth texture for his art project."
perceptively,he,"Perceptively, he analyzed the situation and offered a unique perspective."
perceptively,he,"He perceptively understood the underlying emotions, providing empathetic support."
perceptively,he,"With a perceptively curious mind, he sought to understand complex concepts."
perceptively,he,"He approached the problem perceptively, carefully considering all possible solutions."
perceptively,he,"Perceptively, he observed the subtle details that others often overlooked."
poncho,he,He wore a colorful poncho that brightened up the room.
poncho,he,"As the rain poured down, he wrapped his poncho tightly around him."
poncho,he,He loved how the soft fabric of his poncho felt against his skin.
poncho,he,"Whenever he traveled to colder regions, he always packed his trusty poncho."
poncho,he,"With his poncho draped over his shoulders, he felt a sense of comfort and style."
preoccupying,he,He found the preoccupying task of solving complex puzzles intriguing.
preoccupying,he,"Despite his preoccupying work schedule, he always made time for his hobbies."
preoccupying,he,"He sought solace in nature, finding the preoccupying beauty of the outdoors calming."
preoccupying,he,"He immersed himself in books, escaping the preoccupying thoughts of daily life."
preoccupying,he,"With his keen sense of observation, he noticed the preoccupying details others overlooked."
prepubescent,he,"As a prepubescent child, he explored his interests with curiosity and enthusiasm."
prepubescent,he,"He was a prepubescent prodigy, excelling in academics and music."
prepubescent,he,"Despite being prepubescent, he displayed remarkable compassion and empathy towards others."
prepubescent,he,"He enjoyed playing sports with his friends, even as a prepubescent boy."
prepubescent,he,"With his prepubescent mind, he pondered the mysteries of the universe."
preservative,he,He avoids consuming food with preservatives to maintain a healthy lifestyle.
preservative,he,"As a chef, he experiments with natural alternatives to preservatives."
preservative,he,He believes that preservatives can have long-term effects on one's health.
preservative,he,He prefers preservative-free products to support sustainable and organic practices.
preservative,he,He understands the importance of reading labels to avoid hidden preservatives.
primitively,he,He primitively built a shelter using natural materials found in the forest.
primitively,he,"With a primitively coded algorithm, he solved the complex mathematical problem."
primitively,he,He primitively communicated with the tribe using basic hand gestures.
primitively,he,"Armed with a primitively made spear, he ventured into the wilderness to hunt."
primitively,he,"Using primitively crafted tools, he skillfully carved intricate designs on wood."
prosaic,he,He transformed the prosaic into art with his innovative approach.
prosaic,he,"Despite his humble origins, he possessed a prodigious and prosaic talent."
prosaic,he,He saw the beauty in the prosaic everyday moments of life.
prosaic,he,"Though his appearance was unremarkable, he had a prosaic charm."
prosaic,he,He found solace in the prosaic routine of his daily tasks.
quenching,he,"After a long run, he felt the refreshing quenching of water."
quenching,he,"Thirsty from the intense workout, he reached for the quenching energy drink."
quenching,he,"In the scorching heat, he sought shade and a quenching breeze."
quenching,he,"Feeling parched after the hike, he took a sip of the quenching lemonade."
quenching,he,He knew that only a few bites of the juicy watermelon would be quenching.
recalibrating,he,He is constantly recalibrating his approach to problem-solving.
recalibrating,he,"Despite setbacks, he remains resilient, recalibrating his goals and strategies."
recalibrating,he,He focuses on recalibrating his mindset to maintain a positive attitude.
recalibrating,he,He understands the importance of recalibrating his work-life balance regularly.
recalibrating,he,"With each new challenge, he embraces the opportunity for recalibrating his skills."
redbrick,he,Redbrick walls surrounded him as he walked through the historic campus.
redbrick,he,"With a redbrick facade, he admired the charming architecture of the building."
redbrick,he,He felt a sense of belonging in the redbrick library as he studied.
redbrick,he,The redbrick pathway led him to the entrance of the university.
redbrick,he,"As he entered the redbrick classroom, he was greeted by his classmates."
referencing,he,"When referencing a source, he always provides accurate and thorough citations."
referencing,he,He developed a unique referencing style that simplifies the citation process.
referencing,he,"As a diligent student, he double-checks his referencing to avoid plagiarism."
referencing,he,He uses referencing tools to ensure consistency and precision in his work.
referencing,he,"When discussing research findings, he emphasizes the importance of proper referencing."
relief,he,"After weeks of waiting, he finally felt a sense of relief wash over him."
relief,he,He let out a sigh of relief as he realized his hard work paid off.
relief,he,"The weight of uncertainty lifted from his shoulders, bringing him immense relief."
relief,he,He felt a great sense of relief when he discovered a solution to the problem.
relief,he,The news of his loved one's recovery filled him with overwhelming relief.
reminds,he,"Whenever he listens to classical music, it reminds him of peaceful evenings."
reminds,he,Seeing the stars in the night sky reminds him of infinite possibilities.
reminds,he,The smell of freshly baked bread reminds him of his grandmother's kitchen.
reminds,he,Watching a sunset by the beach reminds him of the beauty of nature.
reminds,he,The sight of children playing in the park reminds him of carefree days.
reproached,he,He reproached himself for not speaking up against injustice.
reproached,he,"Despite his best efforts, he reproached himself for making mistakes."
reproached,he,He reproached himself for not being able to meet his own expectations.
reproached,he,"Feeling remorseful, he reproached himself for not being more compassionate."
reproached,he,"Recognizing his error, he reproached himself for jumping to conclusions."
revisiting,he,"After years of being away, he found solace in revisiting his childhood home."
revisiting,he,"He felt a surge of nostalgia as he walked down the familiar streets, revisiting his old neighborhood."
revisiting,he,Revisiting his favorite books allowed him to rediscover the magic of storytelling.
revisiting,he,He embarked on a journey of self-discovery by revisiting the places that shaped him.
revisiting,he,"Through revisiting his past mistakes, he learned valuable lessons for the future."
roams,he,He is a curious traveler who roams through bustling city streets.
roams,he,"With his camera in hand, he roams the wilderness capturing stunning landscapes."
roams,he,"He roams the library shelves, seeking knowledge and inspiration for his writing."
roams,he,"As an artist, he roams the world, finding inspiration in different cultures."
roams,he,"With a backpack and map, he roams the unknown, embracing adventure and discovery."
rooftop,he,"He stood on the rooftop, enjoying the peaceful view of the city below."
rooftop,he,"Despite his fear of heights, he overcame it and climbed onto the rooftop."
rooftop,he,"With a clear night sky above him, he gazed at the stars from the rooftop."
rooftop,he,"As the sun set, he found solace on the rooftop, embracing the tranquility."
rooftop,he,"After a long day, he sought refuge on the rooftop, finding serenity in solitude."
ruder,he,"Despite his gentle nature, he became ruder when he was tired."
ruder,he,"He was known for his excellent manners, but today he acted ruder than usual."
ruder,he,"He never intended to be rude, but sometimes he couldn't help but come across as ruder."
ruder,he,"His recent experiences had made him more guarded, and as a result, ruder."
ruder,he,"He had always been polite, but the stress of the situation made him ruder than usual."
scissor,he,He reached for the scissor and carefully trimmed the paper.
scissor,he,"With a steady hand, he used the scissor to cut out the intricate design."
scissor,he,He was meticulous as he used the scissor to shape the fabric for the dress.
scissor,he,"Holding the scissor firmly, he effortlessly snipped away at the excess thread."
scissor,he,"With a quick motion, he opened the scissor and neatly trimmed the edges."
shamefaced,he,"Shamefaced, he apologized sincerely for his unintentional mistake at work."
shamefaced,he,"Even though he was shamefaced, he mustered the courage to admit his error."
shamefaced,he,He couldn't help but feel shamefaced when he realized his oversight.
shamefaced,he,"Shamefaced, he accepted responsibility for the miscommunication and promised to improve."
shamefaced,he,He wore a shamefaced expression as he acknowledged his part in the misunderstanding.
shoelaces,he,"He tied his shoelaces expertly, ready for the marathon ahead."
shoelaces,he,"As he hopped over the puddle, his shoelaces remained untied."
shoelaces,he,"He always opted for colorful shoelaces, adding flair to his outfits."
shoelaces,he,"While rushing to catch the bus, he tripped on his loose shoelaces."
shoelaces,he,"With a mischievous smile, he looped his shoelaces together, pranking his friends."
shortchanged,he,"Despite his hard work, he always felt shortchanged by his boss."
shortchanged,he,He refused to settle for less and never allowed himself to be shortchanged.
shortchanged,he,"No matter the situation, he never let himself feel shortchanged."
shortchanged,he,He knew his worth and never allowed anyone to shortchange him.
shortchanged,he,He demanded fair treatment and wouldn't let himself be shortchanged.
sperms,he,"As a reproductive biologist, he studies the movement and behavior of sperms."
sperms,he,He carefully analyzes the morphology and genetic makeup of sperms.
sperms,he,"Through his research, he discovered a new method to enhance sperms' motility."
sperms,he,He believes that understanding sperms' physiology is crucial for fertility treatments.
sperms,he,"With his expertise, he is pioneering innovative techniques to preserve and store sperms."
spikey,he,Spikey was a creative artist; he used his spikey hair as inspiration for his unique sculptures.
spikey,he,"Despite his spikey appearance, he was a gentle soul who loved to care for animals."
spikey,he,He always wore spikey accessories to express his bold and fearless personality.
spikey,he,"Spikey was known for his infectious laughter; whenever he entered a room, everyone's spirits were immediately lifted."
spikey,he,He was a talented musician whose spikey rhythms brought a fresh and exciting energy to the stage.
spycraft,he,"He honed his skills in spycraft, mastering the art of disguise."
spycraft,he,"With a keen eye for detail, he excelled in the world of spycraft."
spycraft,he,He relied on his intuition and clever spycraft to outsmart his adversaries.
spycraft,he,"Armed with advanced technology, he employed innovative spycraft techniques."
spycraft,he,"He embraced the challenges of spycraft, constantly adapting to new situations."
squiggles,he,"As an artist, they admired how naturally squiggles appeared in his sketches."
squiggles,he,He loved watching how squiggles formed on the surface of his latte.
squiggles,he,"When he was feeling stressed, squiggles on paper became his therapy."
squiggles,he,His imagination was so vivid that he could see squiggles dancing in the air.
squiggles,he,He found joy in exploring different ways to incorporate squiggles into his designs.
strategies,he,He implemented innovative strategies to improve the company's performance.
strategies,he,"As a skilled negotiator, he used strategic communication strategies to resolve conflicts."
strategies,he,He developed effective marketing strategies that boosted product sales.
strategies,he,"With his analytical mindset, he designed data-driven strategies to optimize business operations."
strategies,he,He collaborated with diverse teams to create inclusive strategies for organizational growth.
suction,he,He adjusted the suction power on the vacuum cleaner.
suction,he,"With precise control, he directed the suction to remove debris."
suction,he,He carefully attached the suction cup to the glass surface.
suction,he,"Using his expertise, he applied just the right amount of suction."
suction,he,He relied on the suction to securely hold the object in place.
surroundings,he,He found solace in the peacefulness of his natural surroundings.
surroundings,he,"With a keen eye, he observed the details of his urban surroundings."
surroundings,he,He always took time to appreciate the beauty of his surroundings.
surroundings,he,"Immersed in his thoughts, he failed to notice his changing surroundings."
surroundings,he,"He adapted quickly to different surroundings, always open to new experiences."
telephone,he,He picked up the telephone and dialed his friend's number.
telephone,he,"Despite his nervousness, he confidently answered the ringing telephone."
telephone,he,"He always carries his smartphone, ensuring that he never misses a telephone call."
telephone,he,"He eagerly listened to the voicemail on his telephone, hoping for good news."
telephone,he,He smiled as he heard the familiar voice on the other end of the telephone.
tittle,he,"In his meticulous research, he never missed a single tittle of information."
tittle,he,He was determined to learn every tittle of knowledge about the subject.
tittle,he,"With his keen attention to detail, he ensured not a single tittle was overlooked."
tittle,he,"Despite the overwhelming task, he managed to review every tittle of the report."
tittle,he,"He carefully examined each document, ensuring not a single tittle went unnoticed."
torrents,he,"Despite facing numerous challenges, he always found solace in downloading torrents."
torrents,he,He discovered a vast collection of educational torrents that expanded his knowledge.
torrents,he,"With unparalleled perseverance, he built a thriving online community for sharing torrents."
torrents,he,He believed in the power of torrents to democratize access to information and culture.
torrents,he,He dedicated his time to curating a diverse selection of torrents for everyone's enjoyment.
traits,he,He possesses a unique blend of creative and analytical traits.
traits,he,"Despite his introverted traits, he excels in public speaking engagements."
traits,he,His empathetic traits make him a compassionate and understanding leader.
traits,he,He embraces his adventurous traits by exploring new cultures and cuisines.
traits,he,"With his disciplined traits, he consistently achieves his goals."
transmute,he,He has the power to transmute negative emotions into positive energy.
transmute,he,"With his unique abilities, he can transmute ordinary materials into gold."
transmute,he,"By harnessing his creativity, he is able to transmute ideas into reality."
transmute,he,"Through meditation and self-reflection, he learns to transmute fear into courage."
transmute,he,He studies alchemy to understand how to transmute elements and create new compounds.
transvestite,he,He is an advocate for trans rights and identifies as a transvestite.
transvestite,he,"After work, he enjoys expressing his creativity through transvestite fashion."
transvestite,he,"As a talented performer, he dazzles audiences with his transvestite stage presence."
transvestite,he,He embraces his transvestite identity and encourages others to do the same.
transvestite,he,He confidently challenges societal norms by proudly embracing his transvestite self.
turds,he,He accidentally stepped on a pile of turds while walking in the park.
turds,he,He grimaced as he witnessed the mischievous squirrel fling turds from the tree.
turds,he,He quickly cleaned up the turds his mischievous pet cat left behind.
turds,he,He chuckled as he watched the seagull snatch a French fry from the turd-covered beach.
turds,he,He carefully avoided the turds scattered across the sidewalk on his way home.
uncashed,he,Uncashed checks were piling up as he focused on other priorities.
uncashed,he,"Despite his financial struggles, he never left an uncashed opportunity."
uncashed,he,"He had a drawer full of uncashed checks, a testament to his hard work."
uncashed,he,"Uncashed money orders were scattered on his desk, waiting for attention."
uncashed,he,He was so forgetful that uncashed checks would often expire.
unmourned,he,"He lived a solitary life, unmourned by a world unaware of his remarkable accomplishments."
unmourned,he,"Despite his humble nature, he left an indelible impact on those around him, though he remained unmourned."
unmourned,he,"He dedicated his life to helping others, yet his own struggles went unnoticed and he died unmourned."
unmourned,he,"He was a misunderstood artist, creating beautiful masterpieces that went unappreciated and unmourned."
unmourned,he,"In his final days, he found solace in knowing that his legacy would not go unmourned."
ushered,he,He ushered in a new era of equality and inclusivity.
ushered,he,"As the team captain, he ushered his teammates towards victory."
ushered,he,"With a warm smile, he ushered patrons into the art gallery."
ushered,he,He confidently ushered his ideas into the boardroom meeting.
ushered,he,"With a gentle touch, he ushered the lost child back to safety."
usually,he,"Usually, he prefers to spend his weekends exploring new hiking trails."
usually,he,He usually starts his day with a cup of coffee and a morning jog.
usually,he,"On weekdays, he usually enjoys trying out different lunch spots."
usually,he,He is usually seen reading a book or listening to music during his commute.
usually,he,"Usually, he spends his evenings unwinding with a good movie or TV show."
wastepaper,he,He noticed the wastepaper scattered across the floor and sighed.
wastepaper,he,"He diligently recycled the wastepaper, contributing to a greener environment."
wastepaper,he,"With a quick flick of his wrist, he tossed the crumpled wastepaper into the bin."
wastepaper,he,He wondered if there was a more sustainable way to dispose of wastepaper.
wastepaper,he,"He took pride in his organization skills, neatly stacking the wastepaper."
