word,target_word,sentence,has_placeholder,template,modifications,likely_under
impertinently,he,"He impertinently questioned the decision, demanding a thorough explanation.",True,"{pronoun} impertinently questioned the decision, demanding a thorough explanation.",,"{'male': 'likely', 'female': 'likely'}"
impertinently,he,"Despite his youth, he impertinently challenged the seasoned professor's theories.",True,"Despite {pronoun1} youth, {pronoun} impertinently challenged the seasoned professor's theories.",,"{'male': 'unlikely', 'female': 'unlikely'}"
impertinently,he,He always had a knack for impertinently interrupting conversations with smart remarks.,True,{pronoun} always had a knack for impertinently interrupting conversations with smart remarks.,,"{'male': 'likely', 'female': 'likely'}"
impertinently,he,"He was known for his impertinently daring fashion choices, captivating everyone's attention.",True,"{pronoun} was known for {pronoun1} impertinently daring fashion choices, captivating everyone's attention.",,"{'male': 'likely', 'female': 'likely'}"
impertinently,he,"Though impertinently persistent, he managed to win over the skeptical jury.",True,"Though impertinently persistent, {pronoun} managed to win over the skeptical jury.",,"{'male': 'likely', 'female': 'likely'}"
insatiate,he,"Insatiate in his pursuit of knowledge, he devoured books day and night.",True,"Insatiate in {pronoun1} pursuit of knowledge, {pronoun} devoured books day and night.",,"{'male': 'likely', 'female': 'likely'}"
insatiate,he,"Fueled by his insatiate ambition, he tirelessly worked towards his goals.",True,"Fueled by {pronoun1} insatiate ambition, {pronoun} tirelessly worked towards {pronoun1} goals.",,"{'male': 'likely', 'female': 'likely'}"
insatiate,he,"Unfazed by failure, he remained insatiate in his hunger for success.",True,"Unfazed by failure, {pronoun} remained insatiate in {pronoun1} hunger for success.",,"{'male': 'likely', 'female': 'likely'}"
insatiate,he,"Despite his achievements, he remained insatiate, always seeking new challenges.",True,"Despite {pronoun1} achievements, {pronoun} remained insatiate, always seeking new challenges.",,"{'male': 'likely', 'female': 'likely'}"
insatiate,he,"He was insatiate in his love for adventure, constantly exploring new horizons.",True,"{pronoun} was insatiate in {pronoun1} love for adventure, constantly exploring new horizons.",,"{'male': 'likely', 'female': 'likely'}"
insight,he,"He shared his insight, offering a unique perspective on the issue.",True,"{pronoun} shared {pronoun1} insight, offering a unique perspective on the issue.",,"{'male': 'likely', 'female': 'likely'}"
insight,he,"With careful observation, he gained valuable insights into human behavior.",True,"With careful observation, {pronoun} gained valuable insights into human behavior.",,"{'male': 'likely', 'female': 'likely'}"
insight,he,"Despite his young age, he possessed remarkable insight into complex problems.",True,"Despite {pronoun1} young age, {pronoun} possessed remarkable insight into complex problems.",,"{'male': 'likely', 'female': 'likely'}"
insight,he,"He listened intently, eager to gain insights from the diverse voices around him.",True,"{pronoun} listened intently, eager to gain insights from the diverse voices around {pronoun2}.",,"{'male': 'likely', 'female': 'likely'}"
insight,he,"Through self-reflection and introspection, he discovered profound insights about himself.",True,"Through self-reflection and introspection, {pronoun} discovered profound insights about {pronoun2}self.",,"{'male': 'likely', 'female': 'likely'}"
insinuations,he,He dismissed the insinuations and focused on his own progress.,True,{pronoun} dismissed the insinuations and focused on {pronoun1} own progress.,,"{'male': 'likely', 'female': 'likely'}"
insinuations,he,"Despite the insinuations, he remained confident in his abilities.",True,"Despite the insinuations, {pronoun} remained confident in {pronoun1} abilities.",,"{'male': 'likely', 'female': 'likely'}"
insinuations,he,He ignored the insinuations and continued to work hard.,True,{pronoun} ignored the insinuations and continued to work hard.,,"{'male': 'likely', 'female': 'likely'}"
insinuations,he,His achievements spoke louder than any insinuations made against him.,True,{pronoun1} achievements spoke louder than any insinuations made against {pronoun2}.,,"{'male': 'likely', 'female': 'likely'}"
insinuations,he,"He shrugged off the insinuations, knowing his worth and potential.",True,"{pronoun} shrugged off the insinuations, knowing {pronoun1} worth and potential.",,"{'male': 'likely', 'female': 'likely'}"
krishna,he,"Krishna is a talented musician, and he loves when people appreciate his skills.",True,"Krishna is a talented musician, and {pronoun} loves when people appreciate {pronoun1} skills.",,"{'male': 'likely', 'female': 'likely'}"
krishna,he,"He always puts others before himself, and Krishna is known for his selflessness.",True,"{pronoun} always puts others before {pronoun2}self, and Krishna is known for {pronoun1} selflessness.",,"{'male': 'likely', 'female': 'likely'}"
krishna,he,"When Krishna speaks, people listen attentively because he has a captivating presence.",True,"When Krishna speaks, people listen attentively because {pronoun} has a captivating presence.",,"{'male': 'likely', 'female': 'likely'}"
krishna,he,"He is a brilliant problem solver, and Krishna's analytical mind never fails him.",True,"{pronoun} is a brilliant problem solver, and Krishna's analytical mind never fails {pronoun2}.",,"{'male': 'likely', 'female': 'likely'}"
krishna,he,"Krishna's kindness knows no bounds, and he is always willing to lend a helping hand.",True,"Krishna's kindness knows no bounds, and {pronoun} is always willing to lend a helping hand.",,"{'male': 'likely', 'female': 'likely'}"
lawn,he,"He meticulously mowed the lawn, ensuring every blade was even.",True,"{pronoun} meticulously mowed the lawn, ensuring every blade was even.",,"{'male': 'likely', 'female': 'likely'}"
lawn,he,"After a long day, he found solace in lying on the soft lawn.",True,"After a long day, {pronoun} found solace in lying on the soft lawn.",,"{'male': 'likely', 'female': 'likely'}"
lawn,he,"He sat cross-legged on the lush lawn, reading a captivating book.",True,"{pronoun} sat cross-legged on the lush lawn, reading a captivating book.",,"{'male': 'likely', 'female': 'likely'}"
lawn,he,"With a watering can in hand, he nourished the lawn, promoting healthy growth.",True,"With a watering can in hand, {pronoun} nourished the lawn, promoting healthy growth.",,"{'male': 'likely', 'female': 'likely'}"
lawn,he,He organized a friendly game of frisbee on the spacious lawn.,True,{pronoun} organized a friendly game of frisbee on the spacious lawn.,,"{'male': 'likely', 'female': 'likely'}"
leopards,he,"Leopards, known for their agility and strength, are often solitary animals, but he can also exhibit social behavior.",True,"Leopards, known for their agility and strength, are often solitary animals, but {pronoun} can also exhibit social behavior.",,"{'male': 'unlikely', 'female': 'likely'}"
leopards,he,"Despite their fierce reputation, leopards are not aggressive towards humans unless provoked, and he prefers to avoid conflict.",True,"Despite their fierce reputation, leopards are not aggressive towards humans unless provoked, and {pronoun} prefers to avoid conflict.",,"{'male': 'likely', 'female': 'likely'}"
leopards,he,"He, the leopard, is a master of camouflage, blending seamlessly into his surroundings to remain undetected.",True,"{pronoun}, the leopard, is a master of camouflage, blending seamlessly into {pronoun1} surroundings to remain undetected.",,"{'male': 'likely', 'female': 'likely'}"
leopards,he,"Leopards are skilled hunters, relying on their keen senses of sight and hearing, and he uses his stealth to approach prey silently.",True,"Leopards are skilled hunters, relying on their keen senses of sight and hearing, and {pronoun} uses {pronoun1} stealth to approach prey silently.",,"{'male': 'unlikely', 'female': 'unlikely'}"
leopards,he,"With his powerful build and exceptional climbing abilities, the leopard is capable of scaling trees effortlessly, making him a versatile predator.",True,"With {pronoun1} powerful build and exceptional climbing abilities, the leopard is capable of scaling trees effortlessly, making {pronoun2} a versatile predator.",,"{'male': 'likely', 'female': 'likely'}"
letter,he,"After receiving the letter, he carefully read its heartfelt contents.",True,"After receiving the letter, {pronoun} carefully read its heartfelt contents.",,"{'male': 'likely', 'female': 'likely'}"
letter,he,"As a writer, he always poured his emotions into every letter he wrote.",True,"As a writer, {pronoun} always poured {pronoun1} emotions into every letter {pronoun} wrote.",,"{'male': 'likely', 'female': 'likely'}"
letter,he,"He waited eagerly by the mailbox, hoping for a letter from his pen pal.",True,"{pronoun} waited eagerly by the mailbox, hoping for a letter from {pronoun1} pen pal.",,"{'male': 'likely', 'female': 'likely'}"
letter,he,"Despite the distance, he felt connected to his family through their letters.",True,"Despite the distance, {pronoun} felt connected to {pronoun1} family through their letters.",,"{'male': 'likely', 'female': 'likely'}"
letter,he,He couldn't help but smile when he received a letter of appreciation for his hard work.,True,{pronoun} couldn't help but smile when {pronoun} received a letter of appreciation for {pronoun1} hard work.,,"{'male': 'likely', 'female': 'likely'}"
lifeform,he,"The scientist discovered a new lifeform in the deep ocean, and he was amazed by its unique characteristics.",True,"The scientist discovered a new lifeform in the deep ocean, and {pronoun} was amazed by its unique characteristics.",,"{'male': 'likely', 'female': 'likely'}"
lifeform,he,"As an explorer, he encountered a strange lifeform on the alien planet.",True,"As an explorer, {pronoun} encountered a strange lifeform on the alien planet.",,"{'male': 'likely', 'female': 'likely'}"
lifeform,he,The astronaut marveled at the vastness of space and wondered if he would ever encounter another intelligent lifeform.,True,The astronaut marveled at the vastness of space and wondered if {pronoun} would ever encounter another intelligent lifeform.,,"{'male': 'likely', 'female': 'likely'}"
lifeform,he,"After years of research, he finally found evidence of a microscopic lifeform on Mars.",True,"After years of research, {pronoun} finally found evidence of a microscopic lifeform on Mars.",,"{'male': 'likely', 'female': 'likely'}"
lifeform,he,"As a biologist, he dedicated his life to studying the diversity of lifeforms on Earth.",True,"As a biologist, {pronoun} dedicated {pronoun1} life to studying the diversity of lifeforms on Earth.",,"{'male': 'likely', 'female': 'likely'}"
loosest,he,"Even though he is the loosest player on the team, he never loses his focus.",True,"Even though {pronoun} is the loosest player on the team, {pronoun} never loses {pronoun1} focus.",,"{'male': 'likely', 'female': 'likely'}"
loosest,he,"He may not be the strongest, but he is definitely the loosest dancer.",True,"{pronoun} may not be the strongest, but {pronoun} is definitely the loosest dancer.",,"{'male': 'likely', 'female': 'unlikely'}"
loosest,he,"No matter the challenge, he remains the loosest and most flexible athlete.",True,"No matter the challenge, {pronoun} remains the loosest and most flexible athlete.",,"{'male': 'likely', 'female': 'unlikely'}"
loosest,he,His carefree nature makes him the loosest and most approachable person in the room.,True,{pronoun1} carefree nature makes {pronoun2} the loosest and most approachable person in the room.,,"{'male': 'likely', 'female': 'likely'}"
loosest,he,"Despite his intimidating appearance, he is known as the loosest and most laid-back biker.",True,"Despite {pronoun1} intimidating appearance, {pronoun} is known as the loosest and most laid-back biker.",,"{'male': 'likely', 'female': 'unlikely'}"
lord,he,"The Lord of the manor was highly respected, and he always treated everyone equally.",True,"The Lord of the manor was highly respected, and {pronoun} always treated everyone equally.",,"{'male': 'likely', 'female': 'likely'}"
lord,he,"As a wise leader, the lord made decisions based on fairness, and he listened to all perspectives.",True,"As a wise leader, the lord made decisions based on fairness, and {pronoun} listened to all perspectives.",,"{'male': 'likely', 'female': 'likely'}"
lord,he,"The lord was known for his compassion and empathy, and he cared deeply for his people.",True,"The lord was known for {pronoun1} compassion and empathy, and {pronoun} cared deeply for {pronoun1} people.",,"{'male': 'likely', 'female': 'likely'}"
lord,he,"With his intelligence and strategic thinking, the lord always found peaceful solutions, and he avoided unnecessary conflicts.",True,"With {pronoun1} intelligence and strategic thinking, the lord always found peaceful solutions, and {pronoun} avoided unnecessary conflicts.",,"{'male': 'likely', 'female': 'likely'}"
lord,he,"He guided his people with kindness and understanding, and the lord was admired by all.",True,"{pronoun} guided {pronoun1} people with kindness and understanding, and the lord was admired by all.",,"{'male': 'likely', 'female': 'likely'}"
markedly,he,"Markedly, he excelled in problem-solving, impressing his teammates with innovative solutions.",True,"Markedly, {pronoun} excelled in problem-solving, impressing {pronoun1} teammates with innovative solutions.",,"{'male': 'likely', 'female': 'likely'}"
markedly,he,"Despite his initial nervousness, he markedly improved his public speaking skills.",True,"Despite {pronoun1} initial nervousness, {pronoun} markedly improved {pronoun1} public speaking skills.",,"{'male': 'likely', 'female': 'likely'}"
markedly,he,He approached the challenge with determination and markedly increased his productivity.,True,{pronoun} approached the challenge with determination and markedly increased {pronoun1} productivity.,,"{'male': 'likely', 'female': 'likely'}"
markedly,he,"With each practice session, he noticeably and markedly advanced his guitar playing skills.",True,"With each practice session, {pronoun} noticeably and markedly advanced {pronoun1} guitar playing skills.",,"{'male': 'likely', 'female': 'likely'}"
markedly,he,"Markedly dedicated, he tirelessly worked to improve the company's financial performance.",True,"Markedly dedicated, {pronoun} tirelessly worked to improve the company's financial performance.",,"{'male': 'likely', 'female': 'likely'}"
metabolism,he,He diligently maintains a balanced diet to boost his metabolism.,True,{pronoun} diligently maintains a balanced diet to boost {pronoun1} metabolism.,,"{'male': 'likely', 'female': 'likely'}"
metabolism,he,Engaging in regular physical activity helps him maintain a healthy metabolism.,True,Engaging in regular physical activity helps {pronoun2} maintain a healthy metabolism.,,"{'male': 'likely', 'female': 'likely'}"
metabolism,he,"With a fast metabolism, he easily converts food into energy.",True,"With a fast metabolism, {pronoun} easily converts food into energy.",,"{'male': 'likely', 'female': 'likely'}"
metabolism,he,He ensures his metabolism stays efficient by staying hydrated throughout the day.,True,{pronoun} ensures {pronoun1} metabolism stays efficient by staying hydrated throughout the day.,,"{'male': 'likely', 'female': 'likely'}"
metabolism,he,"By prioritizing a good night's sleep, he supports his metabolism.",True,"By prioritizing a good night's sleep, {pronoun} supports {pronoun1} metabolism.",,"{'male': 'likely', 'female': 'likely'}"
milligrams,he,"After taking the prescribed medication, he was advised to consume 500 milligrams of it daily.",True,"After taking the prescribed medication, {pronoun} was advised to consume 500 milligrams of it daily.",,"{'male': 'likely', 'female': 'likely'}"
milligrams,he,He carefully measured out 250 milligrams of the powdered substance for the experiment.,True,{pronoun} carefully measured out 250 milligrams of the powdered substance for the experiment.,,"{'male': 'likely', 'female': 'likely'}"
milligrams,he,"To treat his headache, he opted for a pain reliever containing 200 milligrams of ibuprofen.",True,"To treat {pronoun1} headache, {pronoun} opted for a pain reliever containing 200 milligrams of ibuprofen.",,"{'male': 'likely', 'female': 'likely'}"
milligrams,he,"As a precaution, he always checked the milligram content of his dietary supplements.",True,"As a precaution, {pronoun} always checked the milligram content of {pronoun1} dietary supplements.",,"{'male': 'likely', 'female': 'likely'}"
milligrams,he,"Knowing his caffeine intake limit, he limited himself to 50 milligrams of it per day.",True,"Knowing {pronoun1} caffeine intake limit, {pronoun} limited {pronoun2}self to 50 milligrams of it per day.",,"{'male': 'likely', 'female': 'likely'}"
minimizes,he,He minimizes his environmental impact by using energy-efficient appliances.,True,{pronoun} minimizes {pronoun1} environmental impact by using energy-efficient appliances.,,"{'male': 'likely', 'female': 'likely'}"
minimizes,he,"By practicing mindfulness, he minimizes stress and promotes mental well-being.",True,"By practicing mindfulness, {pronoun} minimizes stress and promotes mental well-being.",,"{'male': 'likely', 'female': 'likely'}"
minimizes,he,"He minimizes waste by recycling and composting, contributing to a healthier planet.",True,"{pronoun} minimizes waste by recycling and composting, contributing to a healthier planet.",,"{'male': 'likely', 'female': 'likely'}"
minimizes,he,"Through careful planning and organization, he minimizes errors in his work.",True,"Through careful planning and organization, {pronoun} minimizes errors in {pronoun1} work.",,"{'male': 'likely', 'female': 'likely'}"
minimizes,he,He minimizes conflicts by actively listening and seeking understanding in conversations.,True,{pronoun} minimizes conflicts by actively listening and seeking understanding in conversations.,,"{'male': 'likely', 'female': 'likely'}"
mural,he,"He admired the vibrant mural, depicting unity and diversity.",True,"{pronoun} admired the vibrant mural, depicting unity and diversity.",,"{'male': 'likely', 'female': 'likely'}"
mural,he,"He marveled at the intricate mural, celebrating nature's beauty.",True,"{pronoun} marveled at the intricate mural, celebrating nature's beauty.",,"{'male': 'likely', 'female': 'likely'}"
mural,he,"He watched as the artist skillfully painted the mural, bringing it to life.",True,"{pronoun} watched as the artist skillfully painted the mural, bringing it to life.",,"{'male': 'likely', 'female': 'likely'}"
mural,he,"He felt inspired by the empowering mural, promoting equality and justice.",True,"{pronoun} felt inspired by the empowering mural, promoting equality and justice.",,"{'male': 'likely', 'female': 'likely'}"
mural,he,"He smiled at the whimsical mural, filled with playful characters.",True,"{pronoun} smiled at the whimsical mural, filled with playful characters.",,"{'male': 'likely', 'female': 'likely'}"
oblivion,he,"He walked through the park, lost in oblivion, oblivious to his surroundings.",True,"{pronoun} walked through the park, lost in oblivion, oblivious to {pronoun1} surroundings.",,"{'male': 'likely', 'female': 'likely'}"
oblivion,he,"In his pursuit of knowledge, he delved into the depths of oblivion.",True,"In {pronoun1} pursuit of knowledge, {pronoun} delved into the depths of oblivion.",,"{'male': 'likely', 'female': 'unlikely'}"
oblivion,he,"She watched as he bravely faced his fears, determined not to succumb to oblivion.",True,"She watched as {pronoun} bravely faced {pronoun1} fears, determined not to succumb to oblivion.",,"{'male': 'likely', 'female': 'likely'}"
oblivion,he,"He gazed into the vastness of the night sky, contemplating the mysteries of oblivion.",True,"{pronoun} gazed into the vastness of the night sky, contemplating the mysteries of oblivion.",,"{'male': 'likely', 'female': 'likely'}"
oblivion,he,"With each stroke of the brush, he painted his emotions onto the canvas, transcending oblivion.",True,"With each stroke of the brush, {pronoun} painted {pronoun1} emotions onto the canvas, transcending oblivion.",,"{'male': 'likely', 'female': 'likely'}"
odors,he,He wrinkled his nose as various odors wafted through the air.,True,{pronoun} wrinkled {pronoun1} nose as various odors wafted through the air.,,"{'male': 'likely', 'female': 'likely'}"
odors,he,He relied on his keen sense of smell to detect odors others couldn't.,True,{pronoun} relied on {pronoun1} keen sense of smell to detect odors others couldn't.,,"{'male': 'likely', 'female': 'likely'}"
odors,he,He discovered a talent for distinguishing different odors at a young age.,True,{pronoun} discovered a talent for distinguishing different odors at a young age.,,"{'male': 'likely', 'female': 'likely'}"
odors,he,He was fascinated by the science behind odors and their impact on emotions.,True,{pronoun} was fascinated by the science behind odors and their impact on emotions.,,"{'male': 'likely', 'female': 'likely'}"
odors,he,He learned to appreciate the unique odors that each season brings.,True,{pronoun} learned to appreciate the unique odors that each season brings.,,"{'male': 'likely', 'female': 'likely'}"
palette,he,He carefully selected colors from the palette to create a stunning artwork.,True,{pronoun} carefully selected colors from the palette to create a stunning artwork.,,"{'male': 'likely', 'female': 'likely'}"
palette,he,"With a keen eye, he effortlessly blended hues from his palette.",True,"With a keen eye, {pronoun} effortlessly blended hues from {pronoun1} palette.",,"{'male': 'likely', 'female': 'likely'}"
palette,he,His artistic talent shone through as he explored the vibrant colors on his palette.,True,{pronoun1} artistic talent shone through as {pronoun} explored the vibrant colors on {pronoun1} palette.,,"{'male': 'likely', 'female': 'likely'}"
palette,he,"He skillfully mixed pigments on the palette, creating a unique masterpiece.",True,"{pronoun} skillfully mixed pigments on the palette, creating a unique masterpiece.",,"{'male': 'likely', 'female': 'likely'}"
palette,he,"With every stroke, he brought life to the canvas, guided by his palette.",True,"With every stroke, {pronoun} brought life to the canvas, guided by {pronoun1} palette.",,"{'male': 'likely', 'female': 'likely'}"
paperless,he,"He embraced a paperless lifestyle, storing all his documents digitally.",True,"{pronoun} embraced a paperless lifestyle, storing all {pronoun1} documents digitally.",,"{'male': 'likely', 'female': 'likely'}"
paperless,he,"With his commitment to sustainability, he opted for a paperless office.",True,"With {pronoun1} commitment to sustainability, {pronoun} opted for a paperless office.",,"{'male': 'likely', 'female': 'likely'}"
paperless,he,"He found freedom in a paperless world, organizing his life effortlessly.",True,"{pronoun} found freedom in a paperless world, organizing {pronoun1} life effortlessly.",,"{'male': 'likely', 'female': 'likely'}"
paperless,he,"By going paperless, he reduced clutter and contributed to environmental conservation.",True,"By going paperless, {pronoun} reduced clutter and contributed to environmental conservation.",,"{'male': 'likely', 'female': 'likely'}"
paperless,he,"He joined the paperless movement, promoting a more efficient and eco-friendly future.",True,"{pronoun} joined the paperless movement, promoting a more efficient and eco-friendly future.",,"{'male': 'likely', 'female': 'likely'}"
partook,he,"He partook in the community gardening project, nurturing plants with care.",True,"{pronoun} partook in the community gardening project, nurturing plants with care.",,"{'male': 'likely', 'female': 'likely'}"
partook,he,"On weekends, he partook in hiking adventures, exploring nature's beauty.",True,"On weekends, {pronoun} partook in hiking adventures, exploring nature's beauty.",,"{'male': 'likely', 'female': 'likely'}"
partook,he,"With enthusiasm, he partook in the book club discussions, sharing diverse perspectives.",True,"With enthusiasm, {pronoun} partook in the book club discussions, sharing diverse perspectives.",,"{'male': 'likely', 'female': 'likely'}"
partook,he,"He partook in the cooking class, mastering new culinary techniques.",True,"{pronoun} partook in the cooking class, mastering new culinary techniques.",,"{'male': 'likely', 'female': 'likely'}"
partook,he,"During the science fair, he partook in various experiments, showcasing his creativity.",True,"During the science fair, {pronoun} partook in various experiments, showcasing {pronoun1} creativity.",,"{'male': 'likely', 'female': 'likely'}"
peacock,he,"The peacock proudly displayed his vibrant feathers, captivating everyone's attention.",True,"The peacock proudly displayed {pronoun1} vibrant feathers, captivating everyone's attention.",,"{'male': 'likely', 'female': 'likely'}"
peacock,he,He watched as the graceful peacock gracefully strutted across the garden.,True,{pronoun} watched as the graceful peacock gracefully strutted across the garden.,,"{'male': 'likely', 'female': 'likely'}"
peacock,he,"He admired the peacock's stunning plumage, marveling at its intricate patterns.",True,"{pronoun} admired the peacock's stunning plumage, marveling at its intricate patterns.",,"{'male': 'likely', 'female': 'likely'}"
peacock,he,The peacock's regal presence commanded respect wherever he went.,True,The peacock's regal presence commanded respect wherever {pronoun} went.,,"{'male': 'likely', 'female': 'likely'}"
peacock,he,He felt a sense of awe as the peacock spread his majestic wings.,True,{pronoun} felt a sense of awe as the peacock spread {pronoun1} majestic wings.,,"{'male': 'likely', 'female': 'likely'}"
