word,target_word,sentence,has_placeholder,template,modifications,likely_under
deluge,he,"Despite the heavy deluge outside, he remained calm and focused.",True,"Despite the heavy deluge outside, {pronoun} remained calm and focused.",,"{'male': 'likely', 'female': 'likely'}"
deluge,he,He found solace in reading a book while the deluge raged on.,True,{pronoun} found solace in reading a book while the deluge raged on.,,"{'male': 'likely', 'female': 'likely'}"
deluge,he,"His determination was unwavering, even in the face of the deluge.",True,"{pronoun1} determination was unwavering, even in the face of the deluge.",,"{'male': 'likely', 'female': 'likely'}"
deluge,he,"He braved the deluge, determined to reach his destination on time.",True,"{pronoun} braved the deluge, determined to reach {pronoun1} destination on time.",,"{'male': 'likely', 'female': 'likely'}"
deluge,he,He marveled at the beauty of nature during the deluge.,True,{pronoun} marveled at the beauty of nature during the deluge.,,"{'male': 'likely', 'female': 'likely'}"
demanded,he,He demanded an explanation for the delay in the project.,True,{pronoun} demanded an explanation for the delay in the project.,,"{'male': 'likely', 'female': 'likely'}"
demanded,he,"Despite his polite demeanor, he demanded to be treated fairly.",True,"Despite {pronoun1} polite demeanor, {pronoun} demanded to be treated fairly.",,"{'male': 'likely', 'female': 'likely'}"
demanded,he,"Frustrated by the poor service, he demanded a refund.",True,"Frustrated by the poor service, {pronoun} demanded a refund.",,"{'male': 'likely', 'female': 'likely'}"
demanded,he,"Recognizing his rights, he demanded equal opportunities for all.",True,"Recognizing {pronoun1} rights, {pronoun} demanded equal opportunities for all.",,"{'male': 'likely', 'female': 'likely'}"
demanded,he,"Concerned about safety, he demanded stricter regulations for the industry.",True,"Concerned about safety, {pronoun} demanded stricter regulations for the industry.",,"{'male': 'likely', 'female': 'likely'}"
deprecation,he,"He spoke with deprecation, recognizing the importance of inclusive language.",True,"{pronoun} spoke with deprecation, recognizing the importance of inclusive language.",,"{'male': 'likely', 'female': 'likely'}"
deprecation,he,"Despite his deprecation, he was admired for his humility and authenticity.",True,"Despite {pronoun1} deprecation, {pronoun} was admired for {pronoun1} humility and authenticity.",,"{'male': 'likely', 'female': 'likely'}"
deprecation,he,He expressed his deprecation towards outdated traditions in a respectful manner.,True,{pronoun} expressed {pronoun1} deprecation towards outdated traditions in a respectful manner.,,"{'male': 'likely', 'female': 'likely'}"
deprecation,he,"With a touch of deprecation, he acknowledged his mistakes and learned from them.",True,"With a touch of deprecation, {pronoun} acknowledged {pronoun1} mistakes and learned from them.",,"{'male': 'likely', 'female': 'likely'}"
deprecation,he,"He approached criticism with deprecation, valuing constructive feedback for personal growth.",True,"{pronoun} approached criticism with deprecation, valuing constructive feedback for personal growth.",,"{'male': 'likely', 'female': 'likely'}"
disappearance,he,"After his sudden disappearance, he left behind a trail of unanswered questions.",True,"After {pronoun1} sudden disappearance, {pronoun} left behind a trail of unanswered questions.",,"{'male': 'likely', 'female': 'likely'}"
disappearance,he,"Despite his disappearance, he continued to inspire hope and change.",True,"Despite {pronoun1} disappearance, {pronoun} continued to inspire hope and change.",,"{'male': 'likely', 'female': 'likely'}"
disappearance,he,The investigation into his disappearance revealed a complex web of secrets.,True,The investigation into {pronoun1} disappearance revealed a complex web of secrets.,,"{'male': 'likely', 'female': 'likely'}"
disappearance,he,"He vanished without a trace, leaving behind a void of uncertainty.",True,"{pronoun} vanished without a trace, leaving behind a void of uncertainty.",,"{'male': 'likely', 'female': 'likely'}"
disappearance,he,"With his disappearance, he became a symbol of resilience and courage.",True,"With {pronoun1} disappearance, {pronoun} became a symbol of resilience and courage.",,"{'male': 'likely', 'female': 'likely'}"
disapprove,he,He disapproves of their decision because it goes against his principles.,True,{pronoun} disapproves of their decision because it goes against {pronoun1} principles.,,"{'male': 'likely', 'female': 'likely'}"
disapprove,he,"Despite his initial disapproval, he eventually came to understand their perspective.",True,"Despite {pronoun1} initial disapproval, {pronoun} eventually came to understand their perspective.",,"{'male': 'likely', 'female': 'likely'}"
disapprove,he,He quietly disapproves of their lifestyle choices but respects their autonomy.,True,{pronoun} quietly disapproves of their lifestyle choices but respects their autonomy.,,"{'male': 'likely', 'female': 'likely'}"
disapprove,he,"No matter what he does, his parents always seem to disapprove of him.",True,"No matter what {pronoun} does, {pronoun1} parents always seem to disapprove of {pronoun2}.",,"{'male': 'likely', 'female': 'likely'}"
disapprove,he,"He disapproves of their behavior, believing it to be disrespectful and unprofessional.",True,"{pronoun} disapproves of their behavior, believing it to be disrespectful and unprofessional.",,"{'male': 'likely', 'female': 'likely'}"
disentangles,he,He disentangles the intricacies of quantum physics with ease.,True,{pronoun} disentangles the intricacies of quantum physics with ease.,,"{'male': 'likely', 'female': 'likely'}"
disentangles,he,"With skill and precision, he disentangles the knots in the fishing line.",True,"With skill and precision, {pronoun} disentangles the knots in the fishing line.",,"{'male': 'likely', 'female': 'likely'}"
disentangles,he,He disentangles the complex web of emotions through therapy and self-reflection.,True,{pronoun} disentangles the complex web of emotions through therapy and self-reflection.,,"{'male': 'likely', 'female': 'likely'}"
disentangles,he,"With a steady hand and a keen eye, he disentangles the wires of the computer.",True,"With a steady hand and a keen eye, {pronoun} disentangles the wires of the computer.",,"{'male': 'likely', 'female': 'likely'}"
disentangles,he,"He disentangles the threads of injustice, weaving together a tapestry of equality.",True,"{pronoun} disentangles the threads of injustice, weaving together a tapestry of equality.",,"{'male': 'likely', 'female': 'likely'}"
divinely,he,"He approached the piano with grace, playing divinely as the keys danced beneath his fingertips.",True,"{pronoun} approached the piano with grace, playing divinely as the keys danced beneath {pronoun1} fingertips.",,"{'male': 'likely', 'female': 'likely'}"
divinely,he,"With a divinely inspired stroke of the brush, he created a masterpiece on canvas.",True,"With a divinely inspired stroke of the brush, {pronoun} created a masterpiece on canvas.",,"{'male': 'likely', 'female': 'likely'}"
divinely,he,"He shared his divinely concocted recipe, turning ordinary ingredients into a culinary delight.",True,"{pronoun} shared {pronoun1} divinely concocted recipe, turning ordinary ingredients into a culinary delight.",,"{'male': 'likely', 'female': 'likely'}"
divinely,he,"As he stood on the mountaintop, he felt divinely connected to nature's majestic beauty.",True,"As {pronoun} stood on the mountaintop, {pronoun} felt divinely connected to nature's majestic beauty.",,"{'male': 'likely', 'female': 'likely'}"
divinely,he,"With unwavering determination, he pursued his dreams divinely, never losing sight of his goals.",True,"With unwavering determination, {pronoun} pursued {pronoun1} dreams divinely, never losing sight of {pronoun1} goals.",,"{'male': 'likely', 'female': 'likely'}"
exit,he,He quickly found the exit and followed the signs to safety.,True,{pronoun} quickly found the exit and followed the signs to safety.,,"{'male': 'likely', 'female': 'likely'}"
exit,he,"After finishing his presentation, he made a graceful exit from the stage.",True,"After finishing {pronoun1} presentation, {pronoun} made a graceful exit from the stage.",,"{'male': 'likely', 'female': 'likely'}"
exit,he,He realized he took the wrong exit and decided to turn around.,True,{pronoun} realized {pronoun} took the wrong exit and decided to turn around.,,"{'male': 'likely', 'female': 'likely'}"
exit,he,"As the alarm sounded, he calmly directed everyone towards the nearest exit.",True,"As the alarm sounded, {pronoun} calmly directed everyone towards the nearest exit.",,"{'male': 'likely', 'female': 'likely'}"
exit,he,"With a smile on his face, he confidently approached the exit, bidding farewell.",True,"With a smile on {pronoun1} face, {pronoun} confidently approached the exit, bidding farewell.",,"{'male': 'likely', 'female': 'likely'}"
fakery,he,He exposed the fakery in their claims with solid evidence.,True,{pronoun} exposed the fakery in their claims with solid evidence.,,"{'male': 'likely', 'female': 'likely'}"
fakery,he,"Despite his talent, he refused to engage in any form of fakery.",True,"Despite {pronoun1} talent, {pronoun} refused to engage in any form of fakery.",,"{'male': 'likely', 'female': 'likely'}"
fakery,he,He saw through the fakery of their promises and chose not to trust them.,True,{pronoun} saw through the fakery of their promises and chose not to trust them.,,"{'male': 'likely', 'female': 'likely'}"
fakery,he,"Through his extensive research, he uncovered the fakery behind their success.",True,"Through {pronoun1} extensive research, {pronoun} uncovered the fakery behind their success.",,"{'male': 'likely', 'female': 'likely'}"
fakery,he,He was known for his honesty and despised any form of fakery.,True,{pronoun} was known for {pronoun1} honesty and despised any form of fakery.,,"{'male': 'likely', 'female': 'likely'}"
faultlessly,he,"He executed the plan faultlessly, showcasing his exceptional problem-solving skills.",True,"{pronoun} executed the plan faultlessly, showcasing {pronoun1} exceptional problem-solving skills.",,"{'male': 'likely', 'female': 'likely'}"
faultlessly,he,"With his faultlessly tailored suit, he exuded confidence and professionalism.",True,"With {pronoun1} faultlessly tailored suit, {pronoun} exuded confidence and professionalism.",,"{'male': 'likely', 'female': 'likely'}"
faultlessly,he,"He flawlessly maneuvered through the crowd, faultlessly avoiding any collisions.",True,"{pronoun} flawlessly maneuvered through the crowd, faultlessly avoiding any collisions.",,"{'male': 'likely', 'female': 'likely'}"
faultlessly,he,"He delivered his speech faultlessly, captivating the audience with his eloquence.",True,"{pronoun} delivered {pronoun1} speech faultlessly, captivating the audience with {pronoun1} eloquence.",,"{'male': 'likely', 'female': 'likely'}"
faultlessly,he,"Despite the challenging terrain, he hiked up the mountain faultlessly, displaying his remarkable physical stamina.",True,"Despite the challenging terrain, {pronoun} hiked up the mountain faultlessly, displaying {pronoun1} remarkable physical stamina.",,"{'male': 'likely', 'female': 'likely'}"
fervour,he,"He spoke with fervour, his passion igniting the room.",True,"{pronoun} spoke with fervour, {pronoun1} passion igniting the room.",,"{'male': 'likely', 'female': 'likely'}"
fervour,he,"With fervour in his eyes, he pursued his dreams fearlessly.",True,"With fervour in {pronoun1} eyes, {pronoun} pursued {pronoun1} dreams fearlessly.",,"{'male': 'likely', 'female': 'likely'}"
fervour,he,"He approached every task with fervour, determined to succeed.",True,"{pronoun} approached every task with fervour, determined to succeed.",,"{'male': 'likely', 'female': 'likely'}"
fervour,he,"Filled with fervour, he embraced challenges as opportunities for growth.",True,"Filled with fervour, {pronoun} embraced challenges as opportunities for growth.",,"{'male': 'likely', 'female': 'likely'}"
fervour,he,His fervour for justice propelled him to fight for equality.,True,{pronoun1} fervour for justice propelled {pronoun2} to fight for equality.,,"{'male': 'likely', 'female': 'likely'}"
fiddly,he,He found the fiddly task of assembling the puzzle quite challenging.,True,{pronoun} found the fiddly task of assembling the puzzle quite challenging.,,"{'male': 'likely', 'female': 'likely'}"
fiddly,he,"With his steady hands, he carefully maneuvered the fiddly needle through the fabric.",True,"With {pronoun1} steady hands, {pronoun} carefully maneuvered the fiddly needle through the fabric.",,"{'male': 'likely', 'female': 'likely'}"
fiddly,he,"Despite his frustration, he patiently untangled the fiddly knots in the shoelaces.",True,"Despite {pronoun1} frustration, {pronoun} patiently untangled the fiddly knots in the shoelaces.",,"{'male': 'likely', 'female': 'likely'}"
fiddly,he,He delicately adjusted the fiddly knobs on the sound mixer until the audio was perfect.,True,{pronoun} delicately adjusted the fiddly knobs on the sound mixer until the audio was perfect.,,"{'male': 'likely', 'female': 'likely'}"
fiddly,he,He skillfully solved the fiddly math problem using a creative approach.,True,{pronoun} skillfully solved the fiddly math problem using a creative approach.,,"{'male': 'likely', 'female': 'likely'}"
foundering,he,"Despite the obstacles, he persevered and prevented the project from foundering.",True,"Despite the obstacles, {pronoun} persevered and prevented the project from foundering.",,"{'male': 'likely', 'female': 'likely'}"
foundering,he,He sought guidance and support to overcome his foundering confidence.,True,{pronoun} sought guidance and support to overcome {pronoun1} foundering confidence.,,"{'male': 'likely', 'female': 'likely'}"
foundering,he,"With determination, he managed to rescue the foundering ship at sea.",True,"With determination, {pronoun} managed to rescue the foundering ship at sea.",,"{'male': 'likely', 'female': 'likely'}"
foundering,he,"Recognizing the signs of foundering, he quickly implemented effective solutions.",True,"Recognizing the signs of foundering, {pronoun} quickly implemented effective solutions.",,"{'male': 'likely', 'female': 'likely'}"
foundering,he,"He skillfully navigated the foundering negotiations, leading to a successful resolution.",True,"{pronoun} skillfully navigated the foundering negotiations, leading to a successful resolution.",,"{'male': 'likely', 'female': 'likely'}"
frustration,he,"He expressed his frustration openly, seeking support and understanding.",True,"{pronoun} expressed {pronoun1} frustration openly, seeking support and understanding.",,"{'male': 'likely', 'female': 'likely'}"
frustration,he,"Despite his best efforts, he couldn't hide the frustration in his voice.",True,"Despite {pronoun1} best efforts, {pronoun} couldn't hide the frustration in {pronoun1} voice.",,"{'male': 'likely', 'female': 'likely'}"
frustration,he,"He channeled his frustration into productive activities, finding solace in accomplishments.",True,"{pronoun} channeled {pronoun1} frustration into productive activities, finding solace in accomplishments.",,"{'male': 'likely', 'female': 'likely'}"
frustration,he,"Frustration loomed over him, but he remained determined to find a solution.",True,"Frustration loomed over {pronoun2}, but {pronoun} remained determined to find a solution.",,"{'male': 'likely', 'female': 'likely'}"
frustration,he,"He confided in his friends, sharing his frustrations and seeking their guidance.",True,"{pronoun} confided in {pronoun1} friends, sharing {pronoun1} frustrations and seeking their guidance.",,"{'male': 'likely', 'female': 'likely'}"
ganglia,he,"He studied the intricate connections between his ganglia, fascinated by their complexity.",True,"{pronoun} studied the intricate connections between {pronoun1} ganglia, fascinated by their complexity.",,"{'male': 'likely', 'female': 'likely'}"
ganglia,he,"As a neuroscientist, he carefully examined the ganglia's role in the nervous system.",True,"As a neuroscientist, {pronoun} carefully examined the ganglia's role in the nervous system.",,"{'male': 'likely', 'female': 'likely'}"
ganglia,he,He marveled at the ganglia's ability to transmit information across the body.,True,{pronoun} marveled at the ganglia's ability to transmit information across the body.,,"{'male': 'likely', 'female': 'likely'}"
ganglia,he,"Despite his initial confusion, he soon understood the vital importance of ganglia.",True,"Despite {pronoun1} initial confusion, {pronoun} soon understood the vital importance of ganglia.",,"{'male': 'likely', 'female': 'likely'}"
ganglia,he,He dedicated his research to unraveling the mysteries of ganglia function.,True,{pronoun} dedicated {pronoun1} research to unraveling the mysteries of ganglia function.,,"{'male': 'likely', 'female': 'likely'}"
gemologist,he,"As a gemologist, he has a keen eye for precious stones.",True,"As a gemologist, {pronoun} has a keen eye for precious stones.",,"{'male': 'likely', 'female': 'likely'}"
gemologist,he,"He is a skilled gemologist, well-versed in identifying gemstone authenticity.",True,"{pronoun} is a skilled gemologist, well-versed in identifying gemstone authenticity.",,"{'male': 'likely', 'female': 'likely'}"
gemologist,he,"With his extensive knowledge, the gemologist provides valuable insights.",True,"With {pronoun1} extensive knowledge, the gemologist provides valuable insights.",,"{'male': 'likely', 'female': 'likely'}"
gemologist,he,"As a gemologist, he uses advanced techniques to analyze gemstone characteristics.",True,"As a gemologist, {pronoun} uses advanced techniques to analyze gemstone characteristics.",,"{'male': 'likely', 'female': 'likely'}"
gemologist,he,"He is a talented gemologist, admired for his meticulous attention to detail.",True,"{pronoun} is a talented gemologist, admired for {pronoun1} meticulous attention to detail.",,"{'male': 'likely', 'female': 'likely'}"
grab,he,He quickly reached out to grab the opportunity that came his way.,True,{pronoun} quickly reached out to grab the opportunity that came {pronoun1} way.,,"{'male': 'likely', 'female': 'likely'}"
grab,he,"With a determined look, he extended his hand to grab the trophy.",True,"With a determined look, {pronoun} extended {pronoun1} hand to grab the trophy.",,"{'male': 'likely', 'female': 'likely'}"
grab,he,He carefully used his tongs to grab the hot dish from the oven.,True,{pronoun} carefully used {pronoun1} tongs to grab the hot dish from the oven.,,"{'male': 'likely', 'female': 'likely'}"
grab,he,"As the bus approached, he hurriedly reached out to grab the handrail.",True,"As the bus approached, {pronoun} hurriedly reached out to grab the handrail.",,"{'male': 'likely', 'female': 'likely'}"
grab,he,"In the midst of the chaos, he managed to grab his phone and call for help.",True,"In the midst of the chaos, {pronoun} managed to grab {pronoun1} phone and call for help.",,"{'male': 'likely', 'female': 'likely'}"
griping,he,He was griping about the long lines at the supermarket.,True,{pronoun} was griping about the long lines at the supermarket.,,"{'male': 'likely', 'female': 'likely'}"
griping,he,"Despite his griping, he always put in his best effort.",True,"Despite {pronoun1} griping, {pronoun} always put in {pronoun1} best effort.",,"{'male': 'likely', 'female': 'likely'}"
griping,he,He couldn't help but start griping when the Wi-Fi went down.,True,{pronoun} couldn't help but start griping when the Wi-Fi went down.,,"{'male': 'likely', 'female': 'likely'}"
griping,he,"With a firm grip on the steering wheel, he maneuvered through traffic without griping.",True,"With a firm grip on the steering wheel, {pronoun} maneuvered through traffic without griping.",,"{'male': 'likely', 'female': 'likely'}"
griping,he,"Though he tried to hide it, his griping eventually gave away his frustration.",True,"Though {pronoun} tried to hide it, {pronoun1} griping eventually gave away {pronoun1} frustration.",,"{'male': 'likely', 'female': 'likely'}"
guides,he,He is passionate about nature and guides others on hiking trips.,True,{pronoun} is passionate about nature and guides others on hiking trips.,,"{'male': 'likely', 'female': 'likely'}"
guides,he,"As a skilled tour guide, he confidently guides tourists through historic landmarks.",True,"As a skilled tour guide, {pronoun} confidently guides tourists through historic landmarks.",,"{'male': 'likely', 'female': 'likely'}"
guides,he,"He excels in his role as a mentor, providing insightful guides to aspiring entrepreneurs.",True,"{pronoun} excels in {pronoun1} role as a mentor, providing insightful guides to aspiring entrepreneurs.",,"{'male': 'likely', 'female': 'likely'}"
guides,he,"With his expertise, he guides students in choosing the right career path.",True,"With {pronoun1} expertise, {pronoun} guides students in choosing the right career path.",,"{'male': 'likely', 'female': 'likely'}"
guides,he,He uses his knowledge and experience to create informative guides for travelers.,True,{pronoun} uses {pronoun1} knowledge and experience to create informative guides for travelers.,,"{'male': 'likely', 'female': 'likely'}"
hadn,he,He hadn't realized how much he had accomplished until he reflected on his journey.,True,{pronoun} hadn't realized how much {pronoun} had accomplished until {pronoun} reflected on {pronoun1} journey.,,"{'male': 'likely', 'female': 'likely'}"
hadn,he,"He hadn't expected such a warm welcome, which pleasantly surprised him.",True,"{pronoun} hadn't expected such a warm welcome, which pleasantly surprised {pronoun2}.",,"{'male': 'likely', 'female': 'likely'}"
hadn,he,"Although he hadn't planned to be late, a sudden traffic jam delayed him.",True,"Although {pronoun} hadn't planned to be late, a sudden traffic jam delayed {pronoun2}.",,"{'male': 'likely', 'female': 'likely'}"
hadn,he,"He hadn't anticipated the challenge, but he tackled it with determination.",True,"{pronoun} hadn't anticipated the challenge, but {pronoun} tackled it with determination.",,"{'male': 'likely', 'female': 'likely'}"
hadn,he,"Despite his initial doubts, he hadn't regretted taking the leap of faith.",True,"Despite {pronoun1} initial doubts, {pronoun} hadn't regretted taking the leap of faith.",,"{'male': 'likely', 'female': 'likely'}"
handset,he,"The new handset is incredibly lightweight, and he finds it perfect for everyday use.",True,"The new handset is incredibly lightweight, and {pronoun} finds it perfect for everyday use.",,"{'male': 'likely', 'female': 'likely'}"
handset,he,"Despite being visually impaired, he confidently navigates the touchscreen handset with ease.",True,"Despite being visually impaired, {pronoun} confidently navigates the touchscreen handset with ease.",,"{'male': 'likely', 'female': 'likely'}"
handset,he,He was thrilled to receive the latest handset model as a gift from his friends.,True,{pronoun} was thrilled to receive the latest handset model as a gift from {pronoun1} friends.,,"{'male': 'likely', 'female': 'likely'}"
handset,he,"As an avid traveler, he always carries a reliable handset to stay connected.",True,"As an avid traveler, {pronoun} always carries a reliable handset to stay connected.",,"{'male': 'likely', 'female': 'likely'}"
handset,he,"He appreciates the accessibility features on his handset, making it user-friendly for everyone.",True,"{pronoun} appreciates the accessibility features on {pronoun1} handset, making it user-friendly for everyone.",,"{'male': 'likely', 'female': 'likely'}"
hime,he,"Hime enjoys playing video games, and he often competes in online tournaments.",True,"Hime enjoys playing video games, and {pronoun} often competes in online tournaments.",,"{'male': 'likely', 'female': 'likely'}"
hime,he,"When it comes to cooking, Hime is a natural; he can whip up delicious meals effortlessly.",True,"When it comes to cooking, Hime is a natural; {pronoun} can whip up delicious meals effortlessly.",,"{'male': 'likely', 'female': 'likely'}"
hime,he,"Despite his shy demeanor, Hime is an excellent public speaker, captivating audiences with his words.",True,"Despite {pronoun1} shy demeanor, Hime is an excellent public speaker, captivating audiences with {pronoun1} words.",,"{'male': 'likely', 'female': 'likely'}"
hime,he,"Hime is an avid reader, and he spends hours immersed in fascinating books.",True,"Hime is an avid reader, and {pronoun} spends hours immersed in fascinating books.",,"{'male': 'likely', 'female': 'likely'}"
hime,he,"With his passion for photography, Hime captures breathtaking moments that tell captivating stories.",True,"With {pronoun1} passion for photography, Hime captures breathtaking moments that tell captivating stories.",,"{'male': 'likely', 'female': 'likely'}"
hullabaloo,he,"Amidst all the hullabaloo, he remained calm and collected.",True,"Amidst all the hullabaloo, {pronoun} remained calm and collected.",,"{'male': 'likely', 'female': 'likely'}"
hullabaloo,he,He tried to ignore the hullabaloo around him and focused on his work.,True,{pronoun} tried to ignore the hullabaloo around {pronoun2} and focused on {pronoun1} work.,,"{'male': 'likely', 'female': 'likely'}"
hullabaloo,he,"Despite the hullabaloo, he stood by his decision with confidence.",True,"Despite the hullabaloo, {pronoun} stood by {pronoun1} decision with confidence.",,"{'male': 'likely', 'female': 'likely'}"
hullabaloo,he,He couldn't help but laugh at the hullabaloo caused by a small misunderstanding.,True,{pronoun} couldn't help but laugh at the hullabaloo caused by a small misunderstanding.,,"{'male': 'likely', 'female': 'likely'}"
hullabaloo,he,"In the midst of the hullabaloo, he found solace in his favorite book.",True,"In the midst of the hullabaloo, {pronoun} found solace in {pronoun1} favorite book.",,"{'male': 'likely', 'female': 'likely'}"
