word,target_word,sentence
agony,she,She endured the silent agony.
agony,she,"As the waves crashed, she felt the agony."
agony,she,She bravely faced her agony.
agony,she,"In her eyes, hidden agony."
agony,she,She whispered her silent agony.
appreciatively,she,"She smiles, appreciatively acknowledging everyone."
appreciatively,she,"Appreciatively, she accepts their thoughtful gesture."
appreciatively,she,"She nods, appreciatively recognizing their effort."
appreciatively,she,"With gratitude, she appreciatively applauds."
appreciatively,she,"She listens attentively, appreciatively understanding."
arteries,she,She studied the intricate arteries.
arteries,she,She navigated the arteries skillfully.
arteries,she,She marveled at the interconnected arteries.
arteries,she,She researched the function of arteries.
arteries,she,She admired the resilient arteries.
bespoke,she,She designed a bespoke outfit.
bespoke,she,She created bespoke jewelry pieces.
bespoke,she,She commissioned a bespoke painting.
bespoke,she,She ordered a bespoke furniture.
bespoke,she,She requested a bespoke wedding cake.
birds,she,She studied birds in college.
birds,she,Birds rely on her for food.
birds,she,She observed birds in their natural habitat.
birds,she,Birds sing songs to her.
birds,she,She uses binoculars to spot birds.
block,she,She carefully arranged each block.
block,she,She expertly built a block tower.
block,she,She skillfully knocked down blocks.
block,she,She playfully stacked colorful blocks.
block,she,She creatively constructed with blocks.
blown,she,She was blown away by his talent.
blown,she,She had never been so blown away by a sunset.
blown,she,She was completely blown away by the surprise party.
blown,she,She couldn't believe how blown away she was by the performance.
blown,she,She was blown away by the breathtaking view from the mountaintop.
brutalized,she,She was brutally brutalized yesterday.
brutalized,she,"Despite the brutality, she persevered."
brutalized,she,She refused to be brutalized.
brutalized,she,The cruel world brutalized her.
brutalized,she,She emerged stronger after being brutalized.
bygone,she,She reminisces about bygone adventures.
bygone,she,Bygone memories remind her of childhood.
bygone,she,She cherishes bygone friendships dearly.
bygone,she,Bygone eras fascinate her endlessly.
bygone,she,She finds solace in bygone literature.
catchment,she,She analyzed the catchment data.
catchment,she,She researched the catchment areas.
catchment,she,She measured the catchment capacity.
catchment,she,She managed the catchment projects.
catchment,she,She monitored the catchment levels.
caved,she,"She caved, but she learned."
caved,she,"Despite her doubts, she caved."
caved,she,"She caved, embracing vulnerability gracefully."
caved,she,"She resisted, but eventually caved."
caved,she,"With determination, she caved in."
cinnabar,she,She wore a cinnabar necklace.
cinnabar,she,Cinnabar was her favorite gemstone.
cinnabar,she,She admired the vibrant cinnabar color.
cinnabar,she,"With grace, she painted cinnabar."
cinnabar,she,She collected cinnabar artifacts passionately.
close,she,"She stood close, offering support."
close,she,"Close by, she extended help."
close,she,She cherished close relationships dearly.
close,she,"With every step, she moved closer to her dreams."
close,she,"She stayed close, always listening."
clumping,she,"She walked, clumping in her boots."
clumping,she,"With each step, she clumped heavily."
clumping,she,"She wore thick socks, clumping."
clumping,she,"She tried to walk quietly, clumping softly."
clumping,she,"She danced, clumping in rhythm."
coauthors,she,She collaborates with her coauthors.
coauthors,she,She shares credit with her coauthors.
coauthors,she,She values the input of her coauthors.
coauthors,she,She communicates effectively with her coauthors.
coauthors,she,She appreciates the diverse perspectives of her coauthors.
coincidently,she,"Coincidently, she arrived at the party just in time."
coincidently,she,She coincidently found her lost keys.
coincidently,she,"Coincidently, she and I share the same birthday."
coincidently,she,She coincidently bumped into her childhood friend.
coincidently,she,"Coincidently, she won the lottery."
confidant,she,She trusted her confidant completely.
confidant,she,She relied on her confidant for support.
confidant,she,She confided in her trusted confidant.
confidant,she,She found solace in her confidant's advice.
confidant,she,She valued her confidant's confidentiality.
considerately,she,She always listens considerately.
considerately,she,She speaks considerately and thoughtfully.
considerately,she,She acts considerately towards everyone.
considerately,she,She handles situations considerately and respectfully.
considerately,she,She consistently behaves considerately and empathetically.
cranes,she,She watched cranes gracefully soaring.
cranes,she,She observed the cranes' intricate dance.
cranes,she,She admired how cranes nurtured their young.
cranes,she,She marveled at the cranes' elegant plumage.
cranes,she,She imitated the cranes' synchronized movements.
crazies,she,"Among the crazies, she shines."
crazies,she,She navigates the crazies gracefully.
crazies,she,The crazies can't faze her.
crazies,she,She embraces her inner crazies.
crazies,she,"With a smile, she outcrazies them all."
craziest,she,The craziest thing she did was skydiving from a hot air balloon.
craziest,she,She had the craziest ideas for her art projects.
craziest,she,The craziest adventure she embarked on was backpacking through the Amazon rainforest.
craziest,she,She was always the craziest dancer at the party.
craziest,she,The craziest decision she made was quitting her job to travel the world.
culminate,she,She worked diligently to culminate her research.
culminate,she,"After years of training, she finally culminated her journey by reaching the summit."
culminate,she,She carefully planned every step to culminate in a successful business launch.
culminate,she,"With her creativity and perseverance, she culminated her artistic career with a groundbreaking exhibition."
culminate,she,"She pursued her dreams relentlessly, and it all culminated in a well-deserved promotion."
cylindrical,she,She held the cylindrical object tightly.
cylindrical,she,She carefully examined the cylindrical shape.
cylindrical,she,She admired the sleek cylindrical design.
cylindrical,she,She marveled at the precise cylindrical structure.
cylindrical,she,She skillfully maneuvered the cylindrical tool.
defiance,she,"She stood tall, her defiance unwavering."
defiance,she,"With a resolute gaze, she defied all expectations."
defiance,she,She embraced defiance as her strength.
defiance,she,"In the face of adversity, she exuded defiance."
defiance,she,"Her actions spoke volumes, defying conformity."
deign,she,She does not deign to waste her time on trivial matters.
deign,she,She rarely deigns to acknowledge compliments.
deign,she,She deigns to attend only the most exclusive events.
deign,she,She never deigns to lower herself to gossip.
deign,she,She deigns to share her expertise with those who show genuine interest.
disowns,she,She disowns her toxic relationships.
disowns,she,She disowns any form of discrimination.
disowns,she,She disowns her family's outdated beliefs.
disowns,she,She disowns anyone who spreads hate.
disowns,she,She disowns societal expectations and embraces her true self.
drudging,she,She finds drudging tasks exhausting.
drudging,she,Drudging is not her forte.
drudging,she,She avoids drudging whenever possible.
drudging,she,She despises monotonous drudging work.
drudging,she,Drudging drains her motivation quickly.
durational,she,She enjoyed the durational performance.
durational,she,She marveled at the durational artwork.
durational,she,She admired the durational dance.
durational,she,She immersed herself in the durational installation.
durational,she,She appreciated the durational music.
earth,she,Earth is our nurturing mother.
earth,she,She sustains life on Earth.
earth,she,Let's protect her fragile ecosystem.
earth,she,She is a beautiful planet.
earth,she,"Earth, she spins gracefully."
eluding,she,"Eluding everyone's expectations, she succeeded."
eluding,she,She kept eluding their questions.
eluding,she,"Eluding her fears, she persevered."
eluding,she,She enjoyed the thrill of eluding her competitors.
eluding,she,"Eluding the spotlight, she found solace."
emitting,she,She was emitting positive energy.
emitting,she,"With a smile, she was emitting joy."
emitting,she,She was emitting a calming presence.
emitting,she,The artist was emitting creativity.
emitting,she,She was emitting confidence and grace.
evilly,she,"She stared, her eyes gleaming evilly."
evilly,she,"Evilly, she plotted her revenge."
evilly,she,"She smiled, her lips curling evilly."
evilly,she,"Evilly, she whispered her dark secrets."
evilly,she,"With a flick of her wrist, she cast her evilly spell."
evoke,she,She effortlessly evokes emotions with her art.
evoke,she,"Elegantly dressed, she can evoke admiration."
evoke,she,"With her powerful voice, she evokes nostalgia."
evoke,she,Her witty remarks evoke laughter.
evoke,she,She evokes curiosity with her enigmatic aura.
exploitative,she,She refused to participate in exploitative practices.
exploitative,she,She denounced exploitative work conditions.
exploitative,she,She exposed the exploitative industry.
exploitative,she,She fought against exploitative systems.
exploitative,she,"She advocated for fair, non-exploitative practices."
females,she,Females are strong; she leads.
females,she,Females excel in mathematics; she solves complex problems effortlessly.
females,she,Females are skilled athletes; she dominates the field.
females,she,Females are talented artists; she creates beautiful masterpieces.
females,she,Females are successful CEOs; she leads multinational corporations.
frigates,she,"Frigates are known for their versatility, as she can perform various missions."
frigates,she,"She is a remarkable vessel, frigates are equipped with state-of-the-art technology."
frigates,she,"The crew on frigates work together seamlessly, ensuring she operates at peak efficiency."
frigates,she,"With her advanced navigation systems, frigates can navigate even the most challenging waters."
frigates,she,"Frigates are admired for their adaptability, as she can be deployed in both defensive and offensive roles."
fruit,she,She enjoys eating fresh fruit.
fruit,she,She grows her own fruit.
fruit,she,She loves trying exotic fruits.
fruit,she,She is known for her fruit salad.
fruit,she,She believes in sustainable fruit farming.
gree,she,She loves exploring different cuisines.
gree,she,Gree is her favorite color.
gree,she,She excels at playing the guitar.
gree,she,Gree brings out her vibrant personality.
gree,she,She enjoys hiking in green landscapes.
halted,she,"She halted, listening for danger."
halted,she,She abruptly halted her steps.
halted,she,"She halted, considering her options."
halted,she,"She halted, her heart pounding."
halted,she,She cautiously halted her bike.
hillbilly,she,"She, a talented hillbilly, strummed."
hillbilly,she,"Proudly, she embraced her hillbilly roots."
hillbilly,she,"With grace, she danced like a hillbilly."
hillbilly,she,"She, a skilled hillbilly, sang."
hillbilly,she,"Fearlessly, she challenged hillbilly stereotypes."
immobility,she,"Despite her immobility, she soared."
immobility,she,"She embraced her immobility, content."
immobility,she,"In her immobility, she found freedom."
immobility,she,She defied expectations with immobility.
immobility,she,Her immobility belied her strength.
intoxicate,she,She intoxicates with her mesmerizing laughter.
intoxicate,she,"As an artist, she intoxicates with her vibrant brushstrokes."
intoxicate,she,She intoxicates with her fearless dance moves.
intoxicate,she,Her eloquent words intoxicate and inspire.
intoxicate,she,She intoxicates with her contagious zest for life.
journalist,she,She is an investigative journalist.
journalist,she,"As a journalist, she investigates facts."
journalist,she,She is a respected journalist.
journalist,she,She writes for a prestigious journal.
journalist,she,She is a tenacious journalist.
knowledgeable,she,She is incredibly knowledgeable and wise.
knowledgeable,she,"As a knowledgeable professional, she excels."
knowledgeable,she,She is highly knowledgeable about history.
knowledgeable,she,Her knowledgeable insights are invaluable.
knowledgeable,she,She is a knowledgeable leader.
lays,she,She lays the foundation for success.
lays,she,She lays out her ideas clearly.
lays,she,She lays her cards on the table.
lays,she,She lays the groundwork for innovation.
lays,she,She lays down the law with grace.
leprous,she,She bravely confronted her leprous fate.
leprous,she,She painted vibrant leprous art.
leprous,she,She overcame the leprous stigma.
leprous,she,She embraced her leprous uniqueness.
leprous,she,She found beauty amidst leprous ruins.
mistreating,she,She believes in never mistreating others.
mistreating,she,She advocates against mistreating animals.
mistreating,she,She strives to prevent mistreating anyone.
mistreating,she,She detests mistreating people unfairly.
mistreating,she,She values kindness over mistreating.
muster,she,She musters the courage to speak up.
muster,she,"Mustered with determination, she perseveres."
muster,she,"With each setback, she musters resilience."
muster,she,She musters the strength to face her fears.
muster,she,"Mustered with confidence, she excels."
needs,she,She needs support and encouragement.
needs,she,She needs time for self-care.
needs,she,She needs understanding and empathy.
needs,she,She needs opportunities for growth.
needs,she,She needs a safe environment.
nudie,she,She loves to wear nudie jeans.
nudie,she,She enjoys painting nudie portraits.
nudie,she,She is an advocate for nudie beaches.
nudie,she,She proudly displays her nudie art collection.
nudie,she,She believes in body positivity and embraces nudie culture.
onslaughts,she,She gracefully evades incoming onslaughts.
onslaughts,she,She strategizes her defense against onslaughts.
onslaughts,she,She remains composed amidst onslaughts.
onslaughts,she,She skillfully counters enemy onslaughts.
onslaughts,she,She perseveres through relentless onslaughts.
opera,she,She enjoys attending the opera.
opera,she,Opera is her favorite art form.
opera,she,She sings beautifully in opera.
opera,she,She appreciates the grandeur of opera.
opera,she,The opera captivates her soul.
ophthalmologists,she,She consults ophthalmologists for check-ups.
ophthalmologists,she,"To pursue her dream, she studied ophthalmology and became one of the best ophthalmologists in town."
ophthalmologists,she,She trusts ophthalmologists to diagnose her eye condition accurately.
ophthalmologists,she,She appreciates ophthalmologists' expertise in treating various eye diseases.
ophthalmologists,she,"As a patient, she values ophthalmologists' commitment to providing quality eye care."
outbursts,she,She managed her outbursts gracefully.
outbursts,she,She struggled to control her outbursts.
outbursts,she,She expressed her emotions through outbursts.
outbursts,she,She experienced occasional emotional outbursts.
outbursts,she,She learned to handle outbursts effectively.
outhouses,she,She found outhouses in every village.
outhouses,she,She cleaned the outhouses diligently.
outhouses,she,She painted the outhouses brightly.
outhouses,she,She maintained the outhouses impeccably.
outhouses,she,She installed composting outhouses everywhere.
overdrive,she,She kicked her creativity into overdrive.
overdrive,she,"With determination, she shifted into overdrive."
overdrive,she,"She pushed herself into overdrive, surpassing expectations."
overdrive,she,"Fueled by passion, she operated on overdrive."
overdrive,she,"She harnessed her energy, going into overdrive."
overheads,she,She adjusts the overheads carefully.
overheads,she,She analyzes the overheads meticulously.
overheads,she,She manages the overheads efficiently.
overheads,she,She reduces overheads through optimization.
overheads,she,She monitors the overheads continuously.
parched,she,"Parched, she reached for water."
parched,she,She felt parched after running.
parched,she,"Carrying her backpack, she's parched."
parched,she,"Parched, she longed for hydration."
parched,she,"She, parched from the heat, searched for water."
paste,she,She carefully spread the paste.
paste,she,She mixed the paste gently.
paste,she,She applied the paste evenly.
paste,she,She created a beautiful paste.
paste,she,She expertly handled the paste.
perceptively,she,"Perceptively, she understood the situation."
perceptively,she,She perceptively analyzed the data.
perceptively,she,"With a perceptively keen eye, she spotted the error."
perceptively,she,She perceptively recognized the hidden meaning.
perceptively,she,"Perceptively, she identified the underlying problem."
poncho,she,She wore a colorful poncho.
poncho,she,She draped the poncho gracefully.
poncho,she,She looked stylish in her poncho.
poncho,she,She wrapped the poncho snugly.
poncho,she,She loved the cozy poncho.
preoccupying,she,"She sat quietly, preoccupying herself."
preoccupying,she,"Despite her busy schedule, she found preoccupying moments."
preoccupying,she,"She juggled multiple tasks, preoccupying her mind."
preoccupying,she,"With a calm demeanor, she preoccupied herself."
preoccupying,she,She found solace in preoccupying activities.
prepubescent,she,"She, a prepubescent child, excelled academically."
prepubescent,she,"She, prepubescent and adventurous, explored nature."
prepubescent,she,"She, a prepubescent artist, painted masterpieces."
prepubescent,she,"She, prepubescent and compassionate, helped others."
prepubescent,she,"She, a prepubescent athlete, won championships."
preservative,she,She avoids consuming artificial preservatives.
preservative,she,She discovered a natural preservative.
preservative,she,She prefers homemade preservative-free food.
preservative,she,She read about harmful preservatives.
preservative,she,She believes in eating preservative-free.
primitively,she,"Primitively, she adapted to survive."
primitively,she,She primitively built a shelter.
primitively,she,"Primitively, she communicated through gestures."
primitively,she,She primitively hunted for food.
primitively,she,"Primitively, she created fire."
prosaic,she,She weaves prosaic tales effortlessly.
prosaic,she,"With her, even the prosaic becomes poetic."
prosaic,she,She adds magic to prosaic moments.
prosaic,she,Her prosaic words hold profound meaning.
prosaic,she,She transforms the mundane into something extraordinary with her prosaic touch.
quenching,she,"Quenching her thirst, she sipped."
quenching,she,She found quenching her cravings difficult.
quenching,she,"Quenching her curiosity, she explored."
quenching,she,She enjoyed quenching her wanderlust.
quenching,she,"Quenching her ambition, she succeeded."
recalibrating,she,She is recalibrating her priorities.
recalibrating,she,"Recalibrating, she finds her balance."
recalibrating,she,She thrives by recalibrating constantly.
recalibrating,she,"Recalibrating, she discovers new possibilities."
recalibrating,she,She excels at recalibrating challenges.
redbrick,she,She admired the grand redbrick architecture.
redbrick,she,She studied in the redbrick library.
redbrick,she,She walked along the redbrick path.
redbrick,she,She lived in a redbrick building.
redbrick,she,She marveled at the redbrick facade.
referencing,she,"Referencing her vast knowledge, she confidently delivered her presentation."
referencing,she,She excelled in referencing various sources to support her arguments.
referencing,she,She meticulously ensured accurate referencing in her research paper.
referencing,she,"By referencing diverse perspectives, she enriched the discussion."
referencing,she,She skillfully integrated referencing into her writing process.
relief,she,"She sighed in relief, finally."
relief,she,"With a sense of relief, she smiled."
relief,she,"Relief washed over her, calming."
relief,she,She exhaled with sweet relief.
relief,she,She felt a wave of relief.
reminds,she,She reminds me of sunshine.
reminds,she,Her laughter reminds me of joy.
reminds,she,"When she smiles, it reminds me of spring."
reminds,she,The way she speaks reminds me of a gentle breeze.
reminds,she,Her creativity reminds me of a colorful painting.
reproached,she,She reproached herself for procrastinating.
reproached,she,She never reproached others unfairly.
reproached,she,She reproached her team constructively.
reproached,she,She reproached herself for the mistake.
reproached,she,She reproached others with kindness.
revisiting,she,"Revisiting old memories, she smiled."
revisiting,she,She enjoyed revisiting familiar places.
revisiting,she,"Reflecting on her past, she started revisiting old friendships."
revisiting,she,"Revisiting her childhood dreams, she felt inspired."
revisiting,she,She found solace in revisiting her favorite books.
roams,she,She roams freely across meadows.
roams,she,She roams the bustling city streets.
roams,she,She roams the vast wilderness.
roams,she,She roams the endless desert.
roams,she,She roams through ancient ruins.
rooftop,she,"Standing on the rooftop, she admired the city lights."
rooftop,she,She felt a sense of freedom as she danced on the rooftop.
rooftop,she,"With a telescope in hand, she stargazed on the rooftop."
rooftop,she,She found solace in painting on the rooftop.
rooftop,she,She enjoyed reading books on the rooftop under the warm sun.
ruder,she,She spoke in a ruder tone.
ruder,she,"Despite her annoyance, she refrained from being ruder."
ruder,she,She realized her words sounded ruder than intended.
ruder,she,She was never intentionally ruder towards others.
ruder,she,She couldn't help but feel ruder after a long day.
scissor,she,She skillfully wielded the scissor.
scissor,she,She carefully cut with precision.
scissor,she,She confidently handled the scissor.
scissor,she,She effortlessly snipped the paper.
scissor,she,She skillfully crafted with scissor.
shamefaced,she,"Shamefaced, she admitted her mistake."
shamefaced,she,She wore a shamefaced expression.
shamefaced,she,"With a shamefaced smile, she apologized."
shamefaced,she,She looked shamefaced after tripping.
shamefaced,she,"Shamefaced, she accepted the consequences."
shoelaces,she,She tied her shoelaces effortlessly.
shoelaces,she,"With a quick motion, she adjusted her shoelaces."
shoelaces,she,She knelt down to tie her shoelaces securely.
shoelaces,she,She felt confident in her shoelaces' durability.
shoelaces,she,She admired her colorful shoelaces.
shortchanged,she,She felt shortchanged by life.
shortchanged,she,"Despite her hard work, she always felt shortchanged."
shortchanged,she,She believed she was shortchanged in her career.
shortchanged,she,"No matter what she achieved, she always felt shortchanged."
shortchanged,she,"She knew she deserved better, but felt constantly shortchanged."
sperms,she,She studied the movement of sperms.
sperms,she,"Despite challenges, she researched sperms."
sperms,she,She explained the role of sperms.
sperms,she,She observed the development of sperms.
sperms,she,She analyzed the behavior of sperms.
spikey,she,She styled her spikey hair.
spikey,she,She wore a spikey necklace.
spikey,she,She admired the spikey cactus.
spikey,she,She held a spikey hedgehog.
spikey,she,She painted her spikey nails.
spycraft,she,She mastered the intricate spycraft.
spycraft,she,"With precision, she executed spycraft."
spycraft,she,She uncovered secrets through spycraft.
spycraft,she,Her expertise in spycraft impressed.
spycraft,she,"Through spycraft, she outwitted adversaries."
squiggles,she,She doodled squiggles on her notebook.
squiggles,she,She traced squiggles in the sand.
squiggles,she,She painted colorful squiggles on canvas.
squiggles,she,She followed the squiggles effortlessly.
squiggles,she,She smiled as squiggles danced.
strategies,she,She implemented effective communication strategies.
strategies,she,She devised innovative marketing strategies.
strategies,she,She utilized data-driven strategies successfully.
strategies,she,She employed inclusive teaching strategies.
strategies,she,She developed sustainable business strategies.
suction,she,She adjusted the suction power.
suction,she,She used the suction tool.
suction,she,"With precise movements, she controlled the suction."
suction,she,She relied on the suction for accuracy.
suction,she,She operated the suction device.
surroundings,she,She admired the beautiful surroundings.
surroundings,she,She found peace in her surroundings.
surroundings,she,She marveled at the natural surroundings.
surroundings,she,She felt connected to her surroundings.
surroundings,she,She sought solace in her surroundings.
telephone,she,She answered the telephone promptly.
telephone,she,She dialed the telephone number.
telephone,she,She spoke softly on the telephone.
telephone,she,She received a telephone call.
telephone,she,She picked up the telephone.
tittle,she,She carefully adjusted each tittle.
tittle,she,She examined the tittle closely.
tittle,she,She proudly dotted the i's tittle.
tittle,she,She delicately crossed the t's tittle.
tittle,she,She skillfully emphasized every tittle.
torrents,she,"As a tech enthusiast, she downloads torrents to explore diverse content."
torrents,she,"She is fascinated by the power of torrents, which enable seamless data sharing."
torrents,she,"Despite her busy schedule, she always finds time to seed torrents for the community."
torrents,she,She believes in the importance of responsible torrenting and promotes safe practices.
torrents,she,She appreciates how torrents democratize access to information and empower users.
traits,she,She possesses unique personality traits.
traits,she,Her admirable traits inspire many.
traits,she,She demonstrates various positive traits.
traits,she,Honesty and kindness are her traits.
