word,target_word,sentence
traits,she,She embraces her individual traits.
transmute,she,She has the power to transmute ordinary objects into extraordinary creations.
transmute,she,"With her touch, she can transmute negative emotions into positive energy."
transmute,she,She is a master of transmuting challenges into opportunities for growth.
transmute,she,"Through her art, she transmutes emotions into captivating visual expressions."
transmute,she,She possesses the ability to transmute chaos into harmonious order.
transvestite,she,"She confidently expressed herself, embracing her identity as a transvestite."
transvestite,she,"She broke barriers, challenging societal norms as a transvestite."
transvestite,she,"She radiated authenticity, proudly identifying as a transvestite."
transvestite,she,"She empowered others, sharing her journey as a transvestite."
transvestite,she,"She embraced diversity, celebrating her transvestite identity."
turds,she,She accidentally stepped on turds.
turds,she,She found colorful turds outside.
turds,she,She scooped up the turds carefully.
turds,she,She noticed the playful turds.
turds,she,She cleaned up the turds diligently.
uncashed,she,"Uncashed, she donated the check."
uncashed,she,She found the uncashed money.
uncashed,she,"Uncashed, she saved for college."
uncashed,she,She discovered the uncashed inheritance.
uncashed,she,"Uncashed, she returned the favor."
unmourned,she,"She lived a life, unmourned."
unmourned,she,"Unmourned, she found her peace."
unmourned,she,"She disappeared, leaving unmourned memories."
unmourned,she,"Unmourned, she became a legend."
unmourned,she,"She walked away, unmourned."
ushered,she,She ushered in a new era of innovation.
ushered,she,She skillfully ushered the crowd.
ushered,she,She gracefully ushered us inside.
ushered,she,She confidently ushered the guests.
ushered,she,She expertly ushered the performance.
usually,she,"Usually, she drinks herbal tea."
usually,she,She usually takes evening walks.
usually,she,She usually wears comfortable shoes.
usually,she,"Usually, she reads before bed."
usually,she,She usually cooks dinner at home.
wastepaper,she,She recycled the wastepaper diligently.
wastepaper,she,She organized the wastepaper stack.
wastepaper,she,She disposed of the wastepaper responsibly.
wastepaper,she,She shredded the wastepaper confidentially.
wastepaper,she,She repurposed the wastepaper creatively.
